"number","title","artist","album","album_release_date","release_date","pageviews","word_count","line_count","featured_artists","genius_url","genius_id","lyrics"
"35","Rushes","Frank Ocean","Endless","","August 19, 2016","631478","316","49","","https://genius.com/Frank-ocean-rushes-lyrics","2840966","Gonna be somebody, I follow
Running showers, in a mist so cloudy
Enough time to know, know nothing at all
I see the lines (Walls)
There's two lines (Walls)
You'll live a life anew
Tell me what you need from me? Gas money?
And I did what I needed to, yeah
To be kind
Cut your teeth on sheets in Paris
Hope the water's deep enough
It's a rush to the head
We've been here before (He's just like the water)
The first time is not the past time
I ain't felt this way in years

First, I was rushing for a wait
This time, I'm waiting for a rush
(
Oh, help me up off my feet, yeah
)
Infatuation's your rush (
Help me, help me, help me off my feet, yeah
)
(
Do you wish you were me?
)
Keep pushing on 'em, never let 'em stop (Do you wish you were me?)
All what happens to be, now it happens to me
Upon his feet

Twin peaking, highs and lows
We shaded off and on (Up on his feet)
Bygones, but we're still here
Riding in my two wheels
I love the way you make me feel (I'll be up in a week)
Bet you wish you was me?
Might need some help on my feet
Yeah, yeah, yeah, yeah, yeah, I be up to my feet
I'll wake up in a week
Wake me up in a week
(It's like driving 'round, stroke me, suck me, pipe me down)
(Two is a crowd, quieting down)
(Bite me down, pad me down, do whatever to fly me down)

What stays and what—
What's gone and what's here still?
And what's here still?
Riding my two wheels
They're gone and you're still here, ridin'
They're gone and you're still here, riding my two wheels
I love the way you make me feel"
"36","Be Yourself","Frank Ocean","Blonde","","August 20, 2016","617781","163","21","","https://genius.com/Frank-ocean-be-yourself-lyrics","2842088","Many college students have gone to college and gotten hooked on drugs, marijuana, and alcohol
Listen, stop trying to be somebody else
Don't try to be someone else
Be yourself and know that that's good enough
Don't try to be someone else
Don't try to be like someone else, don't try to act like someone else
Be yourself, be secure with yourself
Rely and trust upon your own decisions
On your own beliefs
You understand the things that I've taught you
Not to drink alcohol, not to use drugs
Don't use that cocaine or marijuana, because that stuff is highly addictive
When people become weed-heads
They become sluggish, lazy, stupid, and unconcerned
Sluggish, lazy, stupid, and unconcerned
That's all marijuana does to you, okay? This is mom
Unless you're taking it under doctor's, um, control
Then it's regulated
Do not smoke marijuana, do not consume alcohol
Do not get in the car with someone who is inebriated
This is mom, call me, bye"
"37","we all try","Frank Ocean","nostalgia,ULTRA.","","February 16, 2011","614200","294","42","","https://genius.com/Frank-ocean-we-all-try-lyrics","4619","I believe Jehovah Jireh
I believe there's heaven, I believe in war
I believe a woman's temple
Gives her the right to choose, but baby, don't abort
I believe that marriage isn't
Between a man and woman, but between love and love
And I believe you when you say that you've lost all faith

But you must believe in something, something, something
You gotta believe in something, something, something

I still believe in man
A wise one asked me why
'Cause I just don't believe we're wicked
I know that we sin, but I do believe we try
We all try, the girls try, the boys try
Women try, men try
You and I try, try
We all try

I don't believe in time travel
I don't believe our nation's flag is on the moon
I don't believe our lives are simple
And I don't believe they're short, this is interlude
I don't believe my hands are cleanly
Can't believe that you would let me touch your heart
She didn't believe me when I said that I lost my faith

You must believe in something, something, something
You gotta believe in something, something, something, oh, oh

I still believe in man (Oh, oh)
A wise one asked me why (Oh, oh)
'Cause I just don't believe we're wicked (Wicked)
I know that we sin, but I do believe we try (Try, try)
We all try, the girls try, the boys try
Women try, men try (Every girl tries)
You and I try (Every boy tries), try
We all try

Try to believe
Try (Just try)
Try to believe, try to believe
Try (Just try)
Try to believe, try to believe
Try (Just try)
Try to believe
Oh, I, I do believe, I do believe"
"38","Good Guy","Frank Ocean","Blonde","","August 20, 2016","610060","149","16","","https://genius.com/Frank-ocean-good-guy-lyrics","2842089","Here's to a good guy, he hooked it up
Said if I was in NY, I should look you up
I, first time I'd ever saw you
And you text nothing like you look
Here's to the gay bar you took me to
Here's when I realized you talk so much more than I do
I, here's to the highlights when I was convinced
That this was much more to you than some some-night shit
I know you don't need me right now
And to you, it's just a late night out

Bitches, nigga, all the bitches in the neighborhood wanna fuck you, nigga
(They told me)
I used to fuck with all of 'em
(Yeah, I ain't got bitches no more)
But now, I don't care about bitches like that, my nigga, that shit—
Jasmine fucking wrecked my heart, I don't even know how to feel about bi—"
"39","Open Letter on Tumblr","Frank Ocean","","","July 4, 2012","562399","824","35","","https://genius.com/Frank-ocean-open-letter-on-tumblr-annotated","80479","BASEDGOD WAS RIGHT. we're all a bunch of golden million dollar babies. my hope is that the babies born these days will inherit less of the bullshit than we did. anyhow, what i'm about to post is for anyone who cares to read. it was intended to fill the thank you's section in my album credits, but with all the rumors going round.. I figured it'd be good to clarify..Whoever you are. Wherever you are..

I'm starting to think we're a lot alike. Human beings spinning on blackness.
All wanting to be seen, touched, heard, paid attention to. My loved ones are everything to me here. In the last year or 3 I've screamed at my creator, screamed at clouds in the sky, for some explanation. Mercy maybe. For peace of mind to rain like manna somehow.
4 summers ago, I met somebody.

I was 19 years old. He was too.
We spent that summer, and the summer after, together. Everyday almost. And on the days we were together, time would glide. Most of the day I'd see him, and his smile. I'd hear his conversation and his silence.. until it was time to sleep.
Sleep I would often share with him.
By the time I realized I was in love, it was malignant. It was hopeless. There was no escaping, no negotiating with the feeling. No choice. It was my first love,
it changed my life. Back then, my mind would wander to the women I had been with, the ones I cared for and thought I was in love with.
I reminisced about the sentimental songs I enjoyed when I was a teenager.. The ones I played when I experienced a girlfriend for the first time.
I realized they were written in a language I did not yet speak.
I realized too much, too quickly. Imagine being thrown from a plane. I wasn't in a plane though.
I was in a Nissan Maxima, the same car I packed up with bags and drove to Los Angeles in
. I sat there and told my friend how I felt. I wept as the words left my mouth.
I grieved for them, knowing I could never take them back for myself.
He patted my back. He said kind things.
He did his best, but he wouldn't admit the same. He had to go back inside soon,
it was late and his girlfriend was waiting for him upstairs.
He wouldn't tell the truth about his feelings for me for another 3 years. I felt like I'd only imagined reciprocity for years. Now imagine being thrown from a cliff. No, I wasn't on a cliff. I was still in my car telling myself it was gonna be fine and to take deep breaths. I took the breaths and carried on. I kept up a peculiar friendship with him because I couldn't imagine keeping up my life without him.

I struggled to master myself and my emotions. I wasn't always successful.
The dance went on.. I kept the rhythm for several summers after. It's winter now. I'm typing this on a plane back to Los Angeles from New Orleans. I flew home for another marred Christmas. I have a windowseat.
It's December 27, 2011.

By now I've written two albums. This being the second.
I wrote to keep myself busy and sane. I wanted to create worlds that were rosier than mine.
I tried to channel overwhelming emotions.
I'm surprised at how far all of it has taken me. Before writing this I'd told some people my story.
I'm sure these people kept me alive, kept me safe. Sincerely, these are the folks I wanna thank from the floor of my heart. Everyone of you knows who you are.. Great humans,
probably angels. I don't know what happens now, and that's alrite. I don't have any secrets I need kept anymore. There's probably some small shit still, but you know what I mean. I was never alone, as much as it felt like it. As much as I still do sometimes. I never was. I don't think I ever could be. Thanks.
To my first love, I'm grateful for you. Grateful that even though it wasn't what I hoped for and even though it was never enough, it was.

Some things never are.. and we were. I won't forget you. I won't forget the summer. I'll remember who I was when I met you.

I'll remember who you were and how we've both changed and stayed the same.
I've never had more respect for life and living than I have right now. Maybe it takes a near death experience to feel alive. Thanks. To my mother. You raised me strong. I know I'm only brave because you were first. So thank you. All of you. For everything good.
I feel like a free man.

If I listen closely.. I can hear the sky falling too.
- Frank"
"40","Provider","Frank Ocean","blonded Los Santos 97.8 FM (GTA V)","","August 27, 2017","558913","442","65","","https://genius.com/Frank-ocean-provider-lyrics","3214401","Memo finna start actin' out if I don't see him soon
Yeah my best friend ain't backin' out, it's still on sight, fool
I'm the only one out here on the night loops
I'm the only one out here on the night loops
Trophy case still light, body need a race stripe
And these minerals on my body break light
And these reds on my body brake light
New man comin' up ahead on his own two
Is you a natural blondie like Goku?
Sleepin' on my belly in a loop like a serpent
Talkin' heads ripplin' on the surface

Eyes low, chin heavy, shoegazer
Moonwalkin', R.I.P. Stanley Kubrick
You had you some birthdays, could you prove it?
Show me the wisdom in your movement
Show me some wisdom in your movement

Feelings you provide
Feelings you provide
I know, I know
The feelings I, the feelings I know, I
Feelings you provide
Feelings you provide
I know, I know
The feelings I know, the feelings I-I, I

Tonight I might change my life
If you lived like I live
You couldn't live without it
Said I'd be your new best friend
But what more? (Yeah)
Ain't too late to walk out (Provide)
Ba-da-ooh, ahh (Provide)
Oh-ooh, ooh-ooh-ooh
Tonight I might change my life
All for you, all for you (Provide)

Provided diamond lane that didn't exist
Packed the Astro van and brought my kids through (Family)
Prada tee on the eldest, throw the Gildan on the children
Hand-me-down fits (Yeah)
Chest pass, see mist off rotation (Swish, swisha)
Stiff smile just like I'm Aphex Twin (Yeah, come to daddy, yeah)
Pat the Patagonia pockets, tryna find my zip (Uh, where it's at? Yeah)
Blunt twist, tightropes, I'm not fallin' off (Never that, no)
Watch friend's GoPro through fisheye lens, drownin' off clear
I just saw Jaws, divin' under influence
Been feelin' like the Lord's just out of reach for me (For me)
How I feel lettin' man speak
How I feel lettin' man speak for me (For me)
Holyfield, keep your ears split for me
Can't show my face if you spit for me (Spit for me, yeah)

Eyes low, chin heavy shoegazer
Moonwalkin', R.I.P. Stanley Kubrick
You had you some birthdays, could you prove it?
Show me the wisdom in your movement
Show me some wisdom in your movement

Feelings you provide
Feelings you provide
I know, I know
The feelings I, the feelings I know, I
Feelings you provide
Feelings you provide
I know, I know
The feelings I know, the feelings I-I, I

Ooh-oh-ooh, ooh-ooh-ooh
Tonight I might change my life
All for you, all for you (Provide)"
"41","strawberry swing","Frank Ocean","nostalgia,ULTRA.","","February 16, 2011","516580","236","45","","https://genius.com/Frank-ocean-strawberry-swing-lyrics","4850","Oh-oh, oh
Oh-oh, oh
Ah-ah, ah-ah
Ah-ah, ah (Yeah-yeah, yeah)
Oh-oh, oh (Yeah-yeah, yeah)
Ah-ah, ah
Ah-ah, ah-ah (Ha)

When we were kids
We handpainted strawberries on a swing
Every moment was so precious then
I'm still kickin'
I'm daydreamin' on a strawberry swing
The entire Earth is fighting
All the world is at its end

Just in case an atom bomb
Comes falling on my lawn
I should say and you should hear
I've loved, I've loved the good times here
I've loved our good times here

Say hello, then say farewell
To the places you know
We are all mortals, aren't we?
Any moment this could go

Cry, cry, cry, oh
Even though that won't change a thing
But you should know, you should hear
That I have loved, I've loved the good times here
And I will miss our good times here

Spaceships are lifting off (Ooh)
Of a dying world (World)
And millions are left behind
While the sky burns (Oh)
There wasn't room for you and I
Only you, goodbye (
Ah
)
Goodbye

Now the sky could be blue, I don't mind
Without you, it's a waste of time
Could be blue, I don't mind
Without you, it's a waste of time (Ooh-ooh)
Could be blue, could be grey
Without you, I'm just miles away (Ooh)
Could be blue, I don't mind (Ooh)
Without you, it's a waste of time"
"42","Trouble","Frank Ocean","","","January 1, 2012","516724","268","41","","https://genius.com/Frank-ocean-trouble-lyrics","3461087","Go, go, go

Forbidden from the beginnin', I saw her there, up there
Been like that since I met her, they said I couldn't have her
Way out of my league, I never believed it
Gotta get her heart, I gotta make her mine
But what if she just tells me I'm not quite her speed or
Shows me her bare hands and crushes my ego?
Dismiss me as a kid, tells me I'm barely legal
But barely legal is legal

You ain't gone get in trouble
Messin' with someone a little younger, younger
You ain't gone get in trouble
For messin' with someone a little younger
Who loves ya
Girl, if I gotta show ID (Show I-, show ID)
Then I'm gonna (Gonna)
Won't let you get in trouble
For messin' with someone a little younger
Younger, no

This conversation is taking us for a loop
But taking you serious is difficult to do
'Cause I don't believe ya
When you say that you don't
Ever look at me quite that way (That way)
You say that you tryin' to settle down
But you think I'm handsome
I should be having fun
I shouldn't move fast
So, let's go slower, not faster
'Cause it ain't no fun
Without ya

You ain't gone get in trouble
Messin' with someone a little younger, younger
You ain't gone get in trouble
For messin' with someone a little younger
Who loves ya
Girl, if I gotta show ID (Show I-, show ID)
Then I'm gonna (Gonna)
Won't let you get in trouble
For messin' with someone a little younger
Younger, no"
"43","Higgs","Frank Ocean","Endless","","August 19, 2016","495784","219","38","","https://genius.com/Frank-ocean-higgs-lyrics","2840912","Saturdays involved making our entrances into life outside
We've been in this room too long
Recreation is keeping us self-contained and aware
Of each other's forms still and in full strides
Just the same
Keeping us warm
Walking in straight lines
Talking to sleep at night
Coddled and pacified
By versions of mothers

It's all new to me
It's all new to me
Having you around
It's all new to me
It's all new to me
Having you 'round the Higgs

What if we decide to live by choice?
All this time I knew
That average was something to fall back on after genius ends
I watch video
Only difference is flattened and remiss
Sparks of lightning storm behind wet faces
Slipped my pants back on and rewind it backward more
The tape stopped before I was back alone

I'll be back before
The street lights on, before the daylight's gone
I was spoiled by lavish thoughts
They don't compare, no, not at all
And had this been the past I might not know
What to do with all
Of what you showed
What you give, my words can't hold
And if acts of God breaks us apart
Least we did ours

Turn back, turn back
Turn back, turn
Back, turn back, turn
If you've never been in love"
"44","Unity","Frank Ocean","Endless","","August 19, 2016","495793","390","54","","https://genius.com/Frank-ocean-unity-lyrics","2431802","U-N-I-T—Y (Shoo)

My head fatiguin' off the opus
Kept it underground to focus
I feel afterlife, six-under oath, don't want no hocus-pocus
Niggas tryna go pop, I draw contact, rip my face mask
Nothin' but, nothin' but net, is you Roger or Novak?
You still are no match, you get no rematch
Boy, you missed your moment
Perusin' the MoMA, I'm on all my lonely, burst in tears
On his shoulder, and it's so cold 'cause he's sculpture
Where's the shaman? Ayahuasca
I had WhatsApp'd him for atonement
I never ever trust the pre-rolled
I never let a random motherfucker shoot the B-roll
I never ask advice from him 'cause what could he know?
Never fuck someone you wouldn't wanna be though
It forever seemed like time's up
When we swerved in the Honda
Now, forever seems like no time
I mean, time flies when you have some
Both nuts weigh two pounds, all on your bitch like futons
My crew saved your crew, like
Niggas came through with the Groupons
Cookin' with the grease now, truffle fries and Cholula
Are you slowing down?
Are you holding down?
Whoever held you down?
Whoever propped you up, built the structures with you?
Swished the buckets with you, who was fuckin' with you?
Really brothers when you needed that?
When you see 'em now, is it forced black?
Hail Mary on a fourth down
Hands to the sky, yeah

Peace to the holy, peace to the people that think they know me
Piece of Moschino, cover your ass, your rectum showing
Peace to the boys that we used to be though
Geto Boy, North Face too cold on these hoes
Peace out to Willie D, Bushwick Billy, and 'Face
Piece of steak grillin' in Jesus' name, speakin' his grace
Hands to the sky (Yeah, yeah)

U-N-I-T-Y, Neptunes and peace signs
Chiraq, Palestine like
Iberville, 1995
You'd think that was airstrikes on outside
I put refugees in my villa, play kids the Fu-Gee-La
All this space, Atlanta
Place order, McMansion and two apple pies
I want the Porsche, Bugatti design
Silicon Valley, new venture is tits up
How do I crop your new bitch out my Vine?
Sick, blue nose pit foamin' white like frappo, jacko
El Chapo, de facto
Bell nacho, shell taco, crunch-crackle
Green emerald, pink diamonds like Apple Jack bowl"
"45","At Your Best (You Are Love)","Frank Ocean","Endless","","August 19, 2016","484369","256","40","","https://genius.com/Frank-ocean-at-your-best-you-are-love-lyrics","675748","When I feel what I feel
Sometimes it's hard to tell you so
You may not be in the mood to learn
What you think you know
There are times when I find
You wanna keep yourself from me
When I don't have the strength
I'm just a mirror of what I see

But at your best, you are love
You're a positive motivating force within my life
If you ever feel the need to wonder why
Let me know, let me know
Love

When you feel what you feel
It's hard for me to understand
So many things have taken place before this love affair began
But if you feel more like I feel
Confusion can give way to doubt
For there are times when I fall short of what I say
What I say I'm all about, all about

But at your best, you are love
You're a positive motivating force within my life
Should you ever feel the need to wonder why
Let me know, let me know
Love

(Wait, waiting)
Let me know
(You niggas goin' in)
Tell me what it is (Fuck it)
What it is, no need to make believe
Look beyond your world
Try to find, find a place for me

'Cause when you're at your best, you are love
You're a positive motivating force within my life
Should you ever feel the need to wonder why
Let me know, let me know
Let me know, know
Love

Stay at your best, baby
Let me know, let me know"
"46","End / Golden Girl","Frank Ocean","channel ORANGE (CD Version)","","July 17, 2012","479850","746","120","Tyler, The Creator","https://genius.com/Frank-ocean-end-golden-girl-lyrics","78969","Darker times (
Oh my God, this is my song
)
They're telling boulder-heavy lies (
Don't play with me right now
, what?)
Looks like all we've got is each other (
Ah
)
The truth is obsolete (
Yes
, I can listen to it)
Remember when all I had was my mother (
Haha
, let them sing)
She didn't compromise
She could recognize
Voodoo
Our daughters and our sons (See, all that is unnecessary)
Are just candles in the sun (
Mmcht, huh, haha
)
Voodoo
Don't let him see divide, hmm (I'm just playin', so tell me how I skate?
What you mean?
)
Don't you let her see divide (You said you could tell a lot about a man by the way he skates, so how do I skate?)
Voodoo (
I don't know
, just be real)

She's got the whole wide world in her juicy fruit (
You, you're alright
, heh)
He's got the whole wide world in his pants (
There's somethin' about you
, huh, I don't know)
He wrapped the whole wide world in a wedding band (
I can't believe I'm even talking to you and telling you this right now
)
Then put the whole wide world on her hands
She's got the whole wide world in her hands (
You special
, heh, I don't know about that)
He's got the whole wide world in his hands (
I wish you could see what I see
, hmm)
In his hands (*kiss*)

He wrapped the whole wide world in a wedding band
Then put the whole wide world on her hands
(She's got the whole wide world in her hands)
(He's got the whole wide world in his hands)

She peels an orange for us in the morning
She woke me up to give me half
I can hear the children soccer ballin'
Like wildcats running on the grass, hey
You're a girl on this island
I'm a boy from America
My flight leaves tonight
But I don't think I'm going backwards
I won't be going backwards

You're my golden girl
You're the one I've chosen, girl
You're 24K
You make it bright when it's grey
You're my golden girl
The sun has been kind to you
You're 24K (Girl)
But the sky's never grey (Never grey)

Silent moments, meditative poses
You break my focus, you make me laugh
Two mopeds racing through the forest
Making dirt clouds on a path, on a path
I'm my best on this island
I'm a mess in America
My flight left last night
But I know I'm not going back home, yeah
I'm not going back home, no

You're my golden girl
You're the one I've chosen, girl
You're 24K
You make it bright when it's grey
You're my golden girl
The sun has been kind to you
You're 24K (Girl)
But the sky's never grey (Never grey)

If we build a house in paradise, will we get to heaven still?
(Tropic, tropic, tropic, breezes, breezes, breezes)
If we don't have to live through hell just to get to heaven
(Tropic, tropic, tropic, breezes, breezes, breezes, breezes)
I'ma stay right here, with you
(Tropic, tropic, tropic, breezes, breezes, breezes, breezes)
'Til the hurricane comes, 'til the tsunami comes
(Tropic, tropic, tropic, breezes)
I've found my gold

You're my golden girl
(Oh)
You're the one I've chosen, girl
You're 24K
You make it bright when it's grey
You're my golden girl
The sun has been kind to you
You're 24K (Girl)
But the sky's never grey (Never grey)

Um, you're my G-O L-D E-N G-I R-L
And that's for the females that can't spell, but
Um, thanks for fuckin' with me
You turn my dark into light, you're like a bucket of bleach
You see, I want you to know that
My negatives at home aren't working for my Kodak
So that means that I don't want to go back
Just know that I would like to stay here and hold that
Hand of yours, girl, I'm a wreck in America
Your face is the best
'Cause it's the same color as the lace on my neck
And you're golden, uh, your eyes open, fuck it
Let's toast and listen to Michael Bolton
I free-fall off the hill again
Let's see where I land, I'm like Gilligan
Um, I trust you, Golden, for wed ring
I'm just hopin' that you don't turn my neck green"
