"number","title","artist","album","album_release_date","release_date","pageviews","word_count","line_count","featured_artists","genius_url","genius_id","lyrics"
"22","Sweet Life","Frank Ocean","channel ORANGE","","July 6, 2012","983344","339","44","","https://genius.com/Frank-ocean-sweet-life-lyrics","78957","The best song wasn't the single, but you weren't either
Livin' in Ladera Heights, the black Beverly Hills
Domesticated paradise, palm trees and pools
The water's blue, swallow the pill
Keepin' it surreal, whatever you like
Whatever feels good, whatever takes your mountain high
Keepin' it surreal, not sugar-free
My TV ain't HD, that's too real
Grape vine, mango, peaches, and lime

A sweet life, a sweet life, sweet life
Sweet life, sweet life
A sweet, sweet, sweet, sweet life
A sweet life, a sweet life, sweetie pie

You've had a landscaper and a housekeeper since you were born
The starshine always kept you warm
So why see the world, when you got the beach?
Don't know why see the world, when you got the beach
The sweet life

The best song wasn't the single, but you couldn't turn your radio down
Satellite need a receiver, can't seem to turn the signal fully off
Transmittin' the waves
You're catchin' that breeze 'til you're dead in the grave
But you're keepin' it surreal, whatever you like
Whatever feels good, whatever takes your mountain high
Keepin' it surreal, not sugar-free
My TV ain't HD, that's too real
Grape vines, mango, peaches, and lime

A sweet life, a sweet life
A sweet life, yeah
A sweet life, a sweet life
A sweet life, live and die in the life

You've had a landscaper and a housekeeper since you were born (Yeah)
The starshine always kept you warm
So why see the world, when you got the beach?
Don't know why see the world, when you got the beach

And the water is exactly what I wanted
It's everything I thought it'd be (Thought it'd be)
But this neighborhood is gettin' trippier every day
The neighborhood is goin' ape shit crazy, aah

You've had a landscaper and a housekeeper since you were born
The starshine always kept you warm
So why see the world, when you got the beach?
Don't know why see the world, when you got the beach
The sweet life"
"23","Biking","Frank Ocean","Biking (Single)","","April 10, 2017","982187","845","114","JAŸ-Z, Tyler, The Creator","https://genius.com/Frank-ocean-biking-lyrics","3048264","Uh, turn (Out there, I can't)
What goes around comes around (When’s the last time I asked for some help that)
Ayy, turn, turn the music up (I couldn't get from nobody else, yeah?)
Uh, yeah (I couldn't get from nobody out there)
Goes around comes around (I can’t)
What goes, alright, like-like (When's the last time I asked for some help that)
Life goes in cycles, everything that comes around goes around, uh (I couldn't get from nobody else, yeah?)
'Fore it goes down, get you some ice (Nobody)

Life goes in cycles, what comes around goes around
So 'fore it goes down, nigga, get you some icicles
Audemars before all of y'all's
Wristwatch got a Russian face like a oligarch, ah
12 o'clock, boy, silly nice, huh
Willie in traffic, I’m Philly nice, uh
E.T. on the handles, uh
Handlebars like a Xanax
Shammgod with the AND1 moves
Throw that shit ’round your neck, right quick
Broke boys get fixed, right quick
Nigel Sylvester with these bike flips, uh
That's a full cab and a backflip, uh
Sidebar

Arms stretch a tee like I nailed it
Raf movin’ slow like a creep
Shirt in the breeze like I'm sailin'
And I walk in my sleep, I can't help that (I can’t)
When's the last time I asked for some help that
I couldn't get from nobody else, yeah?
I couldn't get from nobody out there (I can't)
When's the last time I asked for some help that
I couldn't get from nobody else, yeah?
Nobody

I don't get weak in the knees
Hundreds spread out like a fan
Vert feel like some Gucci sandals
Open the sky, get a handful
Torso marked up like a vandal
How you not fuckin' with cash?
God gave you what you could handle
Gave you what you could handle
I got the grip like a handle
And I'm bikin'
I'm bikin' with me and my Daniel
Hades got the angels
TV's got the angles
I'm brakin' (Got—)

Bikin', I'm bikin', I'm bikin' slow-mo (Slow-mo)
Maybe the four wheel excitin' us mo' (Vroom)
I'm cold when the temperatures dip below 70s (Dip below 70s, dip below 70s)
How can I be burr around L.A. coast? (L.A. coast)
The diamonds is plural, the Tiffany brooch (Bling)
On my lapel, at the table, I'm givin' a toast (Givin' it, clink)
The first weddin' that I've been in my twenties
Thinkin' maybe someone is not somethin' to own
Maybe the government got nothin' to do with it
Thinkin' maybe the feeling just comes, and it goes (Nothin' to do with it)
Think I want me a lil' one that look like my clone (Ayy)
Me and my baby can't do on our own
I landed a trick, got my impossibles (Huh)
I'm fuckin' with Addy, I'm watchin' my dose
24 hours like they never close
I'm bikin', I'm bikin', I'm bikin' these blocks, yeah
Since Ben Baller sold all his ice up at Slauson (Oh)
I'm bikin' uphill, and it's burnin' my quads (Obstacles)
I'm bikin' downhill, and it sound like a fishin' rod
Savage, I'm bikin', yeah (Woo)

From Coldwater to the 'Shaw
Alcoholic, way I handle the bar
This a PK, PK Ripper
Nah, you can't fuck with the boy (Woo)
That's my problem, yeah, I got 'em
My tire smokin' when I stop, okay (Okay)
Nobody fuckin' with me (Fuckin' with me)
My accolades hang from my neck (Hang from my neck, woo)
Pedal, I drown in the heat (Drown in the heat)
My sapphires drown in my sweat (Yeah)
White mags, but I jet
Jackson, I'm savin' the streets
I'm Roger Rabbit in the air
I don't care, Big Willie style, yeah
Nigga, one wheel, one wheel, one wheel (Nigga, one)
Nigga, one wheel, I fishtail downhill, yeah (One wheel, woo)
I rose my rate, brand new brakes
Why I name it Slater? Ask my date

I don't get weak in the knees
Hundreds spread out like a fan
Vert feel like some Gucci sandals
Open the sky, get a handful
Torso marked up like a vandal
How you not fuckin' with cash?
God gave you what you could handle
Gave you what you could handle
I got the grip like a handle
And I'm bikin'
I'm bikin' with me and my Daniel
Hades got the angels
TV's got the angles
I'm brakin'

Got, got me fucked up (Out there)
Got a million-dollar bike (I can't)
Got a million-dollar bike
Got, got me fucked up (When's the last time I asked for some help that)
Got me fucked up, up (I couldn't get from nobody else, yeah?)
Million-dollar bike
Got, got me fucked up, up (I couldn't get from nobody out there)
Million-dollar bike
Got, got me fucked up
Got a million-dollar bike (I can't)
Got a million-dollar bike
Got, got me fucked up (When's the last time I asked for some help that)
Got me fucked up, up (I couldn't get from nobody else, yeah?)
Million-dollar bike
Got, got me fucked up, up (Nobody)
Million-dollar bike"
"24","american wedding","Frank Ocean","nostalgia,ULTRA.","","February 16, 2011","978110","455","76","","https://genius.com/Frank-ocean-american-wedding-lyrics","4882","American love
American me
American you
American tears
American heartbreak
Oh, oh, oh

I took a walk with the palm trees
As the daylight fell
Sangria in a canteen
Talking to myself (I can't remember)
This tattoo on my left hand
Is turning purple-ish blue
Daydreams of the romance
Daydreams of you (You)
My pretty woman in a ballgown
I'm Richard Gere in a tux
Getting married in a courthouse
Writing vows in a rush
Making out before the judge
With my teenage wife
Got a wedding band done
That I just might die with

It's an American wedding
They don't mean too much
But we were so in love
We had an American wedding
Now what's mine is yours
That's American law

M-R-S dot Kennedy
She signed her name in pen (Oh)
In the fancy, fancy cursive (Oh)
Then turned her term papers in (Oh, oh)
A thesis on Islamic (Oh)
Virgin brides and arranged marriage (Ah, ah)
Hijabs and polygamist husbands
Those poor un-American girls
After school she ran to me
Jumped in my 5.0
This is the home of the brave, land of the free
But your parents still didn't know (Oh)
She said, ""I've had a hell of a summer
So, baby, don't take this hard
But maybe we should get an annulment
Before this goes way too far"" (Oh)

It's just an American wedding
They don't mean too much
They don't last enough
We had an American wedding
Now what's mine is yours
American divorce

Well, you can have my Mustang
That's all I've got in my name
But Jesus Christ, don't break my heart
This wedding ring won't ever wipe off
But if you stay
Oh, if you stay (Stay)
You'll probably leave later, anyway
It's love made in the USA

Don't let 'em front you, they sayin' you can't move
Without 'em, fuck 'em, I tell 'em this ain't new
We been some hustlers since it began, dude
Ain't gon' be trippin' over some bitch-ass dude
They so vain, I tell 'em this ain't you
You could get sensitive, but this shit ain't true
These niggas can't do nothin' that I can't do
That she can't do, that he can't do
That you can't do, that we can't do
Man, I had a dream and then this shit came true
And nigga, if I did it, I think you can too
These niggas can't do nothin' that I can't do
That she can't do, that he can't do
That you can't do, that we can't do
Man, I had a dream and then this shit came true
These niggas can't do nothin' that I can't do
That she can't do, that he can't do
That you can't do"
"25","Cayendo","Frank Ocean","Cayendo (7"" Single)","","April 3, 2020","824851","167","19","","https://genius.com/Frank-ocean-cayendo-lyrics","4953643","No hablará de mí, ni hablará de esto
Lo que él quiere de ti, yo no se lo negaría
Si esto no me ha partío, ya no me partiré nunca
Si puedo soportar lo que siento, ¿por qué me 'toy cayendo?

You stood me up, you laid me down
You know too much, I can't be proud
I still really, really love you, yes, I do
When I still really, really love you, like I do
If you won't, then I will
If you can't, then I will
Is it love to keep it from you?

No hablará de mí, ni hablará de esto
Lo que él quiere de ti, yo no se lo negaría
Si esto no me ha partío, ya no me partiré nunca
Si puedo soportar lo que siento, ¿por qué me 'toy cayendo?

¿Acaso voy cayendo?
You stood me up, you lay me down
You know too much (Too much), I can't be proud
I still really, really love you, yes, I do"
"26","Skyline To","Frank Ocean","Blonde","","August 20, 2016","791967","183","27","","https://genius.com/Frank-ocean-skyline-to-lyrics","2842073","This is joy, this is summer
Keep alive, stay alive
Got your metal on (Ooh), we're alone
Making sweet love, takin' time
'Til God strikes us

That's a pretty fuckin' fast year flew by
That's a pretty long third gear in this car
Glidin' on the 5
The deer run across, kill the headlights
Pretty fuckin', underneath moonlight now
Pretty fuckin', sunrise in sight
In comes the mornin', hauntin' us with the beams
Solstice ain't as far as it used to be
It begins to blur, we get older (Blur)
Summer's not as long as it used to be
Every day counts like crazy (Smoke, haze, wait)
Wanna get soaked?
Wanna film a tape on a speed boat?
We smell of Californication (Strike a pose)
Everything grows in the Congo, everything grows (Ooh)
Can you come when I call again?

On comes the evenin', gold seekin' ends
Piece in my hand worth twice than a friend
And two limbs over shoulder, carried away
Because I'm stronger, the Congo is dim (Smoke)
In comes the mornin', ah (Smoke)
In comes the mornin', ah (Haze)"
"27","Wise Man","Frank Ocean","","","December 23, 2012","749482","310","51","","https://genius.com/Frank-ocean-wise-man-lyrics","104426","Wiseman closed his mouth
Madman closed his fist
Young man shows his age
Judge man named it sin
Bad man don't exist, no
No evil man exists
Good man don't exist, no
No righteous man exists
Sad man cannot cry in place where man can see
Never witnessed father weep
This old man thought it weak
But strong man don't exist
No undying man exists
Weak man don't exist, no
Just flesh and blood exists

But your mother would be proud of you
I bet your mother would be proud of you (Ooh)

The beast will crawl this earth
Then fall in the dirt to feed the crows
They'll rip apart his flesh
'Til all that's left is glorious bone
So you'll bury your own
Too vain
You saw it unfold
What you know
And you claimed all you could hold
Until death did you part from the mess you made

I bet your mother would be proud of you
I bet your mother would be proud of you (Ooh)

Primate sharpens tool
To survive and thrive in the jungle
Maybe hearts were made to pump blood
Maybe lungs were made for flood
I won't blunt my blade for cut these chains
Rather let my limbs be drug through mud
You're my brother, but your eyes are cold
You're my sister, but your womb is bare

I bet our mother would be proud of you (You, you, you)
I bet our mother would be proud of you, oh (Mother would be proud)

Bad man don't exist
No evil man exists
I know good man don't exist
No righteous man exists
Strong man don't exist
No undying man exists
Weak man don't exist, no
Just flesh and blood exists

You, you, you
You, you, you
I bet your mother would be proud, uhh
I bet your mother would be proud, ooh"
"28","Crack Rock","Frank Ocean","channel ORANGE","","July 10, 2012","739569","280","43","","https://genius.com/Frank-ocean-crack-rock-lyrics","78962","You don't know how little you matter until you're all alone
In the middle of Arkansas with a little rock left in that glass dick
Used to date a blonde, you used to hit it raw
'Cause she was and you are madly involved, madly involved

Hittin' stones in glass homes
You're smokin' stones in abandoned homes
You hit them stones and broke your home
Crack rock, crack rock
Crack rock, crack rock
Hittin' stones in glass homes
You're smokin' stones in abandoned homes
You hit them stones and broke your home (Ooh, ah, ooh)
Crack rock, crack rock
Crack rock, crack rock

You're shuckin' and jivin', stealin' and robbin'
To get the fixing that you're itching for
Your family stopped inviting you to things
Won't let you hold their infant
You used to get a little cut-up from time to time
But the freaks ain't trying to sleep with cracky

Hittin' stones in glass homes
You're smokin' stones in abandoned homes
You hit them stones, and you broke your home
Crack rock
Crack rock, crack rock

Crooked cop, dead cop
How much dope can you push to me?
Crooked cop, dead cop
No good for community
Fuckin' pig get shot, three hundred men will search for me
My brother get popped, and don't no one hear the sound
Don't no one hear the rounds (Ooh, sound)
Don't no one hear the shells (Ooh, shells)
Don't no one hear a sound
Don't no one disturb the peace for riot
Don't no one disrupt nirvana
Don't no one wanna blow the high

Crack rock (Ooh)
Crack rock (Ooh)
Crack rock
How you feeling, girl? (Ooh)
How's the gutter doing?
Crack rock"
"29","Pilot Jones","Frank Ocean","channel ORANGE","","July 10, 2012","724042","295","49","","https://genius.com/Frank-ocean-pilot-jones-lyrics","78961","We once had things in common
Now, the only thing we share is the refrigerator
Ice cold, baby, I told you, I'm ice cold (Ice cold)
You out here flyin' high (
High
)
Huh, go 'head, fly that thing
High, high, yeah
But fly alone

You always smokin' in the house
What if my mother comes over?
You can't get up and get a job
'Cause this little hustle's gettin' you by
You're the dealer and the stoner
With the sweetest kiss I've ever known

I know what I was on
I had a Pilot Jones (What you know about her?)
She took me high (Oh, did she now?)
Then she took me home (We talkin' 'bout)
Pilot Jones, Pilot Jones

Tonight, she came stumblin' across my lawn again
I just don't know why I keep on tryna keep a grown woman sober
See, there you go reachin' up your blouse
And no, I don't want a child
But I ain't been touched in a while
By the dealer and the stoner
With the sweetest kiss I've ever known

I know what I was on (Ever known,
we'll fly, fly
)
I had a Pilot Jones (
We'll fly, fly, fly,
what you know about her?)
She took me high (
We'll be here flyin',
oh, did she now?)
Then she took me home (
Oh,
we talkin' 'bout)
Pilot Jones, Pilot Jones

In the sky up above, the birds
I saw the sky like I've never seen before, yeah
Thought I was above you
Above this in so many ways
But if I got a condo on a cloud
Then I guess you can stay at my place
Boo-hoo, I'ma get one
Mm-hmm, I need ya
I admit it, you're my Pilot Jones"
"30","DHL","Frank Ocean","","","October 19, 2019","716941","715","93","","https://genius.com/Frank-ocean-dhl-lyrics","4956771","Love that I, love that I give
That is not love that I get from (Uh, uh-huh)
Love that I, love that I give (Uh-huh, uh-huh, uh)

Look at them shakes, oh yeah (
That is not love
)
Made up a dance (
That I get from
)
How come you shook
When I ain't took out my hands?
Beans, Starbucks, starstruck
Bitch comin' soon, yeah
That's 'cause you suck (Suck me, suck me, suck me)
That's comin' soon (Suck my dick, uh)
Come on, I'm back, I want my babe
Stayin' alert, I'm goin' steady
'Cause all my chains, diamonds keep callin'
Findin' the key, put it in, Kawasaki
Totin' that Amazon (Amazon)
Shit like 6'5"" (Shit like 6'5"")
Take back, rewind, now I rewind
Ooh, ooh, baby, be mine (Baby, be mine)
Ooh, ooh, baby, be mine

Just got a pack, came from the DHL, just got up with a pack
Got out a pack, came from the DHL, just got off like a bail
Got out a pack, new one's in my jail
Just got out, found a pack, I got a pack
(Been in jail, been in jail, yeah, yeah, yeah)
Just got a pack, came from the DHL
We get the check, bail (Like it long-term like the pill)
I got a pack, came from the DHL
Just got up on a pill, I got a—

Niggas think it's new, it ain't new, boy
Old files just turned two, yeah, it flew, yeah
Still sound like it's comin' soon, comin' soon, yeah
Still sound like it's comin' soon, tell the truth, woah
Boy-toy suck me like a Hoover, like a Hoover
Boy-toy ride me like a Uber, like a Uber
Smiley face, factory case, ain't bust it down, yeah
I left it, I forgave their violations, ain't seen 'em around yet to test it
Wavy pool, sit behind the pool
I'm tellin' the truth, bro
Remind me of trade, brushin' his waves
Shit look like ramen noodles
Fuck, this shit sound like it's comin' soon, comin' soon, bro
And it still sound like it's comin' soon, comin' soon
New files sittin' on my drive, nothin' new, yeah
New fobs and I can't get down, what to do? Yeah
New fobs, really can't get down to the pool, yeah
New glist' sittin' on a cyst on my wrist, yeah
New bitch ridin' on my dick like a kit, yeah
All of them days when I paid for the studio rate
Instead of the rent, yeah
Now I can hang in this bitch every day
Wait for some inspiration to hit me
Look like I'm dressed for a hike
But I really look like I'm in Paris and shit, yeah
Look like I'm dressed for a camp
'Cause I'm pitchin' a bag, like I'm pitchin' a tent, yeah
This ain't no fuckin' hopes and dreams, it's prophecy
Hardly sleep, faith was in the coffee bean
Roman numerals, niggas pourin' up Ivy Leagues, 4's
Double D's exposed, throw some beads
Fuckin' these hoes, leave, now my fuckin' flow's stole
Screw me slow, yes
Ooh, he TX, XTC rollin'
You seen my bag, it's swollen
Rimowa, I can't even fold it
I drop you a pin like I'm bowlin'
We moanin' 'til not even mornin'
Breakfast and dinners is blendin'
We spend all that time alone, alone
Watchin' the clouds roll, woah

I got a pack, came from the DHL
Just got up with a pack
I got a pack, came from the DHL
Just got up with a pack
I got a pack, woah, a pack, yeah
Just got up with a pack
I got a pack on DHL
Just caught up with a pill (There it is, woo!)
DHL, just got up with a pack (There it is)
I got a pack, came up on DHL
Just came up with a pack
I got a pack, came up on DHL
Just caught up with a pack
I got a pack, came up on DHL
Just got off with the pack

Independent jug, sellin' records out the trunk
I'm already rich as fuck, so the product's in the front
Got my partner in the front, been my BF for a month
But we been fuckin' from the jump (Jump, jump, jump, jump)"
"31","Close to You","Frank Ocean","Blonde","","August 20, 2016","715580","77","10","","https://genius.com/Frank-ocean-close-to-you-lyrics","2842092","I'll be honest, I wasn't devastated
But you could've held my hand through this, baby
Let my mind run underneath warm jets
I run my hands through what's left
But we're gettin' older, baby
Don't have much longer, baby
Why am I preachin' to this choir, to this atheist?
Just like mine, versions of these belong to you
After a while, they're keeping me close to you

Just like me, they long to be close to you"
"32","Sierra Leone","Frank Ocean","channel ORANGE","","July 10, 2012","702039","214","27","","https://genius.com/Frank-ocean-sierra-leone-lyrics","78956","(We're spendin' too much time alone)
Eh, we're spendin' too much time alone, eh
(And I just ran outta Trojans)
Horses gallop to her throne, huh (You, you)
(We're behaving like teenagers)
Yes, we're behaving like teenagers (Ah, you, you)
(Making less than minimum wage, shit)
Still inside our parents' homes
(No, I don't live in Denver)
Eh, no, I don't live in Denver
(I grew up in Sierra Leone)
And her pink skies will keep me warm

Sierra Leone
Sierra Leone
Tidbits of intuition that I be gettin', abandon mission (Sierra Leone)
Abandon mission, you must be kiddin'
This shit feelin' different, shit feelin' too good to me
Glistenin', shimmerin' underneath the sunlight, the sunlight (Sierra Leone)

And a new day will bring about the dawn
And a new day will bring another cryin' babe into the world (Babe)
Woah, ooh, oh (Girl now)
Our daughter's reachin' for your nipple 'cause it's time for her to eat (Reachin' for ya)
Tonight, I'll lay her in the cradle if it's time for go to sleep (Oh, go to sleep, oh-oh)
I'll sing a Lennon lullaby, she can have a pretty dream
Baby girl, if you knew what I know, knew what I know, ooh-oh

No, no-no, no, no, no
No, no-no, no, no, no"
"33","Moon River","Frank Ocean","Someone Great (A Netflix Soundtrack)","","February 14, 2018","673701","124","20","","https://genius.com/Frank-ocean-moon-river-lyrics","3525624","One, two

Moon River, wider than a mile
I'm crossing you in style someday
A dream maker (Maker)
My heart (You heart) breaker
Wherever you're goin', I'm goin' that way (Same)

Two drifters off to see the world
There's such a crazy world to see
We're all chasin' after all the same
Chasin' after our ends

Moon River, wider than a mile
Crossin' in style someday
My dream maker, heartbreaker
Wherever you're goin', I'm goin' the same

Two drifters off to see the world
It's such a crazy world, you'll see (What I see, who I become, what I see, who I become)
We're all chasin' after our ends
Chasin' after our ends

Life's just around the bend, my friends
Moon River and me"
"34","In My Room","Frank Ocean","In My Room (7"" Single)","","November 2, 2019","669984","320","40","","https://genius.com/Frank-ocean-in-my-room-lyrics","4991158","Why, why, why, why, why, why, why, why

No sleeper seats, that's a mattress
No sleeper seats, that's a mattress
You ain't stingy, split your tablets with me
You won't flinch when camera's flashing, flashing
Not fake laid back, no, it's natural
And I think you made for the life I lead
I'm not fake patient, I don't fake sick, huh
That kinda coffin don't need lean
Rest in peace
Got this lust for life in me, yeah
Horny for the game, uh
First they kiss, then they bite soft, uh
Then that bitch wanna play it off, huh
Fuck it, I'm pretty still in a pit of snakes
While serpents shake some brand-new scales
I need a new face, I'm tired of these weirdos acting familiar
Took all the rock and turned it to pop, he think that he Elvis
And he ungrateful, they don't say thank you
They don't say grace, not even for meals, not even for millions
Fuck it, I'm pretty still, look at my deal
Richard Mille, look at my ears, flooded with diamonds
Look at my skills, running through blocks like 49ers
Forty-nine diamonds stuffed in my bracelet
That cost a whop, that cost a whopper
And it ain't new, I had a knot at John Ehret in my locker
Pretty still, it ain't no pretty pill, it's either real or real
Real easy on the eyes, green like a soccer field
Skin hot when they tried me, like them poppers feel
Hands shaking, norepinephrine levels skyrocket, fuel, rocket

Quit being violent with me (Yeah, why, why)
Quit being violent with me
Quit being violent with me
You make me violent

My room, my room, my room (With me)
Every night you were in my room
My room, my room (With me)
I guess I can't state my feelings too soon
I don't know you
And I can't put no threats in the air"
