"number","title","artist","album","album_release_date","release_date","pageviews","word_count","line_count","featured_artists","genius_url","genius_id","lyrics"
"20","Tell Your Friends","The Weeknd","The Highlights (Deluxe)","","August 24, 2015","1611328","764","91","","https://genius.com/The-weeknd-tell-your-friends-lyrics","2273458","We are not the same, I am too reckless
I'm not tryna go in that direction
These niggas, they been doin' too much flexin'
And they about to call the wrong attention
And I don't got no patience, no more testin'
I do shit how I want, don't need no blessin'
XO niggas ain't nothin' to mess with
Nobody stoppin' us, oh, no, we destined
And everybody 'round you is so basic
I'm never rockin' white, I'm like a racist
I don't drink my liquor wit' a chase in
That money is the only thing I'm chasin'
And some dope dimes on some coke lines
Gimme head all night, cum four times
Baby girl just wanna smoke a pound
Do an ounce, get some dick, tell her friends about it

Go tell your friends about it (About it)
Go tell your friends about it (About it, hey)
Go tell 'em what you know, what you seen
How I roll, how I get it on the low (Oh, woah)
Go tell your friends about it (About it)
Go tell your friends about it
I'm that nigga with the hair
Singin' 'bout poppin' pills, (Yeah, yeah) fuckin' bitches, livin' life so trill

Last year I did all the politickin'
This year I'ma focus on the vision (That vision)
I think these hoes deserve another fixin' (Fixin')
I'm talkin' 'bout the ones from the beginnin' (Oh, oh, oh)
Don't believe the rumors, bitch, I'm still a user
I'm still rockin' camo and still roll with shooters
I'm a villain in my city, I just made another killin'
I'ma spend it all on bitches (On bitches)
And everybody fuckin', everybody fuckin' (Fuckin')
Pussy on the house, everybody fuckin' (Fuckin')
Man, I miss my city, man, it's been a minute (Been a minute)
MIA a habit, Cali was the mission (Ooh, woah)
Cruise through the west-end in my new Benz (Ooh, woah)
I'm just tryna live life through a new lens (Oh, woah, ho)
Drivin' by the streets I used to walk through
When I had no crib, I guess you call that shit a miracle

Go tell your friends about it (About it)
Go tell your friends about it (About it, hey)
Go tell 'em what you know, what you seen (Oh, ho-woah, oh)
How I roll, how I get it on the low
Go tell your friends about it (About it)
Go tell your friends about it
I'm that nigga with the hair
Singin' 'bout poppin' pills, (Yeah, yeah) fuckin' bitches, livin' life so trill

Roll some, think I’ll roll some
To know some, if we both honest
Who lasts? (Who lasts?)
Yeah, you lie (You lie)
Spent the whole summer
Tryna be at the wrong place at the right time
But I know what's mine when I see it
I know, know

My cousin said I made it big and it's unusual (Unusual)
She tried to take a selfie at my Grandma's funeral (Funeral)
Used to roam on Queen, now I sing Queen Street anthems (Queen Street anthems)
Used to hate attention, now I pull up in that wagon (That wagon)
And I was broken, I was broken, I was so broke (So broke)
I used to roam around the town when I was homeless (No, no, no, no, no)
Me and La Mar would rob a nigga for his Jordans
And flip it just to get these hoes another nose fix
Now we get faded when we want, girl, we got choices (Got choices)
Lay them on the fuckin' table, we got choices (Got choices)
And if they wanna fuck my niggas, they got choices (Got choices)

They told me not to fall in love, that shit is pointless
Yeah, that shit is pointless (Pointless)
They told me not to fall in love, that shit is pointless
Yeah, that shit is pointless (Pointless)
They told me not to fall in love, that shit is pointless

Go tell your friends about it (About it)
Go tell your friends about it (About it, hey)
Go tell 'em what you know, what you seen (Oh)
How I roll, how I get it on the low (Ooh, ooh)
Go tell your friends about it (About it)
Go tell your friends about it
I'm that nigga with the hair
Singin' 'bout poppin' pills, (Yeah, yeah) fuckin' bitches, livin' life so trill

Life so trill
(Politickin', yeah)
Life so trill
Life so trill (Life so trill)
(I'm that nigga with the—)
Life so trill
Life so trill (Ooh, ooh, ooh)
(Life so trill)
(Life so trill)
(Yeah, yeah)
Life so trill"
"21","Wasted Times","The Weeknd","The Highlights (Deluxe)","","March 30, 2018","1599169","384","50","","https://genius.com/The-weeknd-wasted-times-lyrics","3614873","Wasted times I spent with someone else
She wasn't even half of you
Reminiscin' how you felt
Reminiscin' how you felt
And even though you put my life through hell
I can't seem to forget 'bout you, 'bout you
I want you to myself

And now I'm askin', who do you belong to now?
Who you give that love to now?
Who you pullin' up on?
Who you gettin' sprung for now?
And what they got that I ain't got? 'Cause I got a lot
Don't make me run up on 'em, got me blowin' up their spot
'Cause I ain't got no business catchin' feelings anyway
I ain't got no business catchin' feelings

Catchin' feelings
These girls only want you when you're winnin' (Winnin')
But you've been with me from the beginnin' (Ooh, yeah, yeah)
And I know right now that we're not talkin' (Not talkin')
I hope you know this dick is still an option
'Cause I'll beat it up (I'll beat it up, yeah)
I took my time to learn the way your body functions
You were equestrian, so ride it like a champion (Ride it, baby)
This sex will get you high without no other substance

So who do you belong to now? (Who do you belong to now?)
Who you give that love to now? (Who you give that love to now?)
Who you pullin' up on?
Who you gettin' sprung for now? (Who you gettin' sprung for now?)
And what they got that I ain't got? 'Cause I got a lot (I got a lot)
Don't make me run up on 'em, got me blowin' up their spot (Blowin' up their spot)
'Cause I ain't got no business catchin' feelings anyway
I ain't got no business catchin' feelings (Feelings)

Catchin' feelings
I ain't got no business catchin' feelings
I ain't got no business catchin' feelings
Catchin' fee-fee-fee-fee
Feelings
I ain't got no business catchin' feelings
I ain't got no business catchin' feelings
Catchin' fee-fee-fee-fee

Wake up
I don't wanna wake up
I don't wanna wake up
If you ain't layin' next to me
I don't wanna wake up
I don't wanna wake up
I don't wanna wake up
If you ain't layin' next to me-e-e
On me, me, on me, oh, I
On me, on me, on me"
"22","The Morning","The Weeknd","The Highlights (Deluxe)","","January 3, 2011","1556982","527","82","","https://genius.com/The-weeknd-the-morning-lyrics","6169","I'm fucking gone right now
I'm fucking gone right now
""Listen, listen""

From the morning to the evening
Complaints from the tenants
Got the walls kicking like they six months pregnant
Drinking Alizé with our cereal for breakfast
Girls calling cabs at dawn quarter to seven
Sky's getting cold, we're flying from the north
Rockin' with our city like a sold out show
House full of pros that specialize in the ho'in'
Make that money rain as they taking off they clothes
Order plane tickets
Cali is the mission
Visit every month like I'm split life living
Let the world listen
If a hater's caught slipping
Then my niggas stay tight
Got my back like Pippen
Fast life gripping
Yeah, we still tippin'
Codeine cups paint a picture so vivid
Fakes try to mimic
Get girls timid
But behind closed doors they get poles so rigid

All that money, the money is the motive
All that money, the money is the motive
All that money, the money she be folding
Girl, put in work, girl, girl, put in work
Girl, put in work, girl, girl, put in work
Girl, put in work

Push it to the limit
Push it through the pain
I push it for the pleasure like a virgin to the game
A virgin to that money
A virgin to the fame
So this my only chance
And when I'm over only pray
That I flow from the bottom
Closer to the top
The higher that I climb
The harder I'ma drop
These pussy ass niggas tryna hold on to their credit
So I tell them use a debit
Watch they image start to lessen
I warn them like discretion
Why these niggas testing?
Always fucking testing
Why these niggas testing?
Shit that I got them on straight bar hopping
To the music of the ambiance
Get shit popping
Zombies of the night (Zombies of the night)
Niggas ain't talking if they hyping to the crew
Get it in like pockets
Downtown loving
When the moon coming
Only place to find bassheads and hot women

All that money, the money is the motive
All that money, the money is the motive
All that money, the money she be folding
Girl, put in work, girl, girl, put in work
Girl, put in work, girl, girl, put in work
Girl, put in work

Better slow down
She'll feel it in the morning
Ain't the kind of girl you'll be seeing in the morning
Too damn raw, ain't no nigga with her rollin'
Ain't no nigga that she holding
Man, her love is too damn foreign
Look at all that money
The money is the motive (The money is the motive)
All that money
The money she be folding (The money she be folding)
Girl, put in work, girl, girl, put in work
Girl, put in work, girl, girl, put in work

All that money, the money is the motive
All that money, the money is the motive
All that money, the money she be folding
Girl, put in work, girl, girl, put in work
Girl, put in work, girl, girl, put in work
Girl, put in work"
"23","Pray For Me","The Weeknd","The Highlights (Deluxe)","","January 22, 2018","1401351","414","51","","https://genius.com/The-weeknd-and-kendrick-lamar-pray-for-me-lyrics","3487532","(Ooh, ooh, ooh, ooh)

I'm always ready for a war again (A war again)
Go down that road again (That road again)
It's all the same (It's all the same)
I'm always ready to take a life again (That life again)
You know I'll ride again (I'll ride again)
It's all the same (Ooh, ooh, ooh)

Tell me who's gon' save me from myself
When this life is all I know
Tell me who's gon' save me from this hell
Without you, I'm all alone

Who gon' pray for me? Take my pain for me?
Save my soul for me? 'Cause I'm alone, you see
If I'm gon' die for you, if I'm gon' kill for you
Then I'll spill this blood for you, hey

I fight the world, I fight you, I fight myself
I fight God, just tell me how many burdens left
I fight pain and hurricanes, today, I wept
I'm tryna fight back tears, flood on my doorsteps
Life a livin' hell, puddles of blood in the streets
Shooters on top of the building, government aid ain't relief
Earthquake, the body dropped, the ground breaks
The poor run with smoke lungs and Scarface
Who need a hero? (Hero)
You need a hero, look in the mirror, there go your hero
Who on the front lines at ground zero? (Hero)
My heart don't skip a beat, even when hard times bumps the needle
Mass destruction and mass corruption, the souls of sufferin' men
Clutchin' on deaf ears again, rapture's comin'
It's all prophecy and if I gotta be
Sacrificed for the greater good, then that's what it gotta be

Who gon' pray for me? Take my pain for me?
Save my soul for me? 'Cause I'm alone, you see
If I'm gon' die for you, if I'm gon' kill for you
Then I'll spill this blood for you, hey

Hey, hey (La-la-la-la-la-la-la-la-la-la-la-la-la-la-la-la-la-la-la)
Hey, hey (La-la-la-la-la-la-la-la-la-la-la-la-la-la-la-la-la-la-la)
Hey, hey (La-la-la-la-la-la-la-la-la-la-la-la-la-la-la-la-la-la-la)
Hey, hey (La-la-la-la-la-la-la-la-la-la-la-la-la-la-la-la-la-la-la)

Who gon' pray for me? Take my pain for me?
Save my soul for me? 'Cause I'm alone, you see
If I'm gon' die for you, if I'm gon' kill for you
Then I'll spill this blood for you, hey

Just in case my faith go, I'll live by my own law
I'll live by my own law, I'll live by my own
Just in case my faith go, I'll live by my own law
I'll live by my own law, I'll live by my own
La-la-la-la-la-la-la-la-la-la-la-la-la-la-la-la-la-la-la
La-la-la-la-la-la-la-la-la-la-la-la-la-la-la-la-la-la-la
La-la-la-la-la-la-la-la-la-la-la-la-la-la-la-la-la-la-la
La-la-la-la-la-la-la-la-la-la-la-la-la-la-la-la-la-la-la"
"24","In Your Eyes","The Weeknd","The Highlights (Deluxe)","","March 20, 2020","1397029","326","53","","https://genius.com/The-weeknd-in-your-eyes-lyrics","5360217","Ooh, yeah

I just pretend that I'm in the dark and
I don't regret 'cause my heart can't take a loss
I'd rather be so oblivious
I'd rather be with you

When it's said, when it's done, yeah
I don't ever wanna know
I can tell what you done, yeah
When I look at you

In your eyes
I see there's something burning inside you
Oh, inside you
In your eyes
I know it hurts to smile, but you try to
Oh, you try to
You always try to hide the pain
You always know just what to say
I always look the other way
I'm blind, I'm blind
In your eyes
You lie, but I don't let it define you
Oh, define you

I tried to find love
In someone else too many times
But I hope you know I mean it (Mean it)
When I tell you you're the one that was on my mind, oh

When it's said, when it's done, yeah
I would never let you know (Let you know)
I'm ashamed of what I've done, yeah
When I look at you

In your eyes (Your eyes)
I see there's something burning inside you (Inside you)
Oh, inside you (Oh, inside you)
In your eyes
I know it hurts to smile, but you try to (But you try to)
Oh, you try to (You try to)
You always try to hide the pain (Oh, oh)
You always know just what to say (Oh, dear)
I always look the other way
I'm blind, I'm blind
In your eyes
You lie, but I don't let it define you (Hey)
Oh, define you

In your eyes
I see there's something burning inside you
Oh, inside you
You always try to hide the pain
You always know just what to say
I always look the other way
I'm blind, I'm blind
In your eyes
You lie, but I don't let it define you
Oh, define you"
"25","In the Night","The Weeknd","The Highlights (Deluxe)","","August 28, 2015","1372554","383","54","","https://genius.com/The-weeknd-in-the-night-lyrics","729457","All alone, she was livin'
In a world without an end or beginnin'
Baby girl was livin' life for the feelin'
But I don't mind, I don't mind, oh
And all the wrongs she committed
She was numb and she was so co-dependent
She was young and all she had was the city
But I don't mind, I don't mind

And I know (Know)
That she's capable of anything, it's riveting
But when (When)
You wake up, she's always gone, gone, gone, oh

In the night, she hears him calling
In the night, she's dancin' to relieve the pain
She'll never walk away
I don't think you understand
In the night, when she comes crawlin'
Dollar bills and tears keep fallin' down her face
She'll never walk away
I don't think you understand

He sang a song when he did it
He was cold and he was so unforgiving
Now she dances to the song on the minute
Yeah, all the time (All the time), all the time (All the time), oh
It make her weak when she hear it
And it got her on her knees like religion
She was young and she was forced to be a woman
Yeah, all the time (All the time), all the time (All the time)

And I know (Know)
That she's capable of anything, it's riveting
But when (When)
You wake up, she's always gone, gone, gone, oh

In the night, she hears him calling
In the night, she's dancin' to relieve the pain
She'll never walk away
I don't think you understand
In the night, when she comes crawlin' (Yeah)
Dollar bills and tears keep fallin' down her face (Fallin' down her face)
She'll never walk away
I don't think you understand

Oh, baby
I don't think you understand (Woo)
I don't think you understand (Ohh)
I don't think you understand
Oh, no, no, no
I don't think you understand (Hey)

In the night, she hears him calling (Yeah)
In the night, she's dancin' to relieve the pain (To relieve the pain)
She'll never walk away (No-no-no-no-no)
I don't think you understand (Hey)
In the night, when she comes crawlin' (Ooh)
Dollar bills and tears keep fallin' down her face (It's fallin' down her face)
She'll never walk away
I don't think you understand"
"26","Kiss Land","The Weeknd","Kiss Land (Deluxe)","","May 17, 2013","1364568","904","109","","https://genius.com/The-weeknd-kiss-land-lyrics","152385","When I got on stage, she swore I was six feet tall
But when she put it in her mouth
She can't seem to reach my...
Ballin' ain't an issue for me
I'll make a hundred stacks right back next week
Do it all again, I'm faded off the wrong thing, the wrong thing
And I'll admit, baby, I'm a little camera-shy
But exceptions can be made, baby, ‘cause you're too damn fly
For what it's worth, I hope you enjoy the show
'Cause if you're back here only takin' pictures
You gon' have to take your ass home

'Cause the only thing you're takin' is your clothes off
Go 'head, girl, strip it down, close your mouth
I just wanna hear your body talk

(Nothing is going to change my love for you)
(Nothing is going to change my love for you)
Oh, girl, don’t hold back, let it out
(Nothing is going to change my love for you)
(Nothing is going to change my love for you)
Oh, girl, don’t hold back, let it out
(Nothing is going to change my love for you)
(Nothing is going to change my love for you)
Don’t hold back, let it out
(Nothing is going to change my love for you)
(Nothing is going to change my love for you)
Don’t hold back

You can meet me in the room where the kisses ain't free
You gotta pay with your body
Not really into kisses leading into nothing
I'm into shows every night, if you play your cards right
I might fuck around, bring your whole crew on tour
Fuck around, turn you to my West Coast girl
Until they book a show in NYC
Gotta fly back east where the city don't sleep
Woah, I'm tryna finish all this potion
Baby, take your time, I'm tryna sip it 'til the mornin'
And if you're still up, I'm tryna fuck you in the mornin'
Said, I'm two days strong
And never sleep until it's mornin', until the mornin'

'Cause the only thing you're takin' is your clothes off
Go 'head, girl, strip it down, close your mouth
I just wanna hear your body talk

(Nothing is going to change my love for you)
(Nothing is going to change my love for you)
Oh, yeah, don’t hold back, let it out
(Nothing is going to change my love for you)
(Nothing is going to change my love for you)
Oh, girl, don’t hold back, let it out
(Nothing is going to change my love for you)
(Nothing is going to change my love for you)
Don’t hold back, let it out
(Nothing is going to change my love for you)
(Nothing is going to change my love for you)
Oh, yeah, don’t hold back

I got a brand new place, I think I've seen it twice all year
I can't remember how it looks inside
So you can picture how my life's been
I went from starin' at the same four walls for 21 years
To seein' the whole world in just 12 months
Been gone for so long, I might have just found God
Well, probably not, if I keep my habits up
Probably not if I can't keep up with lovin'
And I can't stand talkin' to brand new girls
Only bitches down to fuck when you shower them with ones and
Probably not if my niggas round them up and
Probably not if we take 'em to my spot
Probably not if I tweak all day just to sleep at night
Goddamn, I'm high
My doctor told me to stop
And he gave me somethin' to pop
And I mix it up with some Adderall's
And I wait to get to the top
And I mix it up with some alcohol and I pour it up in a shot
I don't care about you, why you worried 'bout me?
All I want is that smoke, give me all of that smoke
Last week was my rough week
I'm still drippin' down from my nose
And I don't know how to drive, I make my driver get high
But If he goes under that 110, believe my driver get fired
And I don't got any friends, I got XO in my bloodwork
And I'm posted up down in Florida
Ft. Lauderdale to that MIA
Cold drinks with Grand Marnier
To the break of dawn, Kahlua milk
White Russian when the sun hits
White Russians with tongue tricks
I like the feeling of tongue rings
She like the way my whole tongue flip
She grind hard for tuition
She grind hard 'til her teeth chip
I make her hide it with gold grills
I make her suck it with gold grills
In the back room of the VIP, she don't ever sleep

This ain't nothing to relate to
And this ain't nothing to relate to
And this ain't nothing to relate to
This ain't nothing to relate to
Even if you tried, you tried, you tried
You tried, you tried, you tried
You tried, you tried, you tried
You tried, you tried, you tried
This ain't nothing to relate to
This ain't nothing to relate to
And this ain't nothing to relate to
This ain't nothing to relate to
Even if you tried, you tried, you tried
You tried, you tried, you tried
You tried, you tried, you tried
You tried, you tried, you tried"
"27","The Zone","The Weeknd","Trilogy","","August 18, 2011","1359881","466","72","Drake","https://genius.com/The-weeknd-the-zone-lyrics","54471","Ooh ahh
Ooh ahh, ahh
Ohh yeah, yeah
Ooh ahh, ahh

Why you rushing me, baby?
It's only us, alone
I don't want to die tonight, baby
So lemme sip this slow
I'll give you what you called for
Just let me get in my zone
I'll be making love to her through you
So let me keep my eyes closed

And I won't see a damn thing
I can't feel a damn thing
But I'ma touch you right
I won't see a damn thing
I can't feel a damn thing
But I'ma touch you right (Oh yeah)

I'ma touch you right (Ooh yeah)
(Just let me sip this slow)
I'ma touch you right
(Let me get inside my zone)
I'ma touch you right (Oh yeah)
(Just let me)
Ohh ahh, ahh
Ooh yeah

And I'ma lean, 'til I fall, ooh yeah
And I don't give a damn
I felt the ground before
I left it all behind, baby
I didn't need no one
But I'm in need tonight baby
I've been alone for too long
Ohh, oh yeah

So, I won't say a damn thing
I can't feel a damn thing
But I'ma touch you right (Ooh, yeah)
Oh, I can't see a damn thing
I can't feel a damn thing
But I'ma touch you right (Ooh)

I'ma touch you right (Ohh yeah)
(Just let me sip this slow)
Ooh, I'ma touch you right
(Let me get inside my zone)
Ooh, I'ma touch you right
(Just let me)
Ohh ahh, ahh
Ooh, yeah

Woah, all these broken hearts on that pole
Man, if pole dancing's an art, you know how many fuckin' artists I know?
Got some new bills in the mail, got some big favors I owe
Got some good things ahead of me when these bad bitches let go
Well girl let's go, walk your broken heart through that door
Sit your sexy ass on that couch
Wipe that lipstick off of your mouth
I take it slow
She in love with my crew
She said make enough so I can try some
I thought taking drugs just ain't you, be you
Yeah girl, just be you
And I do this shit for my hometown, it been going down, it ain't new
That's that north north, that up top
That OVO and that XO
Your girlfriend at our next show
But it's all good, don't stress though
First night fuck, never really planned it
Take a deep breath, no one need to panic
Lips so French, ass so Spanish
She don't really like attention, I don't know if she gon' manage out here
But she got me all up in my zone
Said she like the view I got in this place, shit I did all of that on my own
Aw yeah"
