"number","title","artist","album","album_release_date","release_date","pageviews","word_count","line_count","featured_artists","genius_url","genius_id","lyrics"
"34","Midnight Rambler","The Rolling Stones","Rolled Gold: The Very Best of the Rolling Stones","","December 5, 1969","55215","501","85","","https://genius.com/The-rolling-stones-midnight-rambler-lyrics","105981","Did you hear about the midnight rambler?
Everybody got to go
Did you hear about the midnight rambler
The one that shut the kitchen door?
He don't give a hoot of a warning
Wrapped up in a black-cat cloak
He don't go in the light of the morning
He split the time the cock will crow

Talkin' about the midnight gambler
The one you never seen before
Yeah, talkin' about the midnight gambler
Did you see him jump the garden wall?
Sighin' down the wind so sadly
Listen, and you'll hear him moan
Yeah, well, I'm talkin' about the midnight gambler
Everybody got to go

Yes

Did you hear about the midnight rambler?
Well, honey, it's no rock 'n' roll show
Well, I'm talkin' about the midnight gambler
Yeah, the one you never seen before, yeah ahh

Don't do that, don't do that, don't do that
Don't do that, don't do that
Don't do that, don't do that
Don't do that, don't do that
Don't do that, don't do that
Don't do that, don't do that
Don't do that, don't you do that
Don't you, don't you do that
Don't do that
Don't do that
Don't you do that
Don't you do that
Don't you do that
Don't you do that
Don't you do that
Don't you do that
Don't you do that
Don't you do that
Don't you do that
Don't you do that
Don't you do that
Don't you, don't you do that
Don't you, don't you do that
Don't you, don't you do that
Don't you, don't you do that
Don't you, don't you do that
Don't you, don't you do that
Don't you, don't you do that
Oh, don’t do that
Oh, don’t do that
Oh, don’t do that
Oh, don’t do that
Oh, don’t do that
Oh, don’t do that
Oh, don’t do that
Oh, don’t do that
Oh, don’t do that
Oh, don’t do that
Hahahaha

Well, you heard about the Boston…
It’s not one of those…
Well, talkin' 'bout the midnight...sh...
The one that closed the bedroom door
I'm called the hit-and-run raper in anger
The knife-sharpened tippie-toe...
Or just the shoot-'em-dead, brain-bell jangler
You know, the one you never seen before

So, if you ever meet the midnight rambler
Coming down your marble hall
Well, he's pouncing like a proud black panther
Well, you can say I, I told you so
Well, don't you listen for the midnight rambler, yeah, yeah
Play it easy, as you go
I'm gonna smash down all your plate-glass windows
Put a fist, put a fist through your steel-plated door

Did you hear about the midnight rambler?
He'll leave his footprints up and down your hall
And did you hear about the midnight gambler?
And did you see me make my midnight call?
And if you ever catch the midnight rambler
I'll steal your mistress from under your nose
I'll go easy with your cold-fanged anger
I'll stick my knife right down your throat, baby
And it hurts!"
"35","Moonlight Mile","The Rolling Stones","Sticky Fingers: Super Deluxe Edition","","April 23, 1971","54247","228","33","","https://genius.com/The-rolling-stones-moonlight-mile-lyrics","106081","When the wind blows, and the rain feels cold
With a head full of snow, with a head full of snow
In the window, there's a face you know
Don't the night pass slow? Don't the nights pass slow?

The sound of strangers sending nothing to my mind
Just another mad, mad day on the road
I am just living to be lying by your side
But I'm just about a moonlight mile on down the road

Made a rag pile of my shiny clothes
Going to warm my bones, going to warm my bones
I've got silence on my radio
Let the airwaves flow, let the airwaves flow

For I am sleeping under strange, strange skies
Just another mad, mad day on the road
My dreams is fading down the railway line
I'm just about a moonlight mile on down the road

Yeah, yeah, yeah, yeah, yeah, yeah

I'm hiding, sister, and I'm dreaming
I'm riding down your moonlight mile
I'm hiding, baby, but I'm dreaming
I'm riding down your moonlight mile
I'm riding down your moonlight mile

Let it go now
Come on up, baby
Yeah, let it go now
Yeah
Flow now, baby
Yeah, come on now, yeah

Hey

Yeah, I'm coming home
'Cause I'm just about a moonlight mile on down the road
On down the road, on down the road
Yeah, yeah, baby"
"36","Out of Time","The Rolling Stones","The Rolling Stones Singles Collection: The London Years","","April 15, 1966","52028","395","51","","https://genius.com/The-rolling-stones-out-of-time-lyrics","310531","You don't know what's going on
You've been away for far too long
You can't come back and think you are still there

You're out of touch, my baby
My poor discarded baby
I said, ""baby, baby, baby, you're out of time""

Well, baby, baby, baby, you're out of time
I said, ""baby, baby, baby, you're out of time""
You are left out
Out of there without a doubt 'cause
Baby, baby, baby, you're out of time

The girl who wants to run away (Run away)
Discovers that she's had her day (Had her day)
It's not good, you're thinking that you are still mine

You're out of touch, my baby
My poor unfaithful baby
I said, ""baby, baby, baby, you're out of time""

Well baby, baby, baby, you're out of time
I said, ""baby, baby, baby, you're out of time""
Yes, you are left out
Out of there without a doubt 'cause
Baby, baby, baby, you're out of time

You thought you were a clever girl (Clever girl)
Giving up your social whirl (Social whirl)
But you can't come back and be the first in line, oh no

You're obsolete my baby
My poor old-fashioned baby
I said, ""baby, baby, baby, you're out of time""

Well baby, baby, baby, you're out of time
I said, ""baby, baby, baby, you're out of time""
Yes, you are left out
Out of there without a doubt 'cause
Baby, baby, baby, you're out of time (Sing the song)
Baby, baby, baby, you're out of time
I said, ""baby, baby, baby, you're out of time""
(Aah) Baby, baby, baby, you're out of time

You don't know what's going on (On)
You've been away for much too long (Much too long)
But you can't come back and think you are still mine

You're out of touch, my baby
My poor discarded baby
I said, ""baby, baby, baby, you're out of time""

Well baby, baby, baby, you're out of time
I said, ""baby, baby, baby, you're out of time""
Yes, you are left out, yes you are
I said, ""no"", out of there without a doubt 'cause
Baby, baby, baby, you're out of time, alright

I said, ""baby, baby, baby, you're out of time""
I said, ""baby, baby, baby, you're out of time""
I said, ""baby, baby, baby, you're out of time""
I said, ""baby, baby, baby, you're out of time"""
"37","Get Off of My Cloud","The Rolling Stones","The Rolling Stones Singles Collection: The London Years","","September 25, 1962","51837","335","34","","https://genius.com/The-rolling-stones-get-off-of-my-cloud-lyrics","213527","I live on an apartment on the ninety-ninth floor of my block
And I sit at home looking out the window, imagining the world has stopped
Then in flies a guy who's all dressed up just like a Union Jack
Says, I've won five pounds if I have his kind of detergent pack

I said, ""Hey (Hey), you (You), get off of my cloud
Hey (Hey), you (You), get off of my cloud
Hey (Hey), you (You), get off of my cloud
Don't hang around 'cause two's a crowd
On my cloud, baby""

The telephone is ringing, I say, ""Hi, it's me, who is it there on the line?""
A voice says, ""Hi, hello, how are you?"", “Well, I guess I'm doing fine“
He says “It's three AM, there's too much noise, don't you people ever wanna go to bed?
Just 'cause you feel so good, do you have to drive me out of my head?”

I said, ""Hey (Hey), you (You), get off of my cloud
Hey (Hey), you (You), get off of my cloud
Hey (Hey), you (You), get off of my cloud
Don't hang around 'cause two's a crowd
On my cloud, baby""
Yeah

I was sick and tired, fed up with this, so I decided to take a drive downtown
It was so very quiet and peaceful, there was nobody, not a soul around
I laid myself out, I was so tired, and I started to dream
In the morning, the parking tickets were just like flags stuck on my windscreen

I said, ""Hey (Hey), you (You), get off of my cloud
Hey (Hey), you (You), get off of my cloud
Hey (Hey), you (You), get off of my cloud
Don't hang around 'cause two's a crowd
On my cloud""

Hey (Hey), you (You), get off of my cloud
Hey (Hey), you (You), get off of my cloud
Hey (Hey), you (You), get off of my cloud
Don't hang around, baby, two's a crowd
On my cloud
Hey (Hey), you (You)..."
"38","Stray Cat Blues","The Rolling Stones","Beggars Banquet","","December 6, 1968","51396","269","37","","https://genius.com/The-rolling-stones-stray-cat-blues-lyrics","310612","Ah... hey
Yeah, got some tail

I hear the click-clack of your feet on the stairs
I know you're no scare-eyed honey
There'll be a feast if you just come upstairs, but
It's no hanging matter
It's no capital crime

I can see that you're fifteen years old
No, I don't want your I.D
And I can see that you're so far from home, but
That's no hanging matter
It's no capital crime

Oh, yeah, you're a strange stray cat
Oh, yeah, don't you scratch like that
Oh, yeah, you're a strange stray cat
I bet, bet your mama don't know you scream like that
I bet your mother don't know you do spit like that

You look so weird, and you're so far from home
But you don't really miss your mother
You look so scared, I'm not no mad-brained bear
But, but it's no hanging matter
It's no capital crime

Oh, yeah
Woo!
I bet your mama don't know that you scratch like that
I bet she don't know you can bite like that

You say you got a friend that she's wilder than you
Why don't you bring her upstairs?
If she's so wild, then she can join in too
It's no hanging matter, huh
It's no capital crime

Oh, yeah, you're a strange stray cat
Oh, yeah, don't you scratch like that
Oh, yeah, you're a strange stray cat
I bet your mama don't know you can bite like that
I'll bet she never saw you scratch my back

Chow, bum ba bum bum, chow, bum ba bum bum bow, bum ba bum bum bow…"
"39","Sway","The Rolling Stones","Sticky Fingers: Super Deluxe Edition","","April 23, 1971","49690","192","23","","https://genius.com/The-rolling-stones-sway-lyrics","106070","One, two, three, four

Did you ever wake up to find
A day that broke up your mind?
Destroyed your notion of circular time?

It's just that demon life has got you in its sway
It's just that demon life has got you in its sway

Ain't flinging tears out on the dusty ground
For my friends out on the burial ground
Can't stand the feeling getting so brought down

It's just that evil life that got me in its sway
It's just that evil life that got me in its sway

There must be ways to find out
Love is the way they say is really strutting out

Whoo
Hey, hey, hey now
One day I woke up to find
Right in the bed next to mine
Someone that broke me up with a corner of her smile, yeah

It's just that demon life that got me in its sway
It's just that demon life that got me in its sway
It's just that demon life that got me in its sway
(It's just that demon life that got me in its sway)

It's just that demon life has got me"
"40","Star Star","The Rolling Stones","Goats Head Soup (2020 Deluxe)","","August 31, 1973","45822","260","41","","https://genius.com/The-rolling-stones-star-star-lyrics","310705","Baby, baby
I've been so sad since you've been gone
Way back to New York City
Where you do belong

Honey, I missed your two tongue kisses
Legs wrapped around me tight
If I ever get back to Fun City, girl
I'm gonna make you scream all night

Honey, honey
Call me on the telephone
I know you're moving out to Hollywood
With your can of tasty foam

All those beat up friends of mine
Gotta get you in their books
Lead guitars and movie stars
Get their tongues beneath your hood

Yeah, you're a starfucker, starfucker, starfucker, starfucker, star
Yeah, a starfucker, starfucker, starfucker, starfucker, star
A starfucker, starfucker, starfucker, starfucker star

Yeah, I heard about your Polaroids
That's what I call obscene
Your tricks with fruit was kinda cute
I bet you keep your pussy clean

Honey, I miss your two tongue kisses
Legs wrapped around me tight
If I ever get back to New York, girl
Gonna make you scream all night

Yeah, you're a starfucker, starfucker, starfucker, starfucker, star
Yeah, a starfucker, starfucker, starfucker, starfucker, star
A starfucker, starfucker, starfucker, starfucker star

Yeah, Ali McGraw got mad with you
For giving head to Steve McQueen
Yeah, you and me we made a pretty pair
Falling through the silver screen

Honey, I'm open to anything
I don't know where to draw the line
Yeah, I'm making bets that you gonna get
Your man before he dies

Yeah, you're a starfucker, starfucker, starfucker, starfucker, star
Yeah, a starfucker, starfucker, starfucker, starfucker, star
A starfucker, starfucker, starfucker, starfucker star"
"41","Happy","The Rolling Stones","GRRR!","","May 12, 1972","44093","256","42","","https://genius.com/The-rolling-stones-happy-lyrics","77868","Well, I never kept a dollar past sunset
It always burned a hole in my pants
Never made a school mama happy
Never blew a second chance, oh no

I need a love to keep me happy
I need a love to keep me happy
Baby, baby, keep me happy
Baby, baby, keep me happy

Always took candy from strangers
Didn't wanna get me no trade
Never want to be like papa
Working for the boss every night and day

I need a love to keep me happy
I need a love
Baby, won't you keep me happy?
Baby, won't you keep me happy? (Happy)
Baby, please keep me

I need a love to keep me happy
I need a love to keep me happy
Baby, baby, keep me happy
Baby

Never got a flash out of cocktails
When I got some flesh off the bone
Never got a lift out of Lear jets
When I can fly way back home

I need a love to keep me happy
I need a love to keep me happy
Baby, baby, keep me happy
Baby, baby, keep me happy
Baby

Happy
Baby, won't you keep me happy
Baby, won't you keep me happy
Baby, won't you keep me happy
Baby, won't you keep me happy
Baby, won't you keep me happy
Oh, keep, oh, baby, keep me happy
Now, baby, won't you keep me happy
Baby, got me feeling happy
Now, now, now, now, now, happy
Come on now, keep me happy
Keep on, baby, keep me happy"
"42","Waiting On a Friend","The Rolling Stones","GRRR!","","November 30, 1981","37884","178","32","","https://genius.com/The-rolling-stones-waiting-on-a-friend-lyrics","1864024","{Intro}

Watching girls go passing by
It ain't the latest thing
I'm just standing in a doorway
I'm just trying to make some sense'
Out of these girls that passing by
The tales they tell of men
I'm not waiting on a lady
I'm just waiting on a friend

A smile relieves a heart that grieves
Remember what I said
I'm not waiting on a lady
I'm just waiting on a friend
Just waiting on a friend
I'm just waiting on a friend
I'm just waiting on a friend

{Bridge}

Don't need a whore, I don't need no booze
Don't need a virgin priest
But I need someone I can cry to
I need someone to protect
Making love and breaking hearts
It is a game for youth
But I'm not waiting on my lady
I'm just waiting on a friend

I'm just waiting on a friend
I'm just waiting on a friend
I'm just waiting on a friend
I'm just waiting on a friend
Just waiting on a friend
Waiting on a friend
Waiting on a friend"
"43","It’s All Over Now","The Rolling Stones","The Rolling Stones Singles Collection: The London Years","","June 10, 1964","36390","204","20","","https://genius.com/The-rolling-stones-its-all-over-now-lyrics","310391","Well, baby used to stay out all night long
She made me cry, she done me wrong
She hurt my eyes open, that's no lie
Tables turn and now her turn to cry

Because I used to love her, but it's all over now
Because I used to love her, but it's all over now

Well, she used to run around with every man in town
She spent all my money, playing her high class game
She put me out, it was a pity how I cried
Tables turn and now her turn to cry

Because I used to love her, but it's all over now
Because I used to love her, but it's all over now

Well, I used to wake in the morning, get my breakfast in bed
When I'd gotten worried she'd ease my aching head
But now she's here and there, with every man in town
Still trying to take me for that same old clown

Because I used to love her, but it's all over now
Because I used to love her, but it's all over now
Because I used to love her, but it's all over now
Because I used to love her, but it's all over now"
"44","No Expectations","The Rolling Stones","The Rolling Stones Singles Collection: The London Years","","August 1968","35619","113","20","","https://genius.com/The-rolling-stones-no-expectations-lyrics","310596","Take me to the station
And put me on a train
I've got no expectations
To pass through here again

Once I was a rich man
Now I am so poor
But never in my sweet, short life
Have I felt like this before

Your heart is like a diamond
You throw your pearls at swine
And as I watch you leaving me
You pack my peace of mind

Our love was like the water
That splashes on a stone
Our love is like our music
It's here, and then it's gone

So take me to the airport
And put me on a plane
I’ve got no expectations
To pass through here again"
"45","Loving Cup","The Rolling Stones","Shine a Light","","May 12, 1972","35227","291","38","","https://genius.com/The-rolling-stones-loving-cup-lyrics","77867","I'm the man on the mountain, come on up
I'm the plowman in the valley with a face full of mud
Yes, I'm fumbling and I know my car don't start
Yes, I'm stumbling and I know I play a bad guitar

Give me a little drink from your loving cup
Just one drink and I'll fall down drunk

I'm the man who walks the hillside in the sweet summer sun
I'm the man that brings you roses when you ain't got none
Well I can run and jump and fish, but I won't fight
You if you want to push and pull with me all night

Give me a little drink from your loving cup
Just one drink and I'll fall down drunk, yeah

I feel so humble with you tonight
Just sitting in front of the fire
See your face dancing in the flame
Feel your mouth kissing me again
What a beautiful buzz, what a beautiful buzz
What a beautiful buzz, what a beautiful buzz
Oh, what a beautiful buzz, what a beautiful buzz

Yes, I am nitty gritty and my shirt's all torn
But I would love to spill the beans with you till dawn

Give me a little drink from your loving cup
Just one drink and I'll fall down drunk

Give me a little drink
Give me a little drink
Give me a little drink
Give me a little drink
Give me a little drink
Give me a little drink
Give me a little drink
Give me a little drink
Give me a little drink
Give me a little drink
Give me a little drink
Give me a little drink
Give me a little drink
Give me a little drink
Give me a little drink"
"46","Love in Vain","The Rolling Stones","Stripped","","December 5, 1969","35067","135","23","","https://genius.com/The-rolling-stones-love-in-vain-lyrics","105976","Well, I followed her to the station
With a suitcase in my hand
Yeah, I followed her to the station
With a suitcase in my hand
Whoa, it's hard to tell, it's hard to tell
When all your love's in vain

When the train come in the station
I looked her in the eye
Well, the train come in the station
And I looked her in the eye
Whoa, I felt so sad, so lonesome
That I could not help but cry
Heyy-ohhh, yeah

When the train left the station
It had two lights on behind
Yeah, when the train left the station
It had two lights on behind
Whoa, the blue light was my baby
And the red light was my mind

All my love's in vain
Ooooh
Ohhh
All my love's in vain"
"47","Fool to Cry","The Rolling Stones","GRRR!","","April 26, 1976","34120","303","49","","https://genius.com/The-rolling-stones-fool-to-cry-lyrics","312055","When I come home, baby
And I've been working all night long
I put my daughter on my knee, and she said
""Daddy, what's wrong?""
She whispered in my ear so sweet
You know what she said? She said

""Daddy, you're a fool to cry
You're a fool to cry
And it makes me wonder why
Daddy, you're a fool""

You know, I've got a woman (Daddy, you're a fool)
And she live in the poor part of town
And I go see her sometimes
And we make love, so fine
I put my head on her shoulder
She said, ""Tell me all your troubles""
You know what she said? She said

Ooh, ""Daddy, you're a fool to cry
You're a fool to cry
And it makes me wonder why
Daddy, you're a fool to cry""
(Oh, I love you so much, baby)
""Daddy, you're a fool to cry
Daddy, you're a fool to cry""

Yeah, she said
Ooh, ""Daddy, you're a fool to cry
You're a fool to cry
And it makes me wonder why""
She said
Ooh, daddy you're a fool to cry
Ooh, ""Daddy, you're a fool to cry""
Ooh, ""Daddy, you're a fool to cry""
Ooh, ""Daddy, you're a fool to cry""
Even my friends say to me sometimes
I make out like I don't understand them
You know what they say? They say

Ooh, ""Daddy, you're a fool to cry
You're a fool to cry
And it makes me wonder why"" (Why, why)

I'm a fool, baby, yeah
I'm a fool, babe, ah yeah
I'm a certified fool, ay ay, yeah
Want, want to tell you, to tell you, babe
I'm a fool, baby, ah yeah, woo
I'm a certified fool, babe, ah, ah, yeah
C'mon, yeah
I'm a fool, yeah
I'm a fool, yeah
I'm a fool"
"48","The Last Time","The Rolling Stones","The Rolling Stones Singles Collection: The London Years","","February 26, 1965","33722","300","58","","https://genius.com/The-rolling-stones-the-last-time-lyrics","310435","Well I told you once and I told you twice
But you never listen to my advice
You don't try very hard to please me
With what you know it should be easy

Well this could be the last time
This could be the last time
Maybe the last time
I don't know. Oh no. Oh no

Well, I'm sorry girl but I can't stay
Feeling like I do today
It's too much pain and too much sorrow
Guess I'll feel the same tomorrow

Well this could be the last time
This could be the last time
Maybe the last time
I don't know. Oh no. Oh no

Well this could be the last time
This could be the last time
Maybe the last time
I don't know. Oh no. Oh no

Well I told you once and I told you twice
That someone will have to pay the price
But here's a chance to change your mind
Because I'll be gone a long, long time

Well this could be the last time
This could be the last time
Maybe the last time
I don't know
Oh no. Oh no

Last time, baby
To see you no more
(Baby the last time)
Not no more
(Baby the last time)
Well not no more
(Baby the last time)
Well not no more
(Baby the last time)
Ah, not no more
(Baby the last time)
Not no more
(Baby the last time)
No, not no more
(Baby the last time)
No, not no more
(Baby the last time)
No, no I don't know
(Baby the last time)
I don't know
(Baby the last time)
I don't know
(Baby the last time)
I don't know
(Baby the last time)
I don't know
(Baby the last time)
I don't know
(Baby the last time)"
"49","Lady Jane","The Rolling Stones","The Rolling Stones Singles Collection: The London Years","","April 15, 1966","33523","106","24","","https://genius.com/The-rolling-stones-lady-jane-lyrics","310466","My sweet Lady Jane
When I see you again
Your servant am I
And will humbly remain

Just heed this plea, my love
On bended knees, my love
I pledge myself to
Lady Jane

My dear Lady Anne
I've done what I can
I must take my leave
For promised, I am

This play is run, my love
Your time has come, my love
I pledge my troth to
Lady Jane

Oh, my sweet Marie
I wait at your eaves
The sands have run out
For your lady and me

Wedlock is nigh, my love
Her station's right, my love
Life is secure with
Lady Jane"
"50","Heaven","The Rolling Stones","Tattoo You","","August 24, 1981","32608","99","13","","https://genius.com/The-rolling-stones-heaven-lyrics","312289","The smell of you baby, my senses, my senses be praised
The smell of you baby, my senses, my senses be praised

Kissing and running, kissing and running away
Kissing and running, kissing and running away
Senses be praised
Senses be praised

You're my saving grace, saving grace
Nothing will harm you and nothing will stand in your way
Nothing, nothing, nothing
Nothing will stop you and nothing will stand in your way

No one will harm you, no one will stand in your way
No one will bar you, nothing will stand in your way
Nothing, there's nothing"
