"number","title","artist","album","album_release_date","release_date","pageviews","word_count","line_count","featured_artists","genius_url","genius_id","lyrics"
"18","Dead Flowers","The Rolling Stones","Sticky Fingers: Super Deluxe Edition","","April 23, 1971","118353","239","28","","https://genius.com/The-rolling-stones-dead-flowers-lyrics","105931","Well, when you're sitting there in your silk upholstered chair
Talking to some rich folk that you know
Well, I hope you won't see me in my ragged company
Well, you know I could never be alone

Take me down, little Susie, take me down
I know you think you're the queen of the underground
And you can send me dead flowers every morning
Send me dead flowers by the mail
Send me dead flowers to my wedding
And I won't forget to put roses on your grave

Well, when you're sitting back in your rose pink Cadillac
Making bets on Kentucky Derby Day
I'll be in my basement room with a needle and a spoon
And another girl can take my pain away

Take me down, little Susie, take me down
I know you think you're the queen of the underground
And you can send me dead flowers every morning
Send me dead flowers by the mail
Send me dead flowers to my wedding
And I won't forget to put roses on your grave
Hey

Take me down, little Susie, take me down
I know you think you're the queen of the underground
And you can send me dead flowers every morning
Send me dead flowers by the U.S. Mail
Say it with dead flowers at my wedding
And I won’t forget to put roses on your grave
No, I won’t forget to put roses on your grave"
"19","Tumbling Dice","The Rolling Stones","GRRR!","","May 1972","116059","308","44","","https://genius.com/The-rolling-stones-tumbling-dice-lyrics","77862","Mmm, yeah

Women think I'm tasty, but they're always tryin' to waste me
And make me burn the candle right down
But baby, baby, I don't need no jewels in my crown
'Cause all you women is low down gamblers
Cheatin' like I don't know how
But baby, I go crazy, there's fever in the funk house now
This low down bitchin' got my poor feet a-itchin'
You know you know the deuce is still wild

Baby, I can't stay, you got to roll me
And call me the tumbling dice

Always in a hurry, I never stop to worry
Don't see the time flashin' by
Honey, got no money
I'm all sixes and sevens and nines
Say now, baby, I'm the rank outsider
You can be my partner in crime

Baby, I can't stay
You got to roll me and call me the tumbling
Roll me and call me the tumbling dice
Baby, oh my

Oh, my, my, my, I'm the lone craps shooter
Playing the field every night

Baby, get it straight
You got to roll me and call me the tumbling dice
Got to roll me (Call me the tumbling dice)
Got to roll me
Got to roll me
Got to roll me (Oh, oh yeah)
Got to roll me (Oh, oh)
Got to roll me (Oh yeah)
Got to roll me (Oh, keep on rolling)
Got to roll me (Oh, keep on rolling)
Got to roll me (Oh yeah, keep on rolling)
Got to roll me (Call me the tumbling dice)
Got to roll me (Yeah)
Got to roll me (Roll me, baby)
Got to roll me (Ah yeah)
Got to roll me (Oh my, my, my, my)
Got to roll me
Got to roll me (Keep on tumbling down, baby, oh)
Got to roll me
Got to roll me
Got to roll me"
"20","As Tears Go By","The Rolling Stones","The Rolling Stones Singles Collection: The London Years","","December 4, 1965","114632","95","18","","https://genius.com/The-rolling-stones-as-tears-go-by-lyrics","105928","It is the evening of the day
I sit and watch the children play
Smiling faces I can see
But not for me
I sit and watch
As tears go by

My riches can't buy everything
I want to hear the children sing
All I hear is the sound
Of rain falling on the ground
I sit and watch
As tears go by

It is the evening of the day
I sit and watch the children play
Doing things I used to do
They think are new
I sit and watch
As tears go by"
"21","Street Fighting Man","The Rolling Stones","The Rolling Stones Singles Collection: The London Years","","August 30, 1968","110237","157","25","","https://genius.com/The-rolling-stones-street-fighting-man-lyrics","213536","Everywhere I hear the sound of marchin', chargin' feet, boy
'Cause summer's here, and the time is right
For fighting in the street, boy

Well now, what can a poor boy do
'Cept to sing for a rock-n-roll band?
'Cause in sleepy London Town
There's just no place for street fighting man
No

Hey, think the time is right for a palace revolution
But where I live, the game to play is compromise solution

Well now, what can a poor boy do
'Cept to sing for a rock-n-roll band?
'Cause in sleepy London Town
There's just no place for street fighting man
No

Get down

Hey, said my name is called disturbance
I'll shout and scream
I'll kill the king, I'll rail at all his servants

Well now, what can a poor boy do
'Cept to sing for a rock-n-roll band?
'Cause in sleepy London Town
There's just no place for street fighting man
No

Get down"
"22","Bitch","The Rolling Stones","Honk (Deluxe)","","April 16, 1971","105060","227","37","","https://genius.com/The-rolling-stones-bitch-lyrics","106072","I'm feeling so tired, can't understand it
Just had a fortnight's sleep
I'm feeling so stuffed, I'm so distracted
Ain't touched a thing all week
I'm feeling drunk, juiced up and sloppy
Ain't touched a drink all night
I'm feeling hungry, can't see the reason
Just had a horse meat pie

Yeah when you call my name
I salivate like a Pavlov dog
Yeah when you lay me out
My heart is beating louder than a big bass drum, alright

Yeah, you got to mix it, child, you got to fix
It must be love, it's a bitch
Yeah, you got to mix it, child, you got to fix
It must be love, it's a bitch, alright

Sometimes, I'm sexy, move like a stud
Like kicking the stall all night
Sometimes, I'm so shy, got to be worked on
Don't have no bark or bite, alright

Yeah, when you call my name
I salivate like a Pavlov dog
Yeah, when you lay me out
My heart is bumping louder than a big bass drum, alright

I want it, woo
I said, hey, yeah, get alright now, get it
Got to be
Hey, I'll get alright now, get it
Hey, hey, hey
Hey, hey, yeah
Hey, hey, hey
Hey, hey, yeah
Hey, hey, hey
Hey, hey, yeah
Hey, hey, hey
Hey, hey, yeah, get on
Hey, hey, hey"
"23","Angry","The Rolling Stones","Hackney Diamonds (Live Edition)","","September 6, 2023","88298","284","52","","https://genius.com/The-rolling-stones-angry-lyrics","9496302","One, two, one, two, three, go

Don't get angry with me
I never caused you no pain
I won't be angry with you
But I can't see straight (Yeah)
It hasn't rained for a month, the river's run dry
We haven't made love and I wanna know why
Why you angry with me
Why you angry?

Please just forget about me, cancel out my name
Please never write to me, I love you just the same
I hear a melody ringing in my brain
Just keep the memories, don't have to be ashamed

Don't get angry with me
I'm in a dеsperate state
I'm not angry with you
Don't you spit in my facе
The wolf's at the door with the teeth and the claws
My mouth's getting sore, I can't take anymore
Why you angry with me?
Why you angry?

Voices keep echoing, calling out my name
Hear the rain keep beating on my window pane
I hear a melody ringing in my brain
You can keep the memories, don't have to be ashamed

Don't get angry with me

Angry
Angry

Yeah, angry, yeah
Don't be angry with me
If we go separate ways
Angry, yeah
Don't get angry with me
Let's go out in a blaze
Angry (Yeah)
Don't be angry with me
Don't you spit in my face
Angry (Oh)
Don't get angry with me
Don't get, don't get, don't
Angry (Yeah)
Don't be angry with me
I'm still taking the pills
And I'm off to Brazil (Angry)
Don't be angry with me
Yeah
Please (Angry)
Don't be angry with me
Come on
Don't, don't (Angry)
Don't, no (Don't be angry with me)
No, no, no, no, no, no, no, yeah"
"24","Sweet Virginia","The Rolling Stones","Exile on Main St.","","May 12, 1972","86644","203","24","","https://genius.com/The-rolling-stones-sweet-virginia-lyrics","77864","Wading through the waste, stormy winter
And there's not a friend to help you through
Trying to stop the waves behind your eyeballs
Drop your reds, drop your greens and blues

Thank you for your wine, California
Thank you for your sweet and bitter fruits
Yes I've got the desert in my toenail
And I hid the speed inside my shoe

But come on, come on down, Sweet Virginia
Come on, honey child, I beg of you
Come on, come on down, you've got it in ya
Got to scrape that shit right off your shoes

I want you to come on and sing it with me one time...
All right

Yes, I want you to come on, come on down, Sweet Virginia
I said I want you to come on, honey child, I beg of you
I, I want you come on, honey child you've got it in you, uh huh
Got to scrape that shit right off your shoes

One more time
Hey

But come on, come on down Sweet Virginia
Come on, come on down, I beg of you
Come on, come on down, you've got it in ya, uh huh
Got to scrape that shit right off your shoes"
"25","Shattered","The Rolling Stones","Forty Licks","","June 9, 1978","84261","353","59","","https://genius.com/The-rolling-stones-shattered-lyrics","312214","Uh huh shattered, uh huh shattered
Love and hope and sex and dreams
Are still surviving on the street
Look at me, I'm in tatters
I been shattered
Shattered

Friends are so alarming and my lover's never charming
Life's just a cocktail party on the street
Big Apple, people dressed in plastic bags, directing traffic
(Shadoobie, shattered)
Some kind of fashion
(Shadoobie, shattered)

Laughter, joy and loneliness
And sex and sex and sex and sex
And look at me, I'm in tatters
I'm a-shattered
Shattered

All this chitter-chatter, chitter-chatter, chitter-chatter 'bout
Shmatta, shmatta, shmatta, I can't give it away on 7th Avenue
This town's been wearing tatters, uh huh
(Shadoobie, shattered)
Work and work for love and sex
Ain't you hungry for success, success, success, success
Does it matter? (Shattered)
Does it matter?

Ahh, look at me, I'm a-shattered
I'm a-shattered
Look at me, I'm a-shattered, yeah

Pride and joy and greed and sex
That's what makes that town the best
Pride and joy and dirty dreams
Are still surviving on the streets (shattered)
And look at me, I'm in tatters, yeah (shattered)

What does it matter (shattered)
Does it matter, uh-huh (shattered)
Does it matter? Uh-huh
I'm shattered
Mm-mm, shattered

Huh shadoobie, shattered
Huh shadoobie, shattered
Shadoobie, shattered, shattered

Don't you know the crime rate's goin' up, up, up, up, up?  (Shadoobie, shattered)
To live in this town you must be tough, tough, tough, tough, tough, tough, tough  (Shadoobie, shattered)  (Shadoobie, shattered, shattered)

We've got rats on the west side, bed bugs uptown (Shadoobie, shattered)
What a mess, this town's in tatters, I've been shattered (Shadoobie, shattered)
My brain's been battered, splattered all over Manhattan (Shadoobie, shattered)

Shadoobie, shattered, shattered
What I say?
Shadoobie, shattered
Shadoobie, shattered
Shadoobie, shattered

This town's full of money grabbers   (Shadoobie, shattered)
Go ahead, bite the Big Apple, don't mind the maggots, uh-huh   (Shadoobie, shattered)   (Shadoobie, shattered)

Shadoobie, my brain's been battered
(Shadoobie, shattered, shattered)
My friends they come around, they flatter, flatter, flatter, flatter, flatter, flatter, flatter
(Shadoobie, shattered)   (Shadoobie, shattered)
Pile it up, pile it up, pile it high on the platter
(Shadoobie, shattered, shattered)"
"26","Mother’s Little Helper","The Rolling Stones","The Rolling Stones Singles Collection: The London Years","","April 15, 1966","82365","260","38","","https://genius.com/The-rolling-stones-mothers-little-helper-lyrics","95381","What a drag it is getting old

""Kids are different today"", I hear every mother say
Mother needs something today to calm her down
And though she's not really ill
There's a little yellow pill

She goes running for the shelter of her mother's little helper
And it helps her on her way
Gets her through her busy day

""Things are different today"", I hear every mother say
Cooking fresh food for her husband's just a drag
So she buys an instant cake
And she burns a frozen steak

And goes running for the shelter of her mother's little helper
And two help her on her way
Get her through her busy day

""Doctor, please some more of these""
Outside the door
She took four more
What a drag it is getting old

""Men just aren't the same today"", I hear every mother say
""They just don't appreciate that you get tired""
""They're so hard to satisfy""
You can tranquilize your mind

So go running for the shelter of a mother's little helper
And for help you through the night
Help to minimize your plight

""Doctor, please some more of these""
Outside the door
She took four more
What a drag it is getting old

""Life's just much too hard today"", I hear every mother say
The pursuit of happiness just seems a bore
And if you take more of those
You will get an overdose

No more running for the shelter of a mother's little helper
They just helped you on your way
Through your busy, dying day

Oi!"
"27","Rocks Off","The Rolling Stones","GRRR!","","May 26, 1972","79839","374","45","","https://genius.com/The-rolling-stones-rocks-off-lyrics","77857","Oh yeah

I hear you talking when I'm on the street
Your mouth don't move, but I can hear you speak
What's the matter with the boy?
He don't come around no more
Is he checking out for sure?
Is he gonna close the door on me?
And I'm always hearing voices on the street
I want to shout, but I can hardly speak
I was making love last night to a dancer friend of mine
I can't seem to stay in step
Because she come every time that she pirouettes over me

And I only get my rocks off while I'm dreaming
(Only get them off, only get them off, only get them off)
I only get my rocks off while I'm sleeping
(Only get them off, only get them off)

I'm zipping through the days at lightning speed
Plug in, flush out and fire the fucking feed

Heading for the overload
Splattered on the nasty road
Kick me like you've kicked before
I can't even feel the pain no more

And I only get my rocks off while I'm dreaming
(Only get them off, only get them off, only get them off)
I only get my rocks off while I'm sleeping
(Only get them off, only get them off)

Feel so hypnotized, can't describe the scene, oh
It's all mesmerized, all that inside me, oh

The sunshine bores the daylights out of me
Chasing shadows, moonlight mystery

Heading for the overload
Splattered on the dirty road
Kick me like you've kicked before
I can't even feel the pain no more

And I only get my rocks off while I'm dreaming
(Only get them off, only get them off, only get them off)
I only get my rocks off while I'm sleeping
(Only get them off, only get them off)
And I only get my rocks off while I'm dreaming
(Only get them off, only get them off, only get them off)
And I only get my rocks off while I'm sleeping
(Only get them off, only get them off)
And I only get my rocks off while I'm sleeping
(Only get them off, only get them off, only get them off)
(Only get them off, get them off, only get them off)"
"28","Play with Fire","The Rolling Stones","The Rolling Stones Singles Collection: The London Years","","February 26, 1965","78946","141","26","","https://genius.com/The-rolling-stones-play-with-fire-lyrics","107935","Well, you've got your diamonds
And you've got your pretty clothes
And the chauffeur drives your car
You let everybody know

But don't play with me
'Cause you're playing with fire

Your mother, she's an heiress
Owns a block in Saint John's Wood
And your father'd be there with her
If he only could

But don't play with me
'Cause you're playing with fire

Your old man took her diamonds
And tiaras by the score
Now she gets her kicks in Stepney
Not in Knightsbridge anymore

So don't play with me
'Cause you're playing with fire

Now you've got some diamonds
And you will add some others
But you'd better watch your step, girl
Or start living with your mother

So don't play with me
'Cause you're playing with fire
So don't you play with me
'Cause you're playing with fire"
"29","Let It Bleed","The Rolling Stones","More Hot Rocks (Big Hits & Fazed Cookies)","","December 5, 1969","76679","337","43","","https://genius.com/The-rolling-stones-let-it-bleed-lyrics","105980","Well, we all need someone we can lean on
And if you want it, well, you can lean on me
Yeah, we all need someone we can lean on
And if you want it, well, you can lean on me

She said, ""My breasts, they will always be open
Baby, you can rest your weary head right on me
And there will always be a space in my parking lot
When you need a little coke and sympathy""

Yeah, we all need someone we can dream on
And if you want it, baby, well, you can dream on me
Yeah, we all need someone we can cream on
Yeah, and if you want to, well, you can cream on me

I was dreaming of a steel-guitar engagement
When you drunk my health in scented jasmine tea
But you knifed me in my dirty, filthy basement
With that jaded, faded, junky nurse
Oh, what pleasant company, ha

We all need someone we can feed on
Yeah, and if you want it, well, you can feed on me, hey
Take my arm, take my leg
Oh, baby, don't you take my head
Woo!

Yeah, we all need someone we can bleed on
Yeah, and if you want it, baby, well, you can bleed on me
Yeah, we all need someone we can bleed on
Yeah, yeah, and if you want it, baby
Why don't you bleed on me? All over, woo!

Yeah, baby
Ah, get it on, rider, woo!
Get it on, rider, get it on, rider
You can bleed all over me, yeah
Get it on, rider, woo
Get it on, rider, yeah, you can be my rider
You can come all over me, ah
Get it on, rider, babe
Get it on, rider
Get it on, rider, you can come all over me
Yeah, yeah, yeah, yeah, ooh
Yeah, c'mon, c'mon
Ah, get it on, rider
Baby, come all over me, yeah, yeah, me
Get it on, rider, nah, nah, nah, nah
Get it on, rider, woo!"
"30","Sweet Sounds of Heaven","The Rolling Stones","Hackney Diamonds (Live Edition)","","September 28, 2023","70800","373","66","","https://genius.com/The-rolling-stones-and-lady-gaga-sweet-sounds-of-heaven-lyrics","9496427","I hear the sweet, sweet sounds of Heaven
Fallin' down, fallin' down to this earth
I hear the sweet, sweetest sounds of Heaven
Driftin' down, driftin' down to this earth

Bless the Father, bless the Son
Hear the sound of the drums
As it echoes through the valley
And it bursts, yeah
Let no woman or child
Go hungry tonight
Please protect us from the pain
And the hurt, yeah

I smell the sweet scents, sweet
Sweet scents of Heaven, Heaven
Tumblin' down, tumblin' down
Tumblin' down to the earth (Oh)
I hear the sweet sounds, sweet sounds
The sweet sounds, ooh, the sweet sounds of children
And they're praisin', praisin'
The land of their birth (No)

No, I'm not, not goin' to Hell
In some dusty motel
And I'm not, not goin' down
In the dirt (Yes, yes, yes)
I'm gonna laugh, I'm gonna laugh, I'm gonna cry, I'm gonna cry
Eat the bread, drink the wine
'Cause I'm finally, finally quenchin'
My thirst, yeah

You can't have a light without a little shadow, yeah
Always need a target for your bow and arrow
I want to be drenched in the rain of your heavenly love
Oh, yeah, c'mon (Oh)

Let the music, let the music play loud, play loud
Let it burst, let it burst through the clouds, through the clouds
And we all feel the heat
Of the sun, yeah
Yeah, let us sing, let us shout, let us shout
Let us all stand up proud
Let the old still believe
That they're young, yeah

Sweet, sweet sound

Sounds so sweet, oh, so sweet
Sounds so sweet, so sweet
Heaven, heaven
Down
Fallin' down, fallin' down
To this earth

I hear the sweet sounds of Heaven
Play me something, Stevie

I smell the sweet, sweet scents of Heaven
Comin' down (Comin' down), comin' down (Comin' down)
To the earth (From the earth)
Oh yeah, oh yeah
Oh yeah, oh yeah
Oh yeah, oh yeah, yeah
Yes, c'mon
Ooh, c'mon
C'mon, ooh, c'mon
C'mon, ooh, yeah, ooh, yeah, ooh

Hear the gods laughin' from above
Of Heaven
Fallin' down, fallin' down
To this earth, oh, oh, oh, oh
Let me lay down and sleep
Oh, oh, Heaven, Heaven
Ooh, ooh, ooh"
"31","Monkey Man","The Rolling Stones","Let It Bleed","","December 5, 1969","67133","184","31","","https://genius.com/The-rolling-stones-monkey-man-lyrics","105984","I'm a flea-bit peanut monkey
All my friends are junkies
That's not really true
I'm a cold Italian pizza
I could use a lemon squeezer
Would you do?
But I've been bit, and I've been tossed around
By every she-rat in this town
Have you, babe?

Well, I am just a monkey man
I'm glad you are a monkey woman too

I was bitten by a boar
I was gouged, and I was gored
But I pulled on through
Yes, I'm a sack of broken eggs
I always have an unmade bed
Don't you?
Well, I hope we're not too messianic
Or a trifle too satanic
We love to play the blues

Well, I am just a monkey man
I'm glad you are a monkey, monkey woman too, babe

I'm a monkey! I'm a monkey!
I'm a monkey, babe!  I'm a monkey, babe!
I'm a monkey! I'm a monkey! I'm a monkey! I'm a monkey!
M-m-m-monkey! M-m-m-m-monkey! I'm a m-m-m-monkey!
M-m-m-ma ma ma ma!
Ma ma ma ma ma
Ma ma ma ma ma monkey!
Ah! I'm a monkey!
Ah! Ah! Ah! Ah! ...."
"32","Shine a Light","The Rolling Stones","Shine a Light","","May 12, 1972","65667","259","33","","https://genius.com/The-rolling-stones-shine-a-light-lyrics","77875","Saw you stretched out in room 1009
With a smile on your face and a tear right in your eye
Oh, couldn't see to get a line on you
My sweet honey love

Berber jewelry jangling down the street
Make you flirt your eyes at every woman that you meet
Could not seem to get a high on you
My sweet honey love

May the good Lord shine a light on you
Make every song your favorite tune
May the good Lord shine a light on you
Warm like the evening sun

When you're drunk in the alley, baby, with your clothes all torn
And your late night friends leave you in the cold gray dawn
Whoa, just seemed too many flies on you
I just can't brush them off

Angels beating all their wings in time
With smiles on their faces and a gleam right in their eyes
Whoa, thought I heard one sigh for you
Come on up, come on up now, come on up now

May the good Lord shine a light on you, yeah
Make every song you sing your favorite tune
May the good Lord shine a light on you, yeah
Warm like the evening sun
Now, now, now, yeah

Come on up now, come on up now
Come on up now, come on up

May the good Lord shine a light on you
Make every song you sing your favorite tune
May the good Lord shine a light on you
Warm like the evening sun
Now, now, now, now, now, yeah
Yeah, yeah"
"33","Some Girls","The Rolling Stones","Shine a Light","","June 9, 1978","62457","316","54","","https://genius.com/The-rolling-stones-some-girls-lyrics","312174","Some girls give me money
Some girls buy me clothes
Some girls give me jewelry
That I never thought I'd own

Some girls give me diamonds
Some girls, heart attacks
Some girls I give all my bread to
I don't ever want it back

Some girls give me jewelry
Others buy me clothes
Some girls give me children
I never asked them for

So give me all your money
Give me all your gold
I'll buy you a house back in Zuma beach
And give you half of what I own

Some girls take my money
Some girls take my clothes
Some girls get the shirt off my back
And leave me with a lethal dose

Yeah
French girls they want Cartier
Italian girls want cars
American girls want everything in the world
You can possibly imagine

English girls they're so prissy
I can't stand them on the telephone
Sometimes I take the receiver off the hook
I don't want them to ever call at all

White girls they're pretty funny
Sometimes they drive me mad
Black girls just wanna get fucked all night
I just don't have that much jam

Chinese girls are so gentle
They're really such a tease
You never know quite what they're cooking
Inside those silky sleeves

Give me all you money
Give me all your gold
I'll buy you a house back in Zuma beach
And give you half of what I own

Yeah, baby, why don't you please come home?

Some girls they're so pure
Some girls so corrupt
Some girls give me children
I only made love to her once

Give me half your money
Give me half your car
Give me half of everything
I'll make you world's biggest star by half

So give me all your money
Give me all your gold
Let's go back to Zuma beach
I'll give you half of everything I own"
