"number","title","artist","album","album_release_date","release_date","pageviews","word_count","line_count","featured_artists","genius_url","genius_id","lyrics"
"1","Dreams","Fleetwood Mac","25 Years: The Chain","","February 4, 1977","1811332","252","38","","https://genius.com/Fleetwood-mac-dreams-lyrics","294002","(Mmm)

Now, here you go again
You say you want your freedom
Well, who am I to keep you down?
It's only right that you should
Play the way you feel it
But listen carefully to the sound
Of your loneliness

Like a heartbeat, (Heart) drives you mad (beat)
In the stillness (Still-) of remembering (-ness)
What you had (Lonely) and what you lost (Ooh, ooh)
And what you had (Ooh, ooh) and what you lost (Ooh)

Oh, thunder only happens when it's rainin'Players only love you when they're playing
Say, ""Women, they will come and they will go""
When the rain washes you clean, you'll know
You'll know

Now, here I go again
I see the crystal visions
I keep my visions to myself
It's only me who wants to
Wrap around your dreams
And have you any dreams you'd like to sell?
Dreams of loneliness

Like a heartbeat, (Heart) drives you mad (beat)
In the stillness (Still-) of remembering (-ness)
What you had (Lonely) and what you lost (Ooh, ooh)
And what you had (Ooh, ooh) Ooh, what you lost (Ah, ah)

Thunder only happens when it's rainin'
Players only love you when they're playing
Women, they will come and they will go
When the rain washes you clean, you'll know
Oh, thunder only happens when it's rainin'
Players only love you when they're playing
Say, ""Women, they will come and they will go""
When the rain washes you clean, you'll know

You'll know
You will know
Oh, you'll know"
"2","Landslide","Fleetwood Mac","25 Years: The Chain","","July 11, 1975","1306543","176","28","","https://genius.com/Fleetwood-mac-landslide-lyrics","6282","I took my love, took it down
I climbed a mountain and I turned around
And I saw my reflection in the snow-covered hills
'Til the landslide brought me down

Oh, mirror in the sky
What is love?
Can the child within my heart rise above?
Can I sail through the changin' ocean tides?
Can I handle the seasons of my life?
Hmm-hmm, hmm-hmm

Well, I've been afraid of changin'
'Cause I've built my life around you
But time makes you bolder
Even children get older
And I'm getting older too

Well, I've been afraid of changin'
'Cause I've built my life around you
But time makes you bolder
Even children get older
And I'm getting older too
Oh, I'm getting older too

Oh-oh, take my love, take it down
Oh-oh, climb a mountain and turn around
And if you see my reflection in the snow-covered hills
Well, the landslide bring it down

And if you see my reflection in the snow-covered hills
Well, the landslide will bring it down
Oh-ohh, the landslide bring it down"
"3","The Chain","Fleetwood Mac","25 Years: The Chain","","February 4, 1977","1012523","277","69","","https://genius.com/Fleetwood-mac-the-chain-lyrics","116175","(Fuck)

Listen to the wind blow
Watch the sun rise
Run in the shadows
Damn your love, damn your lies

And if you don't love me now
You will never love me again
I can still hear you sayin'
You would never break the chain
(
Never break the chain
)
And if you don't love me now
(
You don't love me now
)
You will never love me again
I can still hear you sayin'
(Still hear you saying)
You would never break the chain
(
Never break the chain
)

Listen to the wind blow
Down comes the night
Run in the shadows
Damn your love, damn your lies
Break the silence
Damn the dark, damn the light

And if you don't love me now
You will never love me again
I can still hear you sayin'
You would never break the chain
(
Never break the chain
)
And if you don't love me now
(
You don't love me now
)
You will never love me again
I can still hear you sayin'
(Still hear you saying)
You would never break the chain
(
Never break the chain
)
And if you don't love me now
(
You don't love me now
)
You will never love me again
I can still hear you sayin'
(Still hear you saying)
You would never break the chain
(
Never break the chain
)

Chain keep us together
Run in the shadow
Chain keep us together
Runnin' in the shadow
Chain keep us together
Runnin' in the shadow
Chain keep us together
Run in the shadow
Chain keep us together
Run in the shadow
Chain"
"4","Silver Springs","Fleetwood Mac","25 Years: The Chain","","December 1976","974919","248","41","","https://genius.com/Fleetwood-mac-silver-springs-lyrics","118390","You could be my silver spring
Blue-green colors flashin'
I would be your only dream
Your shinin' autumn ocean crashin'

And don't say that she's pretty
And did you say that she loved you?
Baby, I don't wanna know

So, I begin not to love you
Turn around, see me running
I say, ""I loved you years ago""
Tell myself you never loved me, no

And don't say that she's pretty
And did you say that she loved you?
Baby, I don't wanna know, oh, no
And can you tell me, was it worth it?
Baby, I don't wanna know

Time cast a spell on you
But you won't forget me
I know I could have loved you
But you would not let me

Time cast a spell on you
But you won't forget me
Well, I know I could have loved you
But you would not let me
I'll follow you down
'Til the sound of my voice will haunt you
Oh, give me just a chance
You'll never get away from the sound
Of the woman that loved you
Was I just a fool?
I'll follow you down
'Til the sound of my voice will haunt you
Give me just a chance
You'll never get away from the sound
Of the woman that loved you

Time cast a spell on you
But you won't forget me
I know I could have loved you
But you would not let me
I'll follow you down
'Til the sound"
"5","Rhiannon","Fleetwood Mac","25 Years: The Chain","","July 11, 1975","554098","207","38","","https://genius.com/Fleetwood-mac-rhiannon-lyrics","267752","Rhiannon rings like a bell through the night, and
Wouldn't you love to love her?
Takes to the sky like a bird in flight, and
Who will be her lover?

All your life you've never seen, woman
Taken by the wind
Would you stay if she promised you heaven?
Will you ever win?

She is like a cat in the dark, and then
She is the darkness
She rules her life like a fine skylark, and when
The sky is starless

All your life you've never seen, woman
Taken by the wind
Would you stay if she promised you heaven?
Will you ever win?
Will you ever win?

Rhiannon
Rhiannon
Rhiannon
Rhiannon

She rings like a bell through the night, and
Wouldn't you love to love her?
She rules her life like a bird in flight, and
Who will be her lover?

All your life you've never seen, woman
Taken by the wind
Would you stay if she promised you heaven?
Will you ever win?
Will you ever win?

Rhiannon
Rhiannon
Rhiannon

Taken by, taken by the sky (Ah-ah...)
Taken by, taken by the sky (Ah-ah...)
Taken by, taken by the sky (Ah-ah...)

Dreams unwind, love's a state of mind...
Dreams unwind, love's a state of mind"
"6","Go Your Own Way","Fleetwood Mac","25 Years: The Chain","","December 20, 1976","444620","200","25","","https://genius.com/Fleetwood-mac-go-your-own-way-lyrics","98481","Loving you isn't the right thing to do
How can I ever change things that I feel?
If I could, maybe I'd give you my world
How can I when you won't take it from me?

You can go your own way,
go your own way
You can call it another lonely day
You can go your own way,
go your own way

Tell me why everything turned around
Packing up, shacking up's all you wanna do
If I could, baby, I'd give you my world
Open up, everything's waiting for you

You can go your own way, go your own way
You can call it another lonely day
You can go your own way, go your own way

(Ah!) You can go your own way, go your own way
You can call it another lonely day, another lonely day
You can go your own way, go your own way
You can call it another lonely day, another lonely day

You can call it another lonely day, another lonely day
You can call it another lonely day, another lonely day
You can call it another lonely day, oh, yeah, oh, yeah
You can call it another lonely day
Lonely day"
"7","Gypsy","Fleetwood Mac","25 Years: The Chain","","June 18, 1982","290349","195","31","","https://genius.com/Fleetwood-mac-gypsy-lyrics","185180","So I'm back, to the velvet underground
Back to the floor, that I love
To a room with some lace and paper flowers
Back to the gypsy that I was
To the gypsy that I was

And it all comes down to you
Well you know that it does
And lightning strikes, maybe once, maybe twice
Oh, and it lights up the night
And you see your gypsy
You see your gypsy

To the gypsy that remains
Faces freedom with a little fear
I have no fear, I have only love
And if I was a child
And the child was enough
Enough for me to love
Enough to love

She is dancing away from me now
She was just a wish
She was just a wish
And a memory is all that is left for you now
You see your gypsy, oh
You see your gypsy

Lightning strikes, maybe once, maybe twice
And it all comes down to you
And it all comes down to you
Lightning strikes, maybe once, maybe twice
And it all comes down to you
I still see your bright eyes, bright eyes
And it all comes down to you"
"8","Songbird","Fleetwood Mac","25 Years: The Chain","","February 4, 1977","283192","126","20","","https://genius.com/Fleetwood-mac-songbird-lyrics","266861","For you, there'll be no more crying
For you, the sun will be shining
And I feel that when I'm with you
It's alright, I know it's right
To you, I will give the world
To you, I'll never be cold
'Cause I feel that when I'm with you
It's alright, I know it's right

And the songbirds are singing
Like they know the score
And I love you, I love you, I love you
Like never before

And I wish you all the love in the world
But most of all, I wish it from myself

And the songbirds keep singing
Like they know the score
And I love you, I love you, I love you
Like never before

Like never before
Like never before"
"9","Everywhere","Fleetwood Mac","25 Years: The Chain","","April 13, 1987","251563","199","35","","https://genius.com/Fleetwood-mac-everywhere-lyrics","382874","Calling out your name
Calling out your name

Can you hear me calling out your name?
You know that I'm falling and I don't know what to say
I'll speak a little louder, I'll even shout
You know that I'm proud and I can't get the words out

Oh, I
I wanna be with you everywhere
Oh, I
I wanna be with you everywhere
(
I wanna be with you everywhere
)

Something's happening, happening to me
My friends say I'm acting peculiarly
Come along, baby, we better make a start
You better make it soon before you break my heart

Oh, I
I wanna be with you everywhere
Oh, I
I wanna be with you everywhere
(I wanna be with you everywhere)

Can you hear me calling out your name?
You know that I'm falling and I don't know what to say
Come along, baby, we better make a start
You better make it soon before you break my heart

Oh, I
I wanna be with you everywhere
Oh, I
I wanna be with you everywhere
Oh, I
I wanna be with you everywhere
Oh, I
I wanna be with you everywhere
(I wanna be with you everywhere)"
"10","Gold Dust Woman","Fleetwood Mac","25 Years: The Chain","","February 4, 1977","227857","209","39","","https://genius.com/Fleetwood-mac-gold-dust-woman-lyrics","399871","Rock on, gold dust woman
Take your silver spoon, dig your grave
Heartless challenge
Pick your path and I'll pray
Wake up in the mornin'
See your sunrise, loves to go down
Lousy lovers pick their prey
But they never cry out loud, cry out

Well, did she
make you cry?
Make you break down?
Shatter your illusions of love?
And is it over now? Do you know how?
Pick up the pieces and go home

Rock on, ancient queen
Follow those who pale in your shadow
Rulers make bad lovers
You better put your kingdom up for sale, up for sale

Well, did she
make you cry?
Make you break down?
Shatter your illusions of love?
Well, is it over now? Do you know how?
Pick up the pieces and go home
Well, did she make you cry?
Make you break down?
Shatter your illusions of love?
And now tell me, is it over now? Do you know how
To pick up the pieces and go home?

And go home, and go home

Ooh, pale shadow of a woman
Black widow
Pale shadow of a dragon
Dust woman
Ooh, pale shadow of a woman
Ooh, black widow
Ooh, pale shadow, she's a dragon
Gold dust woman
Woman, woman"
"11","You Make Loving Fun","Fleetwood Mac","25 Years: The Chain","","February 4, 1977","216713","157","20","","https://genius.com/Fleetwood-mac-you-make-loving-fun-lyrics","378467","Sweet, wonderful you
You make me happy with the things you do
Oh, can it be so?
This feeling follows me wherever I go

I never did believe in miracles
But I've a feeling it's time to try
I never did believe in the ways of magic
But I'm beginning to wonder why

I never did believe in miracles
But I've a feeling it's time to try
I never did believe in the ways of magic
But I'm beginning to wonder why

Don't, don't break the spell
It would be different and you know it will
You, you make loving fun
And I don't have to tell you, but you're the only one

You, you make loving fun (It's all I want to do)
You, you make loving fun (It's all I want to do)
You, you make loving fun (It's all I want to do)
You, you make loving fun (It's all I want to do)"
"12","Little Lies","Fleetwood Mac","25 Years: The Chain","","August 29, 1987","209074","306","87","","https://genius.com/Fleetwood-mac-little-lies-lyrics","429777","​

If I could turn the page
In time then I'd rearrange
Just a day or two
Close my, close my, close my eyes
But I couldn't find a way
So I'll settle for one day
To believe in you
Tell me, tell me, tell me lies

Tell me lies
Tell me sweet little lies
(
Tell me lies
,
tell me, tell me lies
)
Oh, no, no, you can't disguise
(
You can't disguise
,
no, you can't disguise
)
Tell me lies
Tell me sweet little lies

Although I'm not making plans
I hope that you understand
There's a reason why
Close your, close your, close your eyes
No more broken hearts
We're better off apart
Let's give it a try
Tell me, tell me, tell me lies

Tell me lies
Tell me sweet little lies
(
Tell me lies
,
tell me, tell me lies
)
Oh, no, no, you can't disguise
(
You can't disguise
,
no, you can't disguise
)
Tell me lies
Tell me sweet little lies

{​Bridge}​

If I could turn the page
In time then I'd rearrange
Just a day or two
Close my, close my, close my eyes
But I couldn't find a way
So I'll settle for one day
To believe in you
Tell me, tell me, tell me lies

Tell me lies
Tell me sweet little lies
(
Tell me lies
,
tell me, tell me lies
)
Oh, no, no, you can't disguise
(
You can't disguise
,
no, you can't disguise
)
Tell me lies
Tell me sweet little lies
(
Tell me lies
,
tell me, tell me lies
)
Oh, no, no, you can't disguise
(
You can't disguise
,
no, you can't disguise
)
Tell me lies
Tell me sweet little lies
(
Tell me, tell me lies
)"
"13","Never Going Back Again","Fleetwood Mac","25 Years: The Chain","","February 4, 1977","208034","57","12","","https://genius.com/Fleetwood-mac-never-going-back-again-lyrics","399852","She broke down and let me in
Made me see where I'd been

Been down one time
Been down two times
I'm never going back again
Mmm

Mmm, you don't know what it means to win
Come 'round and see me again

Been down one time
Been down two times
Mmm, I'm never going back again
Mmm"
"14","Sara","Fleetwood Mac","25 Years: The Chain","","December 5, 1979","199365","276","47","","https://genius.com/Fleetwood-mac-sara-lyrics","399950","Wait a minute, baby
Stay with me awhile
Said you'd give me light
But you never told me 'bout the fire

Drowned in, in the sea of love
Where everyone would love to drown
But now it's gone, it doesn't matter what for
When you build your house, then call me home

And he was just like a great dark wing
Within the wings of a storm
I think I had met my match
He was singin'
And undoing
And undoing
Ooh, the laces
Undoing the laces

Said, ""Sara, you're the poet in my heart
Never change, never stop""
But now it's gone, it doesn't matter what for
But when you build your house, oh, then call me home

Hold on, the night is coming
And the starling flew for days
I'd stay home at night all the time
I'd go anywhere, anywhere, anywhere
Ask me and I'm there, yeah
Ask me and I'm there 'cause I care

In the sea of love
Where every woman would love to drown
But now it's gone, they say it doesn't matter anymore
Oh, if you build your house, then please call me home
Sara, you're the poet in my heart
Never change and don't you ever stop
And now it's gone, no, it doesn't matter anymore
When you build your house, I'll come by

Oh, Sara
Oh, oh
Ooh, Sara
(Ooh, ooh)
Crazy, there's a heartbeat that never really died
(Ooh)
Crazy that it never really died
(Sara)
Oh, would you swallow all your pride? (Whoa)
(Ooh, Sara)
Oh, would you speak a little louder? (Whoa)
(Ooh)
All I ever wanted was to know that you are dreaming"
"15","Tusk","Fleetwood Mac","25 Years: The Chain","","October 12, 1979","150576","95","18","USC Trojan Marching Band","https://genius.com/Fleetwood-mac-tusk-lyrics","128196","How are the tenors, Johnny?

Why don't you ask him if he's gonna stay?
Why don't you ask him if he's going away?

Why don't you tell me what's going on?
Why don't you tell me who's on the phone?

Why don't you ask him what's going wrong?
Why don't you ask him the latest on his throne?
(Ooga-aga-ooga)

Don't say that you love me (Hiyee)
Just tell me that you want me (Hiyee)
Tusk!
Just say that you want me (Hiyee)
Don't tell me that you—

Tusk!
(Real savage-like)

Tusk!
Tusk!
Tusk! Tusk! Tusk!"
"16","Second Hand News","Fleetwood Mac","25 Years: The Chain","","February 4, 1977","139420","309","48","","https://genius.com/Fleetwood-mac-second-hand-news-lyrics","399848","I know there's nothing to say
Someone has taken my place

When times go bad, when times go rough
Won't you lay me down in the tall grass
And let me do my stuff?

I know I got nothin' on you
I know there's nothing to do

When times go bad and you can't get enough
Won't you lay me down in the tall grass
And let me do my stuff?

Do it
Bow, bow, bow, bow, ba-bow, bow, bow, bow, bow
Ba-bow, bow, bow, bow, bow, ba-bow, bow, bow
Doot, do-do-doot do
Bow, bow, bow, bow, ba-bow, bow, bow, bow, bow
Ba-bow, bow, bow, bow, bow, ba-bow, bow, bow, yeah

One thing I think you should know
I ain't gonna miss you when you go
[Refrain:
Lindsey Buckingham & Stevie Nicks
]
Been down so long, I've been tossed around enoughOh, couldn't you just let me go down
And do my stuff?

I know you're hoping to find
Someone who's going to give you peace of mind

When times go bad, when times go rough
Won't you lay me down in the tall grass
And let me do my stuff?

Do it!
Bow, bow, bow, bow, ba-bow, bow, bow, bow, bow
Ba-bow, bow, bow, bow, bow, ba-bow, bow, bow
Doot, do-do-doot do
Bow, bow, bow, bow, ba-bow, bow, bow, bow, bow
Ba-bow, bow, bow, bow, bow, ba-bow, bow, bow
Do it, do it, do it!
Bow, bow, bow, bow, ba-bow, bow, bow, bow, bow
Ba-bow, bow, bow, bow, bow, ba-bow, bow, bow
Doot, do-do-doot do
Bow, bow, bow, bow, ba-bow, bow, bow, bow, bow
Ba-bow, bow, bow, bow, bow, ba-bow, bow, bow

I'm just second-hand newsI'm just second-hand news, yeah
I'm just second-hand news
I'm just second-hand news, yeah
I'm just second-hand news
I'm just second-hand news, yeah
I'm just second-hand news
I'm just second-hand news, yeah
Yeah"
"17","Seven Wonders","Fleetwood Mac","50 Years – Don’t Stop","","April 13, 1987","132053","304","45","","https://genius.com/Fleetwood-mac-seven-wonders-lyrics","400030","So long ago
Certain place
Certain time
You touched my hand
On the way
On the way down to Emmeline

But if our paths never cross
Well, you know I'm sorry, but

If I live to see the seven wonders
I'll make a path to the rainbow's end
I'll never live to match the beauty again

The rainbow's end
(Aaron)
(Aaron)

So it's hard to find
Someone with that kind of intensity
You touched my hand, I played it cool
And you reached out your hand to me

But if our paths never cross
Well, no, I'm not sorry, but

If I live to see the seven wonders
I'll make a path to the rainbow's end
I'll never live to match the beauty again

The rainbow's end
(Aaron)
(Aaron)

So long ago
It's a certain time
It's a certain place
You touched my hand, and you smiled
All the way back, you held out your hand

If I hope and if I pray
Ooh, it might work out someday

If I live to see the seven wonders
I'll make a path to the rainbow's end
I'll never live to match the beauty again

If I live to see the seven wonders (if I live to see the seven wonders)
I'll make a path to the rainbow's end (I'll make a path there)
I'll never live to match the beauty again (I'll never live to see that beauty, that beauty, that same same beauty again)

If I live to see the seven wonders (if I live to see the)
I'll make a path to the rainbow's end
I'll never live to match the beauty again
(Well, if I hope and I pray)
(Well, maybe it might work out someday)

If I live to see the seven wonders (if I live to see the seven wonders)"
"18","Don’t Stop","Fleetwood Mac","25 Years: The Chain","","February 4, 1977","122396","188","32","","https://genius.com/Fleetwood-mac-dont-stop-lyrics","399855","If you wake up and don't wanna smile
If it takes just a little while
Open your eyes and look at the day
You'll see things in a different way

Don't stop thinkin' about tomorrow
Don't stop, it'll soon be here
It'll be better than before
Yesterday's gone, yesterday's gone

Why not think about times to come
And not about the things that you've done?
If your life was bad to you
Just think what tomorrow will do

Don't stop thinkin' about tomorrow
Don't stop, it'll soon be here
It'll be better than before
Yesterday's gone, yesterday's gone

All I want is to see you smile
If it takes just a little while
I know you don't believe that it's true
I never meant any harm to you

Don't stop thinkin' about tomorrow
Don't stop, it'll soon be here
It'll be better than before
Yesterday's gone, yesterday's gone
Don't stop thinkin' about tomorrow
Don't stop, it'll soon be here
It'll be better than before
Yesterday's gone, yesterday's gone

Ooh, don't you look back
Ooh, don't you look back
Ooh, don't you look back
Ooh, don't you look back"
"19","Say You Love Me","Fleetwood Mac","25 Years: The Chain","","July 11, 1975","106413","274","40","","https://genius.com/Fleetwood-mac-say-you-love-me-lyrics","399772","Have mercy, baby, on a poor girl like me
You know I'm fallin', fallin', fallin' at your feet
I'm tinglin' right from my head to my toes
So help me, help me, help me make the feelin' go

'Cause when the lovin' starts and the lights go down
And there's not another livin' soul around
You woo me until the sun comes up
And you say that you love me

Have pity, baby, just when I thought it was over
Now you got me runnin', runnin', runnin' for cover
I'm beggin' you for a little sympathy
And if you use me again, it'll be the end of me

'Cause when the lovin' starts and the lights go down
And there's not another livin' soul around
You woo me until the sun comes up
And you say that you love me

Baby, baby, hope you're gonna stay away
'Cause I'm gettin' weaker, weaker every day
I guess I'm not as strong as I used to be
And if you use me again, it'll be the end of me

'Cause when the lovin' starts and the lights go down
There's not another livin' soul around
You woo me until the sun comes up
And you say that you love me
'Cause when the lovin' starts and the lights go down
There's not another livin' soul around
You woo me until the sun comes up
And you say that you love me
Say that you love me
Say that you love me

[Outro: Fleetwood Mac,
Lindsey Buckingham
]
Fallin', fallin', fallin'
Fallin', fallin', fallin'
(Yeah)
Fallin', fallin', fallin'
Fallin', fallin', fallin'
Fallin', fallin', fallin'
Fallin', fallin', fallin'"
"20","I Don’t Want to Know","Fleetwood Mac","Rumours (Super Deluxe)","","February 4, 1977","101028","259","38","","https://genius.com/Fleetwood-mac-i-dont-want-to-know-lyrics","399862","I don't want to know the reasons why love keeps
Right on walkin' on down the line
I don't want to stand between you and love, honey
I just want you to feel fine
I don't want to know the reasons why love keeps
Right on walkin' on down the line
I don't want to stand between you and love, honey
I just want you to feel fine

Finally, baby
The truth has come down, now
Take a listen to your spirit
It's cryin' out loud
Trying to believe

Oh, you say you love me, but you don't know
You got me rockin' and a-reeling
Oh, yeah, uh-huh

I don't want to know the reasons why love keeps
Right on walkin' on down the line
I don't want to stand between you and love, honey
I just want you to feel fine
I don't want to know the reasons why love keeps
Right on walkin' on down the line
I don't want to stand between you and love, honey
I just want you to feel fine

Finally, baby
The truth has been told
Now, you tell me that I'm crazy
It's nothing that I didn't know
Trying to survive

Oh, you say you love me, but you don't know
You got me rockin' and a-reeling
Hanging on to you
Oh, yeah, uh-huh

I don't want to know the reasons why love keeps
Right on walkin' on down the line
I don't want to stand between you and love, honey
Take a little time

Ah, I don't want to know"
