"number","title","artist","album","album_release_date","release_date","pageviews","word_count","line_count","featured_artists","genius_url","genius_id","lyrics"
"44","The Green Manalishi (With the Two Prong Crown)","Fleetwood Mac","1969 to 1974 (Tracks 1-82)","","September 19, 1969","15284","101","12","","https://genius.com/Fleetwood-mac-the-green-manalishi-with-the-two-prong-crown-lyrics","1116007","Now, when the day goes to sleep and the full moon looks
The night is so black that the darkness cooks
Don't you come creepin' around
Makin' me do things I don't wanna do

Can't believe that you need my love so bad
Come sneakin' around tryin' to drive me mad
Bustin' in on my dreams
Makin' me see things I don't wanna see

'Cause you're da Green Manalishi with the two prong crown
All my tryin' is up all your bringin' is down
Just takin' my love then slippin' away
Leavin' me here just tryin' to keep from followin' you"
"45","Blue Letter","Fleetwood Mac","Fleetwood Mac (2018 Expanded)","","July 11, 1975","15245","208","34","","https://genius.com/Fleetwood-mac-blue-letter-lyrics","399761","It was a blue letter she wrote to me
Its silver words she told
Wanna be on the road to paradise
I want a lover who don't get old

Do I read a message in your eyes?
You want a love to stay another night
Baby, when your day goes down
I won't be waitin' around for you

For every voice you've ever heard
There's a thousand without a word
Redbird, don't say you told me so
Give me one more song to go

Do I read a message in your eyes?
You want a love to stay another night
Baby, when your day goes down
I won't be waitin' around for you
Oh, yeah

For every voice you've ever heard
There's a thousand without a word
Redbird, don't say you told me so
Give me one more song to go

Do I read a message in your eyes?
You want a love to stay another night
Baby, when your day goes down
I won't be waitin' around for you

I, I ain't waitin'
I, I ain't waitin'
I, I ain't waitin'
I, I ain't waitin', come on
I, I ain't waitin'
I, I ain't waitin'
I, I ain't waitin'
I, I ain't waitin'
I, I ain't waitin'"
"46","Peacekeeper","Fleetwood Mac","50 Years – Don’t Stop","","April 15, 2003","15093","165","25","","https://genius.com/Fleetwood-mac-peacekeeper-lyrics","400190","We make all of our suns the same
Every one will suffer the fire we've made
They all explode just the same
And there's no going back on the plans we've made

Peacekeeper take your time
Wait for the dark of night
Soon all the suns will rise

Peacekeeper don't tell why
Don't be afraid to fight
Love is the sweet surprise
Ooh, ooh

Only creatures who are on their way
Ever poison their own well
But we still have time to hate
And there's still something we can sell

When the night is cold and still
When you thought you'd had your fill
Take all the time you will
This is not a test, it's not a drill
Take no prisoners, only kill
Ooh, ooh

You know all of our friends are gods
And they all tell us how to paint our face
But there's only one brush we need
It's the one that never leaves a trace (leaves a trace, leaves a trace)"
"47","Future Games","Fleetwood Mac","1969 to 1974 (Tracks 1-82)","","September 3, 1971","13984","360","60","","https://genius.com/Fleetwood-mac-future-games-lyrics","399662","I did a thing last night
You know, those future games
I turned off all the lights
Oh, the future came
You were by my side
Will you explain?

Oh yeah
Real rhyme or reason for those future games

Now, you were there last night
And oh, were you afraid
Of things we'd come upon
While playin' future games
But baby, it's alright
And so have faith

Oh yeah
You invent the future that you want to face

How many people sit home at night
Wonderin' if they still will be here tonight?
Wonderin' if children they bring to the light
Inherit the world or inherit the night?
Wonderin' if neighbors are thinkin' the same
All of the wild things tomorrow will tame
Talking of journeys that happen in vain
Well, I know I'm not the only one
To ever spend my life sittin' playing future games

You better take your time
You know there's no escape
The future sends a sign
Of things we will create
Baby, it's alright
And so have faith

Oh yeah
You invent the future that you want to face

How many people sit home at night
Wonderin' if this day will be here tonight?
Wonderin' if children they bring to the light
Inherit the world or inherit the night?
Wonderin' if neighbors are thinkin' the same
All of the wild things tomorrow will tame
Talkin' of journeys that happen in vain
Well, I know I'm not the only one
To ever spend my life sittin' playing future games

Future games
Future games
Future games
Future games

I know I'm not the only one
I know I'm not the only one
I know I'm not the only one
I know I'm not the only one
I know I'm not the only one
I know I'm not the only one
I know I'm not the only one
I know I'm not the only one
I know I'm not the only one
I know I'm not the only one
I know I'm not the only one
I know I'm not the only one
I know I'm not the only one
I know I'm not the only one"
"48","Oh Well - Parts I & II","Fleetwood Mac","Spotlight Special Presents Fleetwood Mac","","","13983","83","11","","https://genius.com/Fleetwood-mac-oh-well-parts-i-and-ii-lyrics","2188913","Can't help about the shape I'm in
I can't sing, I ain't pretty and my legs are thin
But don't ask me what I think of you
I might not give the answer that you want me to

Oh well

Now when I talk to God
I know he understands
He said ""stick by me and I'll be your guiding hand""
But don't ask me what I think of you
I might not give the answer that you want me to

Oh well"
"49","Silver Springs (Live 1997) (Edit)","Fleetwood Mac","50 Years – Don’t Stop","","November 16, 2018","13948","236","36","","https://genius.com/Fleetwood-mac-silver-springs-live-1997-edit-lyrics","1377921","You could be my silver spring
Blue green colors flashing
I would be your only dream
Your shining autumn ocean crashing
And did you say she was pretty?
And did you say that she loves you?
Baby, I don't wanna know

I begin not to love you
Turn around, see me running
I say I loved you years ago
Tell myself you never loved me, no
And did you she was pretty?
And did you say that she loves you?
Baby, I don't wanna know
Oh, no
And can you tell me was it worth it?
Really, I don't wanna know

Time casts a spell on you
But you won't forget me
I know I could have loved you
But you would not let me

Time casts a spell on you
But you won't forget me
I know I could have loved you
But you would not let me
I'll follow you down
'Til the sound of my voice will haunt you (Was I just a fool?)
You'll never get away from the sound
Of the woman that loves you (Was I just a fool?)
I'll follow you down
'Til the sound of my voice will haunt you (Give me just a chance)
You'll never get away from the sound
(Never get away, never get away, never get away)
Of the woman that loves you

You could be my silver spring
My blue green colors flashing"
"50","Warm Ways","Fleetwood Mac","25 Years: The Chain","","July 11, 1975","13707","66","12","","https://genius.com/Fleetwood-mac-warm-ways-lyrics","399758","Sleep easy by my side
Into gentle slumber you can hide
I, I'm waiting for the sun to come up
I can't sleep with your warm ways

Forever, forever love
Together, together love

You made me a woman tonight
Dream until the morning light
I, I'm waiting for the sun to come up
I can't sleep with your warm ways

Forever, forever love
Together, together love"
