"number","title","artist","album","album_release_date","release_date","pageviews","word_count","line_count","featured_artists","genius_url","genius_id","lyrics"
"21","Over My Head","Fleetwood Mac","25 Years: The Chain","","July 11, 1975","98102","160","25","","https://genius.com/Fleetwood-mac-over-my-head-lyrics","571312","You can take me to the paradise
And then again, you can be cold as ice
I'm over my head (Over my head)
Oh, but it sure feels nice

You can take me anytime you like
I'll be around if you think you might
Love me, baby (Over my head)
And hold me tight

Your mood is like a circus wheel
You're changing all the time
Sometimes I can't help but feel
That I'm wasting all of my time

(Over my head) Mmm

Your mood is like a circus wheel
You're changing all the time
Sometimes I can't help but feel
That I'm wasting all of my time

I think I'm looking on the dark side
But every day, you hurt my pride
I'm over my head (Over my head)
Oh, but it sure feels nice
I'm over my head (Over my head)
But it sure feels nice
I'm over my head (Over my head)
But it sure feels nice"
"22","Storms","Fleetwood Mac","25 Years: The Chain","","October 12, 1979","83215","233","39","","https://genius.com/Fleetwood-mac-storms-lyrics","399955","Every night that goes between
I feel a little less
As you slowly go away from me
This is only another test
Every night you do not come
Your softness fades away
Did I ever really care that much?
Is there anything left to say?

Every hour of fear I spend
My body tries to cry
Living through each empty night
A deadly calm inside

I haven't felt this way I feel
Since many a year ago
But in those years are the lifetimes past
I did not deal with the road
And I did not deal with you, I know
Though the love has always been
So I search to find an answer there
So I can truly win

Every hour of fear I spend
My body tries to cry
Living through each empty night
A deadly calm inside

So I try to say goodbye, my friend
I'd like to leave you with something warm
But never have I been a blue calm sea
I have always been a storm
Always been a storm
Ooh, always been a storm
I have always been a storm

We were frail
She said, ""Every night he will break your heart"" (Storm)
I should have known from the first
I'd be the brokenhearted (Storm)
(Storm)
I loved you from the start (Storm)
Save us
(Storm) And not all the prayers in the world will save us"
"23","Oh Daddy","Fleetwood Mac","Rumours (Super Deluxe)","","February 4, 1977","71235","229","51","","https://genius.com/Fleetwood-mac-oh-daddy-lyrics","399866","Oh, daddy
You know you make me cry
How can you love me
I don't understand why

Oh, daddy
If I can make you see
If there's been a fool around
It's got to be me
Yes, it's got to be me

Oh, daddy
You soothe me with your smile
You're letting me know
You're the best thing in my life

Oh, daddy
If I can make you see
If there's been a fool around
It's got to be me
Yes, it's got to be me

Why are you right when I'm so wrong?
(
So wrong
)
I'm so weak but you're so strong
(
Ooh, never so strong
)
Everything you do is just all right
And I can't walk away from you
Baby, if I tried

Why are you right when I'm so wrong?
(
Ooh, so wrong
)
I'm so weak but you're so strong
(
Ooh, never so strong
)
Everything you do is just all right
And I can't walk away from you
Baby, if I tried

Oh, daddy
You soothe me with your smile
You're letting me know
You're the best thing in my life

Oh, daddy
If I can make you see
If there's been a fool around
It's got to be me
Yes, it's got to be me

Yes, it's got to be me
Yes, it's got to be me"
"24","Oh Well (Part 1)","Fleetwood Mac","1969 to 1974 (Tracks 1-82)","","September 26, 1969","53526","91","12","","https://genius.com/Fleetwood-mac-oh-well-part-1-lyrics","399636","I can't help about the shape I'm in
I can't sing, I ain't pretty and my legs are thin
But don't ask me what I think of you
I might not give the answer that you want me to
Oh, well

Now, when I talked to God, I knew he'd understand
He said, ""Stick by me and I'll be your guiding hand
But don't ask me what I think of you
I might not give the answer that you want me to""
Well

Oh, well, oh, well
Well, well, well, well"
"25","Big Love","Fleetwood Mac","25 Years: The Chain","","March 23, 1987","47576","142","47","","https://genius.com/Fleetwood-mac-big-love-lyrics","128184","Looking out for love
In the night so still
Oh, I'll build you a kingdom
In that house on the hill

Looking out for love
Big, big love

You said that you love me
And that you always will
Oh, you begged me to keep you
In that house on the hill

Looking out for love
Big, big love

Ooh, ah
Ooh, ah
Ooh, ah
Ooh, ah

I wake up
Alone with it all
I wake up
But only to fall

Looking out for love
Big, big love
Just looking out for love
Big, big love

Ooh, ah
Ooh, ah
Ooh, ah
Ooh, ah
Ooh, ah
Ooh, ah
Ooh, ah
Ooh, ah
Ooh, ah
Ooh, ah
Ooh, ah
Ooh, ah
Ooh, ah
Ooh, ah
Ooh, ah
Ooh, ah
Ooh, ah
Ooh, ah
Ooh, ah
Ooh, ah
Ooh, ah
Ooh, ah
Ooh, ah"
"26","Hold Me","Fleetwood Mac","50 Years – Don’t Stop","","June 18, 1982","37124","208","30","","https://genius.com/Fleetwood-mac-hold-me-lyrics","400035","Can you understand me?
Baby, don't you hand me a line
Although it doesn't matter
You and me got plenty of time
There's nobody in the future
So baby, let me hand you my love
Oh, there's no step for you to dance to
So slip your hand inside of my glove

Hold me, hold me, hold me
(Come on and) Hold me, hold me, hold me

I don't want no damage
But how'm I going to manage you?
Oh, you want a percentage
But I'm the fool payin' the dues
Oh, I'm-a just around the corner
If you got a minute to spare
I'll be waitin' for ya
If you ever wanna be there

Hold me, hold me, hold me
(Come on and) Hold me, hold me, hold me
(Why won't you?) Hold me, hold me, hold me
(Come on and) Hold me, hold me, hold me

(Come on and) Hold me, hold me, hold me
(Come on and) Hold me, hold me, hold me
(Come on and) Hold me, hold me, hold me
(Come on and) Hold me, hold me, hold me

Hold me, hold me, hold me
Hold me, hold me, hold me
Hold me, hold me, hold me
Hold me, hold me, hold me"
"27","Sisters of the Moon","Fleetwood Mac","25 Years: The Chain","","October 12, 1979","35922","128","24","","https://genius.com/Fleetwood-mac-sisters-of-the-moon-lyrics","399967","Intense silence
As she walked in the room
Her black robes trailing
Sister of the moon
And a black widow spider makes
More sound than she
And black moons in those eyes of hers
Made more sense to me
Heavy persuasion
It was hard to breathe
She was dark at the top of the stairs
She called to me

And so I followed
As friends often do
I cared not for love nor money
And I think she knew
Well the people, they love her
But still they're the most cruel
She asked me, be my sister
Sister, sister of the moon

Some call her sister of the moon
Some say illusions are her game
They like to wrap her in velvet
Does anyone, ooh, know her name?"
"28","Don’t Stop (Live 1977)","Fleetwood Mac","Rumours (Super Deluxe)","","","35601","189","32","","https://genius.com/Fleetwood-mac-dont-stop-live-1977-lyrics","6996080","If you wake up and don't wanna smile
If it takes just a little while
Open your eyes and look at the day
You'll see things in a different way

Don't stop thinking about tomorrow
Don't stop, it'll soon be here
It'll be better than before
Yesterday's gone, yesterday's gone

Why not think about times to come
And not about the things that you've done?
If your life was bad to you
Just think what tomorrow will do

Don't stop thinking about tomorrow
Don't stop, it'll soon be here
It'll be better than before
Yesterday's gone, yеsterday's gone

All I want is to see you smile
If it takеs just a little while
I know you don't believe that it's true
I never meant any harm to you

Don't stop thinking about tomorrow
Don't stop, it'll soon be here
It'll be better than before
Yesterday's gone, yesterday's gone
Don't stop thinking about tomorrow
Don't stop, it'll soon be here
It'll be better than before
Yesterday's gone, yesterday's gone

Ooh, don't you look back
Ooh, don't you look back
Ooh, don't you look back
Ooh, no, don't you look back"
"29","Monday Morning","Fleetwood Mac","50 Years – Don’t Stop","","July 11, 1975","34530","236","32","","https://genius.com/Fleetwood-mac-monday-morning-lyrics","399742","Monday morning, you sure look fine
Friday, I got travelin' on my mind
First you love me, and then you fade away
I can't go on believing this way
I got nothing but love for you
Tell me what you really want to do
First you love me, then you get on down the line

But I don't mind
I don't mind, yeah

I'll be there if you want me to
No one else that could ever do
Got to get some peace in my mind

Monday morning, you sure look fine
Friday, I got travelin' on my mind
First you love me, and then you say it's wrong
You know I can't go on believing for long
But you know it's true (Yes)
You only want me when I get over you
First you love me, then you get on down the line

But I don't mind
No, I don't mind, yeah

I'll be there if you want me to
No one else that could ever do
Got to get some peace in my mind

But you know it's true
You know you only want me when I get over you
Oh, first you love me, then you get on down the line

But I don't mind
No, I don't mind, yeah

I'll be there if you want me to
No one else that could ever do
Got to get some peace in my mind"
"30","Crystal","Fleetwood Mac","25 Years: The Chain","","July 11, 1975","32395","154","21","","https://genius.com/Fleetwood-mac-crystal-lyrics","399768","Do you always trust your first, initial feeling?
Special knowledge holds true, bears believing
I turned around and the water was closing all around
Like a glove, like the love that had finally, finally found me

Then I knew in the crystalline knowledge of you
Drove me through the mountains
Through the crystal-like and clear water fountain
Drove me like a magnet, to the sea
To the sea
To the sea, yeah

How the faces of love have changed, turning the pages
And I have changed, oh, but you, you remain ageless
I turned around and the water was closing all around
Like a glove, like the love that had finally, finally found me

Then I knew in the crystalline knowledge of you
Drove me through the mountains
Through the crystal-like and clear water fountain
Drove me like a magnet, to the sea
To the sea
To the sea, yeah
To the sea, yeah"
"31","Need Your Love So Bad","Fleetwood Mac","25 Years: The Chain","","August 15, 1969","30566","190","18","","https://genius.com/Fleetwood-mac-need-your-love-so-bad-lyrics","1157398","Need someone's hand to lead me through the night
I need someone's arms to hold and squeeze me tight
Now, when the night begins, whoa, I'm at an end
Because I need your love so bad

I need some lips to feel next to mine
Need someone to stand up - to stand up and tell me when I'm lyin'
And when the lights are low - and it's time to go
That's when I need your love so bad

So why don't you give it up, baby and bring it home to me
Or write it on a piece of paper, woman - so it can be read to me
Tell me that you love me - and stop drivin' me mad
Whoa, because I - I need your love so bad

Need a soft voice - just to talk to me at night
Don't want you to worry, baby
I know we can make everything alright
Listen to my plea, baby, come on bring it to me
'Cause I need - your love so bad
Baby, I need, I need - woman, I need your love so bad"
"32","Beautiful Child","Fleetwood Mac","25 Years: The Chain","","October 12, 1979","29409","286","55","","https://genius.com/Fleetwood-mac-beautiful-child-lyrics","1071384","Beautiful child
Beautiful child
You are a beautiful child
And I am a fool once more

You fell in love when I was only ten
The years disappeared
Much has gone by since then
I bite my lip, can you send me away
You touch
I have no choice
I have to stay
Ooh, I had to stay
Ooh, I had to stay

Sleepless child
There is so little time
Your eyes say yes
But you don't say yes
Well, I wish that you were mine
I wish that you were mine

You say it will be harder in the morning
I wait for you to say, just go
Your hands, held mine so few hours
(I fell into love)
But I'm not a child anymore

I'm not a child anymore
I'm tall enough
To reach for the stars
I'm old enough
To love you from afar
Too trusting, yes
But then women usually are

(I'm not a child anymore)
I'm not a child, oh no
(I'm tall enough to reach for the stars)
I will do as I'm told
(I'm old enough to love you from afar)
Even if I never hold you again
(Too trusting yes, but then women usually are)
Hold you again
(Hold you again)

Sleepless child
There is so little time
(I will do as I am told)
Your eyes say yes
But you don't say yes
(Even if I never hold you again)
I wish that you were mine
(Hold you again)
I wish that you were mine
(Even if I never hold you again)
Well I wish that you were mine
(Hold you again)
Well I wish that you were mine
(Hold you again)
(I'm not a child anymore)"
"33","Angel","Fleetwood Mac","25 Years: The Chain","","October 12, 1979","27094","290","45","","https://genius.com/Fleetwood-mac-angel-lyrics","3249854","Sometimes, the most beautiful things
The most innocent things
And many of those dreams, pass us by
Keep passing me by

You feel good
I said it's funny that you understood
I knew you would
When you were good, you were very, very good

So I close my eyes softly
'Til I become that part of the wind
That we all long for sometime, yeah
And to those that I love, like a ghost through a fog
Like a charmed hour and a haunted song
And the angel of my dreams
Angel of my dreams

(You said) You feel good
I said it's funny that you understood
I knew you would
When you were good, baby
You were very good

I still look up, when you walk in the room
I've the same wide eyes, now they tell the story
I try not to reach out, when you turn 'round you say hello
And we both pretend
I'm no great pretender

So I close my eyes softly
'Til I become that part of the wind
That we all long for sometime, yeah
And to those that I love, like a ghost through a fog
Like a charmed hour and a haunted song
And the angel, angel of my dreams
Angel of my dreams

I still look up, yeah
I try hard not to look up, yeah
That girl was me, yeah
Track a ghost through the fog, yeah
A charmed hour and a haunted song, yeah

Track a ghost through the fog, baby, yeah
Track a ghost through the fog, baby
Ooh, you try hard
But you'll never catch me, yeah
That girl was me
Ooh, you try hard
But you'll never catch me, yeah
Ooh, that girl was me"
"34","Hypnotized","Fleetwood Mac","1969 to 1974 (Tracks 1-82)","","October 15, 1973","26955","294","42","","https://genius.com/Fleetwood-mac-hypnotized-lyrics","399736","It's the same kind of story
That seems to come down from long ago
Two friends having coffee together
When something flies by their window
It might be out on that lawn
Which is wide, at least half of a playing field
Because there's no explaining
What your imagination can make you see and feel

When your body means nothing (Seems like a dream)
You know you're hypnotized (They got me hypnotized)

Now it's not a meaningless question
To ask if they've been and gone
I remember a talk about North Carolina
And a strange, strange pond
You see, the sides were like glass
In the thick of a forest without a road
And if any man's hand ever made that land
Then I think it would've showed

That's why it seems like a dream (Seems like a dream)
They got me hypnotized (They got me hypnotized)
I know that's right

Seems like a dream
They got me hypnotized

They say there's a place down in Mexico
Where a man can fly over mountains and hills
And he don't need an airplane or some kind of engine
And he never will
Now you know it's a meaningless question to ask
If those stories are right
Because what matters most
Is the feeling you get when you're hypnotized

Seems like a dream (Seems like a dream)
They got you hypnotized (They got me hypnotized)
Your body means nothing (Seems like a dream)
You know you're hypnotized (They got me hypnotized)
Seems like a dream (Seems like a dream)
They got you hypnotized (They got me hypnotized)
Yeah, that's when, that's when they got you hypnotized
Seems like a dream
Seems like a dream
'Cause when your body means nothing
Float around, they got you hypnotized"
"35","As Long as You Follow","Fleetwood Mac","50 Years – Don’t Stop","","November 15, 1988","26227","130","26","","https://genius.com/Fleetwood-mac-as-long-as-you-follow-lyrics","400222","I've been searching
For a pot of gold
Like the kind you find
At the end of the rainbow
I've been dreaming
I thought it was in vain
Ah but now you're here
Can't believe that you're back again

Now I know I can't lose
As long as you follow
I'm going to win
(I'm going to win)
I'm going to beg, steal, or borrow
As long as you follow

I've been wandering
Gone away too far
But the road was rough
To get back where you are
And the sun went down
It never seemed to rise
Ah but now you're here
With the light shining in your eyes

(As long as you follow)
As long as you follow
(As long as you follow)
As long as you follow"
"36","Black Magic Woman","Fleetwood Mac","The Complete Blue Horizon Sessions 1967–1969","","March 29, 1968","24225","187","29","","https://genius.com/Fleetwood-mac-black-magic-woman-lyrics","400227","Got a black magic woman
I got a black magic woman
Yes, I got a black magic woman
She's got me so blind I can't see
But she's a black magic woman
And she's trying to make a Devil out of me

Don't turn your back on me, baby
Don't turn your back on me, baby
Yes, don't turn your back on me, baby
You're messing around with your tricks
Don't turn your back on me, baby
Because you might just break up my magic stick

You got your spell on me, baby
You got your spell on me, baby
Yes, you got your spell on me, baby
You're turning my heart into stone
I need you so bad, magic woman
I can't leave you alone

Yes, I need you so bad
Well, I need you darling
Yeah, I need you darling
Yes, I want you to love me
I want you to love me
Whoa, I want you to love me, ah
Whoh, yeah
Oh, whoa, baby
Yes, I need your love
Oh, I need your love so bad
Yes, I want you to love me"
"37","I’m So Afraid","Fleetwood Mac","Fleetwood Mac (2018 Expanded)","","July 11, 1975","23449","137","28","","https://genius.com/Fleetwood-mac-im-so-afraid-lyrics","399783","I've been alone
All the years
So many ways to count the tears
I never change
I never will
I'm so afraid the way I feel

Days when the rain and the sun are gone
Black as night
Agony's torn at my heart too long
So afraid
Slip and I fall and I die

I been alone
Always down
No one cared to stay around
I never change
I never will
I'm so afraid the way I feel

Days when the rain and the sun are gone
Black as night
Agony's torn at my heart too long
So afraid
Slip and I fall and I die

How I feel
Days when the rain and the sun are gone
Black as night
Agony's torn at my heart too long
So afraid
Slip and I fall and I die"
"38","Man of the World","Fleetwood Mac","25 Years: The Chain","","April 3, 1969","18418","121","17","","https://genius.com/Fleetwood-mac-man-of-the-world-lyrics","400248","Shall I tell you about my life
They say I'm a man of the world
I've flown across every tide
And I've seen lots of pretty girls
I guess I've got everything I need
I wouldn't ask for more
And there's no one I'd rather be
But I just wish that I'd never been born
And I need a good woman
To make me feel like a good man should
I don't say I'm a good man
Oh, but I would be if I could
I could tell you about my life
And keep you amused I'm sure
About all the times I've cried
And how I don't want to be sad anymore
And how I wish I was in love"
"39","Think About Me","Fleetwood Mac","25 Years: The Chain","","October 12, 1979","18264","169","25","","https://genius.com/Fleetwood-mac-think-about-me-lyrics","399945","All it took was a special look and I felt I knew you before
I didn't mean to love you, didn't think it would work out
But I knew we would be together and I couldn't wait for more
What can they say? It's not against the law

I don't hold you down
And maybe that's why you're around
But if I'm the one you love
Think about me

I believe that you really want me, but it's not easy just to give in
So let yourself go and let love begin (Ow!)

I don't hold you down
And maybe that's why you're around
But if I'm the one you love
Think about me
I don't hold you down
But maybe that's why you're around
But if I'm the one you love
Think about me

Baby, once in a while (Ooh)
Think about me
Baby, once in a while (Ooh)
Think about me (Ooh)
Think about me (Ooh)
Every, every once in a while (Ooh)
Think about me (Ooh)"
"40","Thrown Down","Fleetwood Mac","Say You Will ","","April 15, 2003","17894","233","34","","https://genius.com/Fleetwood-mac-thrown-down-lyrics","400175","He fell for her again, she watched it happen
Every day, day by day
But more important, night by night
She watched it all come into play
He held her hands, she listened to what he had to say

Thrown down, like a barricade
Maybe now he could prove to her
That he could be good for her
And they should be together

You've shaken your faith in me, no
You've shaken my faith in everything else
A decision no one makes, and now you're going home
Faith is a hard thing to hold on to
Something inside you says I don't have to
You're not like other people, you do what you want to
You're not like other people, you do what you want to

Thrown down, like a barricade
Maybe now he could prove to her
That he could be good for her
And they should be together

You say you're sorry
Now you should walk away
But it's so overwhelming
You have nothing left to say
You can sit outside his door and wait
Well, you can dedicate your pain to him

All thrown down, like a barricade
Maybe now he could prove to her
That he could be good for her
And they should be together

About just how much he never really told her
Thrown down
About how difficult it had been to be without her
Thrown down"
"41","Say You Will","Fleetwood Mac","50 Years – Don’t Stop","","April 15, 2003","17252","133","18","","https://genius.com/Fleetwood-mac-say-you-will-lyrics","400185","Something in you brought out something in me
That I've never been since
That part of me that was only for you
That kind of romance
Comes only once, that kind of love
That kind of fever dance
That you love because you become someone else in an instant

Say you will, say you will give me one more chance
At least give me time to change your mind
That always seems to heal the wounds
If I can get you to dance

Something in you put a hold on my heart
It's hard to believe now
Here in the place that will never be dark
I remember that place
That kind of touch, electricity of love
That certain kind of grace
That you love because you become someone else in an instant"
"42","Rhiannon (Live 1977)","Fleetwood Mac","Rumours (Super Deluxe)","","","16439","358","77","","https://genius.com/Fleetwood-mac-rhiannon-live-1977-lyrics","6996083","This is a song about a witch

Rhiannon rings like a bell through the night
And wouldn't you love to love her?
She rules her life like a bird in flight
And who will be her lover?

All your life you've never seen a woman
Taken by the wind
Would you stay if she promised you heaven?
Will you ever win?

She is like a cat in the dark
And then she is the darkness
Rules her life like a fine skylark
And when the sky is starless
Once in a million years a lady like her rises
Rhiannon, you cry, but she's gone
Your life knows no answer, yeah,  your life knows no answer

Rhiannon
Rhiannon
Rhiannon
Rhiannon

She rings like a bell through the night
And wouldn't you love to love her?
She rules her life like a bird in flight
And who will be her lover?

All your life you've never seen a woman
Taken by the sky
Would you stay if she promised you heaven?
Would you even try?
Would you even try?

Rhiannon
Rhiannon
Rhiannon

Taken by, taken by the sky
Taken by, taken by the sky, yeah
Taken by, taken by the sky
No

Ooh, ah, mm, oh-oh
Dreams unwind
Love's a state of mind
Dreams unwind
Love's a state of mind
Dreams unwind
And love is hard to find
Dreams unwind
And love's a state of mind
Dreams unwind
And love is hard to find
Dreams unwind
It’s still a state of mind
Take me like the wind, child
Take me to the sky
Take me like the wind, baby
Take me to the sky
All the same, all the same, all the same
Rhiannon
All the same, all the same, all the same
Rhiannon
All the same, yeah
All the same, yeah
All the same, yeah
Rhiannon
All the same, yeah
All the same, yeah
All the same, yeah
Oh, take me to the sky
Dreamer, take me dreamer
Take me to the sky
Dreamer, take me dreamer
Oh, God
Oh, gonna take me to the sky
Dreamer
Rhiannon
Rhiannon
Dreamer
Too late, too late
Dreamer

One, two, three, four"
"43","Over & Over","Fleetwood Mac","Tusk (Expanded Edition)","","October 12, 1979","15993","130","30","","https://genius.com/Fleetwood-mac-over-and-over-lyrics","399937","Could you ever need me?
And would you know how? Yeah
Don't waste our time, tell me now
All you have to do is speak out my name, yeah
And I would come running anyway

And I said, ""Could it be me?""
""Could it really, really be?""
Over and over
""Could it really, really be?""
Over and over

Oh, over and over
Oh-oh-oh-oh
Oh-oh-oh-oh

Oh I said, ""Could it be me?""
""Could it really, really be?""
Over and over
""Could it really, really be?""

Don't turn me away
And don't let me down, yeah
What can I do to keep you around?
Oh-oh-oh-oh

Over and over
Over and over
Over and over
Over and over
Over and over
Over and over
Over and over
Over and over
Over and over"
