"number","title","artist","album","album_release_date","release_date","pageviews","word_count","line_count","featured_artists","genius_url","genius_id","lyrics"
"1","Uprising","Muse","The Resistance","","August 4, 2009","278410","226","40","","https://genius.com/Muse-uprising-lyrics","54136","(Come on)

Paranoia is in bloom
The PR transmissions will resume
They'll try to push drugs that keep us all dumbed down
And hope that we will never see the truth around
(So come on)

Another promise, another seed
Another, a packaged lie to keep us trapped in greed
And all the green belts wrapped around our minds
And endless red tape to keep the truth confined
(So come on)

They will not force us
They will stop degrading us
They will not control us
And we will be victorious
(So come on)

Interchanging mind control
Come let the revolution take its toll
If you could flick a switch and open your third eye
You'd see that we should never be afraid to die
(So come on)

Rise up and take the power back
It's time the fat cats had a heart attack
You know that their time's coming to an end
We have to unify and watch our flag ascend
(So come on)

They will not force us
They will stop degrading us
They will not control us
And we will be victorious
(So come on)

Hey, hey, hey, hey
Hey, hey, hey, hey
Hey, hey, hey, hey

They will not force us
They will stop degrading us
They will not control us
And we will be victorious
(So come on)

Hey, hey, hey, hey"
"2","Time Is Running Out","Muse","Absolution XX Anniversary","","September 8, 2003","270663","241","44","","https://genius.com/Muse-time-is-running-out-lyrics","80779","I think I'm drowning, asphyxiated
I wanna break this spell that you've created
You're something beautiful, a contradiction
I wanna play the game, I want the friction

You will be the death of me
Yeah, you will be the death of me

Bury it
I won't let you bury it
I won't let you smother it
I won't let you murder it

Our time is running out
Our time is running out
You can't push it underground
You can't stop it screaming out

I wanted freedom, bound and restricted
I tried to give you up but I'm addicted
Now that you know I'm trapped, sense of elation
You'd never dream of breaking this fixation

You will squeeze the life out of me

Bury it
I won't let you bury it
I won't let you smother it
I won't let you murder it

And our time is running out
Our time is running out
You can't push it underground
You can't stop it screaming out
How did it come to this?

Ooh-ooh-ooh, yeah-yeah-yeah-yeah-yeah
Ooh-ooh-ooh, yeah-yeah-yeah-yeah-yeah
Ooh-ooh-ooh, yeah-yeah, yeah-yeah-yeah

Yeah, you will suck the life out of me

Bury it
I won't let you bury it
I won't let you smother it
I won't let you murder it

And our time is running out
Our time is running out
You can't push it underground
You can't stop it screaming out
How did it come to this?

Ooh-ooh-ooh, yeah-yeah-yeah-yeah-yeah
Ooh-ooh-ooh, yeah-yeah-yeah-yeah-yeah
Ooh-ooh-ooh, yeah-yeah, yeah-yeah-yeah"
"3","Supermassive Black Hole","Muse","Black Holes and Revelations","","June 17, 2006","264599","277","56","","https://genius.com/Muse-supermassive-black-hole-lyrics","79045","Ooh, baby, don't you know I suffer?
Ooh, baby, can't you hear me moan?
You caught me under false pretenses
How long before you let me go?

Ooh, you set my soul alight
Ooh, you set my soul alight

Glaciers melting in the dead of night (Ooh)
And the superstar's sucked into the supermassive (
You set my soul alight
)
Glaciers melting in the dead of night (Ooh)
And the superstar's sucked into the (
You set my soul
)
Into the supermassive

I thought I was a fool for no one
But, ooh, baby, I'm a fool for you
You're the queen of the superficial
How long before you tell the truth?

Ooh, you set my soul alight
Ooh, you set my soul alight

Glaciers melting in the dead of night (Ooh)
And the superstar's sucked into the supermassive (
You set my soul alight
)
Glaciers melting in the dead of night (Ooh)
And the superstar's sucked into the (
You set my soul
)
Into the supermassive

Supermassive black hole
Supermassive black hole
Supermassive black hole
Supermassive black hole

[Chorus: Chris Wolstenholme,
Matt Bellamy
&
Dominic Howard
]
Glaciers melting in the dead of night
And the superstar's sucked into the supermassive
Glaciers melting in the dead of night
And the superstar's sucked into the supermassive
Glaciers melting in the dead of night (Ooh)
And the superstar's sucked into the supermassive (
You set my soul alight
)
Glaciers melting in the dead of night (Ooh)
And the superstar's sucked into the (
You set my soul
)
Into the supermassive

Supermassive black hole
Supermassive black hole
Supermassive black hole
Supermassive black hole"
"4","Starlight","Muse","Black Holes and Revelations","","July 3, 2006","224219","203","37","","https://genius.com/Muse-starlight-lyrics","79043","Far away
This ship is taking me far away
Far away from the memories
Of the people who care if I live or die

A starlight
I will be chasing a starlight
Until the end of my life
I don't know if it's worth it anymore

Hold you in my arms
I just wanted to hold you in my arms

My life
You electrify my life
Let's conspire to ignite
All the souls that would die just to feel alive

I'll never let you go
If you promise not to fade away
Never fade away

And our hopes and expectations
Black holes and revelations
And our hopes and expectations
Black holes and revelations

Hold you in my arms
I just wanted to hold you in my arms

Far away
This ship has taken me far away
Far away from the memories
Of the people who care if I live or die

I'll never let you go
If you promise not to fade away
Never fade away

And our hopes and expectations
Black holes and revelations, yeah
Our hopes and expectations
Black holes and revelations

Hold you in my arms
I just wanted to hold you in my arms

I just wanted to hold"
"5","Hysteria","Muse","Absolution XX Anniversary","","December 1, 2003","209368","118","20","","https://genius.com/Muse-hysteria-lyrics","77713","It's bugging me, grating me
And twisting me around
Yeah, I'm endlessly caving in
And turning inside out

'Cause I want it now, I want it now
Give me your heart and your soul
And I'm breaking out, I'm breaking out
Last chance to lose control

Yeah, it's holding me, morphing me
And forcing me to strive
To be endlessly cold within
And dreaming I'm alive

'Cause I want it now, I want it now
Give me your heart and your soul
I'm not breaking down, I'm breaking out
Last chance to lose control

And I want you now, I want you now
I'll feel my heart implode
And I'm breaking out, escaping now
Feeling my faith erode"
"6","Madness","Muse","The 2nd Law","","August 20, 2012","187198","206","45","","https://genius.com/Muse-madness-lyrics","86341","Ma-ma-ma-ma-ma-ma-ma-ma-mad-mad-mad
Ma-ma-ma-ma-ma-ma-ma-ma-mad-mad-mad
Ma-ma-ma-ma-ma-ma-ma-ma-mad-mad-mad
Ma-ma-ma-ma-ma-ma-ma-ma-mad-mad-mad

I, I can't get these memories out of my mind
And some kind of madness is starting to evolve, mm
(Ma-ma-ma-ma-ma-ma-ma-ma-mad-mad-mad)
(Ma-ma-ma-ma-ma-ma-ma-ma-mad-mad-mad)
And I, I tried so hard to let you go
But some kind of madness is swallowing me whole, yeah
(Ma-ma-ma-ma-ma-ma-ma-ma-mad-mad-mad)
(Ma-ma-ma-ma-ma-ma-ma-ma-mad-mad-mad)

I have finally seen the light
And I have finally realised
What you mean

Hoo, huh-huh-huh-hoo

Now, I need to know, is this real love
Or is it just madness keeping us afloat? Mm
(Ma-ma-ma-ma-ma-ma-ma-ma-mad-mad-mad)
(Ma-ma-ma-ma-ma-ma-ma-ma-mad-mad-mad)
And when I look back at all the crazy fights we had
It's like some kind of madness was taking control, yeah
(Ma-ma-ma-ma-ma-ma-ma-ma-mad-mad-mad)
(Ma-ma-ma-ma-ma-ma-ma-ma-mad-mad-mad)

Now, I have finally seen the light
And I have finally realised
What you need

Hoo, huh-huh-huh-huh-hoo

(Ma-ma-ma-ma-ma-ma-ma-ma-mad-mad-mad)
(Ma-ma-ma-ma-ma-ma-ma-ma-mad-mad-mad)

Now, I have finally seen the end (Finally seen the end)
And I'm not expecting you to care, no (Expecting you to care)
That I have finally seen the light (Finally seen the light)
And I have finally realised (Realised)
I need your love
I need your love

Come to me, just in a dream
Come on and rescue me
Yes, I know, I can be wrong
And baby, you're too headstrong
Our love is...

Ma-ma-ma-ma-ma-ma-ma-ma-mad-mad-mad
Ma-ma-ma-ma-ma-ma-ma-ma-mad-mad-mad
Ma-ma-ma-ma-ma-ma-ma-ma-mad-mad-mad
Ma-ma-ma-ma-ma-ma-ma-madness"
"7","Feeling Good","Muse","Origin of Muse","","July 17, 2001","175639","185","31","","https://genius.com/Muse-feeling-good-lyrics","87140","Birds flying high, you know how I feel
Sun in the sky, you know how I feel
Reeds drifting on by, you know how I feel

It's a new dawn
It's a new day
It's a new life, for me
And I'm feeling good

Fish in the sea, you know how I feel
River running free, you know how I feel
Blossom in the trees, you know how I feel

It's a new dawn
It's a new day
It's a new life, for me
And I'm feeling good

Dragonfly out in the sun, you know what I mean, don't you know?
Butterflies all are having fun, you know what I mean
Sleep in peace, when the day is done
And this old world is a new world
And a bold world, for me

Stars when you shine, you know how I feel
Scent of the pine, you know how I feel
Yeah, freedom is mine, and you know how I feel

It's a new dawn
It's a new day
It's a new life for me

Butterfly, ooh
Ooh-ooh-ooh
Freer than you
Ooh-ooh-ooh
Ooh-ooh-ooh
Feeling good"
"8","Psycho","Muse","Drones","","March 12, 2015","163098","276","59","","https://genius.com/Muse-psycho-lyrics","722329","Love, it will get you nowhere
You're on your own
Lost in the wild
So come to me now
I could use someone like you
Someone who'll kill on my command
And ask no questions

I'm gonna make you
I'm gonna break you
I'm gonna make you
A fucking psycho

A fucking psycho
Ha-ha, a fucking psycho
Your ass belongs to me now, oh

[Post-Chorus: Drill Sergeant &
Soldier
]
Are you a human drone?
Aye, sir
Are you a killing machine?
Aye, sir
I'm in control, motherfucker, do you understand?
Aye, sir

Your mind is just a program
And I'm the virus
I'm changing the station
I'll improve your thresholds
I'll turn you into a super drone (A super drone)
And you will kill on my command
And I won't be responsible

I'm gonna make you
I'm gonna break you
I'm gonna make you
A fucking psycho

A fucking psycho
Ha-ha, a fucking psycho
Your ass belongs to me now

Are you a psycho killer? Say ""I'm a psycho killer""
I am a psycho killer!
Scream it! I am a psycho killer!
Show me your war face!
Ah!
You are a pussy, I said show me your war face!
Ah!

I'm gonna make you
I'm gonna break you
I'm gonna make you
A fucking psycho

A fucking psycho
Ha-ha, a fucking psycho
Your ass belongs to me now

I will break you, do you understand?
I will break you, do you understand?
I will break you, do you understand?
I will break you, do you understand?
Aye, sir
You fucking psycho

Your ass belongs to me now (Yeah)
Your ass belongs to me now, ooh-ah"
"9","Resistance","Muse","The Resistance","","September 14, 2009","142025","328","44","","https://genius.com/Muse-resistance-lyrics","54137","Is our secret safe tonight?
And are we out of sight?
Or will our world come tumbling down?
Will they find our hiding place?
Is this our last embrace?
Or will the walls start caving in?

(It could be wrong, could be wrong) But it should have been right
(It could be wrong, could be wrong) To let our hearts ignite
(It could be wrong, could be wrong) Are we digging a hole?
(It could be wrong, could be wrong) This is out of control
(It could be wrong, could be wrong) It can never last
(It could be wrong, could be wrong) Must erase it fast
(It could be wrong, could be wrong) But it could have been right
(It could be wrong, could be—)

Love is our resistance
They'll keep us apart and they won't stop breaking us down
Hold me
Our lips must always be sealed

If we live a life in fear
I'll wait a thousand years
Just to see you smile again
Kill your prayers for love and peace
You'll wake the Thought Police
We can't hide the truth inside

(It could be wrong, could be wrong) But it should have been right
(It could be wrong, could be wrong) To let our hearts ignite
(It could be wrong, could be wrong) Are we digging a hole?
(It could be wrong, could be wrong) This is out of control
(It could be wrong, could be wrong) It can never last
(It could be wrong, could be wrong) Must erase it fast
(It could be wrong, could be wrong) But it could have been right
(It could be wrong, could be—)

Love is our resistance
They'll keep us apart and they won't stop breaking us down
Hold me
Our lips must always be sealed

The night has reached its end
We can't pretend
We must run
We must run
It's time to run
Take us away from here
Protect us from further harm
Resistance"
"10","Mercy","Muse","Drones","","May 18, 2015","134499","169","22","","https://genius.com/Muse-mercy-lyrics","722371","Help me, I've fallen on the inside
I tried to change the game, I tried to infiltrate but now I'm losing

Men in cloaks always seem to run the show
Save me from the ghosts and shadows before they eat my soul, yeah

Mercy, mercy
Show me mercy, from the powers that be
Show me mercy, can someone rescue me?

Absent gods and silent tyranny, we're going under
Hypnotized by another puppeteer, and tell me why the

Men in cloaks always have to bring me down
Running from the ghosts and shadows the world just disavows, yeah

Mercy, mercy
Show me mercy, from the powers that be
Show me mercy, can someone rescue me?

Show me mercy
Show me mercy, please

Help me, I've fallen on the inside
And all the men in cloaks trying to devour my soul

Show me mercy from the powers that be
Show me mercy from the gutless and mean
Show me mercy from the killing machines
Show me mercy, can someone rescue me?"
"11","Undisclosed Desires","Muse","The Resistance","","September 14, 2009","134625","195","26","","https://genius.com/Muse-undisclosed-desires-lyrics","54139","I know you've suffered
But I don't want you to hide
It's cold and loveless
I won't let you be denied

Soothing, I'll make you feel pure
Trust me, you can be sure

I want to reconcile the violence in your heart
I want to recognise your beauty is not just a mask
I want to exorcise the demons from your past
I want to satisfy the undisclosed desires in your heart

You trick your lovers
That you're wicked and divine
You may be a sinner
But your innocence is mine

Please me, show me how it's done
Tease me, you are the one

I want to reconcile the violence in your heart
I want to recognise your beauty is not just a mask
I want to exorcise the demons from your past
I want to satisfy the undisclosed desires in your heart

Please me, show me how it's done
Trust me, you are the one

I want to reconcile the violence in your heart
I want to recognise your beauty is not just a mask
I want to exorcise the demons from your past
I want to satisfy the undisclosed desires in your heart"
"12","Dead Inside","Muse","Drones","","March 23, 2015","129867","253","44","","https://genius.com/Muse-dead-inside-lyrics","722364","Dead inside
(Dead inside)

Revere a million prayers
And draw me into your holiness
But there's nothing there
Light only shines from those who share
Unleash a million drones
And confine me then erase me, babe
Do you have no soul?
It's like it died, long ago

Your lips feel warm to the touch
You can bring me back to life
On the outside, you're ablaze and alive
But you're dead inside

You're free to touch the sky
Whilst I am crushed and pulverised
Because you need control
Now I'm the one who's letting go
You like to give an inch
Whilst I am giving infinity
But now I've got nothing left
You have no cares and I'm bereft

Your skin feels warm to caress
I see magic in your eyes
On the outside, you're ablaze and alive
But you're dead inside
(Dead inside)

Feel me now, hold me please
I need you to see who I am
Open up to me, stop hiding from me
It's hurting, babe, only you can stop the pain
Don't leave me out in the cold
Don't leave me out to die
I gave you everything, I can't give you any more
Now I've become just like you

My lips feel warm to the touch
My words seem so alive
My skin is warm to caress
I'll control and hypnotize
You've taught me to lie without a trace
And to kill with no remorse
On the outside, I'm the greatest guy
Now I'm dead inside
(Dead inside)"
"13","Stockholm Syndrome","Muse","Absolution XX Anniversary","","July 14, 2003","127772","150","28","","https://genius.com/Muse-stockholm-syndrome-lyrics","77812","I won't stand in your way
Let your hatred grow
And she'll scream, and she'll shout, and she'll pray
And she had a name, yeah, she had a name

I won't hold you back
Let your anger rise
And we'll fly, and we'll fall, and we'll burn
And no one will recall, no one will recall

This is the last time I'll
Abandon you
And this is the last time I'll
Forget you
I wish I could!

Look to the stars
Let hope burn in your eyes
And we'll love, and we'll hate, and we'll die
All to no avail, all to no avail

This is the last time I'll
Abandon you
And this is the last time I'll
Forget you
I wish I could!

This is the last time I'll
Abandon you
And this is the last time I'll
Forget you
I wish I could!

I wish I could!"
"14","New Born","Muse","Origin of Muse","","June 4, 2001","120250","179","32","","https://genius.com/Muse-new-born-lyrics","87131","Link it to the world, link it to yourself
Stretch it like a birth squeeze
The love for what you hide, the bitterness inside
Is growing like the newborn

When you've seen, seen
Too much
Too young, young
Soulless is everywhere

Hopeless times to roam, the distance to your home
Fades away to nowhere
How much are you worth, you can't come down to earth
You're swelling up, you're unstoppable

'Cause you've seen, seen
Too much
Too young, young
Soulless is everywhere

Destroy the spineless, show me it's real
Wasting our last chance to come away
Just break the silence, 'cause I'm drifting away
Away from you, ooh

Yeah, link it to the world, link it to yourself
Stretch it like it's a birth squeeze
And the love for what you hide, and the bitterness inside
Is growing like the newborn

When you've seen, seen
Too much
Too young, young
Soulless is everywhere

Destroy the spineless, show me it's real
Wasting our last chance to come away
Just break the silence, 'cause I'm drifting away
Away from you, ooh"
"15","Reapers","Muse","Drones","","April 16, 2016","102619","281","50","","https://genius.com/Muse-reapers-lyrics","722379","Home, it's becoming a killing field
There's a crosshair locked on my heart
With no recourse and there's no one behind the wheel
Hellfire, you're wiping me out, killed by

Drones
(Killed by)
Drones
(Killed by)

You rule with lies and deceit
And the world is on your side
'Cause you've got the CIA, babe
(You can run but you're never gonna hide)
But all you've done is brutalise
(You can run but you're never gonna gonna gonna)
Drones!

War, war just moved up a gear
I don't think I can handle the truth
I'm just a pawn
And we're all expendable
Incidentally electronically erased by your

Drones
(Killed by)
Drones
(Killed by)

You kill by remote control
And the world is on your side
You've got reapers and hawks, babe
(You can run but you're never gonna hide)
Now I am radicalized
(You can run but you're never gonna gonna gonna)
Drones! (Killed by)

(You can run but you're never gonna hide)
(You can run but you're never gonna gonna gonna)
(You can run but you're never gonna hide)
(You can run but you're never gonna gonna gonna)
You rule with lies and deceit
And the world is on your side
You've got the CIA, babe
But all you've done is brutalise

You kill by remote control
(You can run but you're never gonna hide)
And the world is on your side
(You can run but you're never gonna gonna gonna)
You've got reapers and hawks, babe
(You can run but you're never gonna hide)
Now I am radicalized
(You can run but you're never gonna gonna gonna)

Here come the drones!
Here come the drones!
Here come the drones!"
"16","The Dark Side","Muse","Simulation Theory","","August 30, 2018","99701","134","23","","https://genius.com/Muse-the-dark-side-lyrics","3526501","I have lived in darkness
For all my life, I've been pursued
You'd be afraid if you could feel my pain
And if you could see the things I am able to see

Break me out, break me out
Let me flee
Break me out, break me out
Set me free

I hail from the dark side
For all my life, I've been besieged
You'd be scared living with my despair
And if you could feel the things I am able to feel

Break me out, break me out
Let me flee
Break me out, break me out
Set me free

Break me out, break me out
Let me flee
Break me out, break me out
Set me free
Save me from the dark side
Break me out, break me out
Set me free"
"17","Unintended","Muse","Origin of Muse","","September 7, 1999","95086","141","22","","https://genius.com/Muse-unintended-lyrics","144377","You could be my unintended
Choice to live my life extended
You could be the one I'll always love
You could be the one who listens
To my deepest inquisitions
You could be the one I'll always love

I'll be there as soon as I can
But I'm busy mending broken
Pieces of the life I had before

First there was the one who challenged
All my dreams and all my balance
She could never be as good as you
You could be my unintended
Choice to live my life extended
You should be the one I'll always love

I'll be there as soon as I can
But I'm busy mending broken
Pieces of the life I had before
I'll be there as soon as I can
But I'm busy mending broken
Pieces of the life I had before
Before you"
"18","Thought Contagion","Muse","Simulation Theory","","February 15, 2018","87392","180","34","","https://genius.com/Muse-thought-contagion-lyrics","3359534","Strung out falling from the big time
Welcome to the infinite black skies
Brain cleansed fractured identity
Fragments and scattered debris

Thought contagion
Thought contagion

Fall down learn when to count it out
Prop me up before I black out
Withdraw before you're out of time
A clean slate and buried war crimes

You've been bitten by a true believer
You've been bitten by someone who's hungrier than you
You've been bitten by a true believer
You've been bitten by someone's false beliefs
Thought contagion
Thought contagion

They'll never do what you want them to
Give it up and watch them break through
It's too late for a revolution
Brace for the final solution

Thought contagion
Thought contagion

You've been bitten by a true believer
You've been bitten by someone who's hungrier than you
You've been bitten by a true believer
You've been bitten by someone's false beliefs
Oh-woah-oh-woah-oh-oh-oh
Thought contagion
Oh-woah-oh-woah-oh-oh-oh
Thought contagion
Oh-woah-oh-woah-oh-oh-oh

Strung out falling from the big time (Welcome to the infinite black skies)
Oh-woah-oh-woah-oh-oh-oh (It's too late for a revolution)
Brace for the final solution"
"19","Map of the Problematique","Muse","Black Holes and Revelations","","July 3, 2006","80550","121","20","","https://genius.com/Muse-map-of-the-problematique-lyrics","152785","Fear and panic in the air
I want to be free from desolation and despair
And I feel like everything I sow
Is being swept away, well I refuse to let you go

I can't get it right
Get it right
Since I met you

Loneliness be over
When will this loneliness be over?

Life will flash before my eyes
So scattered and lost, I want to touch the other side
And no one thinks they are to blame
Why can't we see that when we bleed, we bleed the same?

I can't get it right
Get it right
Since I met you

Loneliness be over
When will this loneliness be over?
Loneliness be over
When will this loneliness be over?"
"20","Citizen Erased","Muse","Origin of Muse","","July 17, 2002","80425","156","29","","https://genius.com/Muse-citizen-erased-lyrics","87136","Break me in
Teach us to cheat
And to lie, and cover up
What shouldn't be shared

And the truth's unwinding, scraping away
At my mind, please stop asking me to describe

For one moment
I wish you'd hold your stage with no feelings at all
Open-minded
I'm sure I used to be so free

Self-expressed
Exhausting for all
To see and to be
What you want and what you need

And the truth's unwinding, scraping away
At my mind, please stop asking me to describe

For one moment
I wish you'd hold your stage with no feelings at all
Open-minded
I'm sure I used to be so free

For one moment
I wish you'd hold your stage with no feelings at all
Open-minded
I'm sure I used to be so free

Wash me away
Clean your body of me
Erase all the memories
They'll only bring us pain
And I've seen all I'll ever need"
"21","I Belong to You (+Mon Coeur S’Ouvre a Ta Voix)","Muse","The Resistance","","September 14, 2009","77960","178","41","","https://genius.com/Muse-i-belong-to-you-mon-coeur-souvre-a-ta-voix-lyrics","54144","Woo
Mhm, mhm

When these pillars get pulled down
It will be you who wears the crown
And I'll owe everything to you

Ooh
Ooh

How much pain has cracked your soul?
How much love would make you whole?
You're my guiding lightning strike

I can't find the words to say
They're overdue
I've travelled half the world to say
I belong to you

Ooh
Ooh

Then she attacks me like a Leo
When my heart is split like Rio
But I assure you my debts are real

I can't find the words to say
When I'm confused
I travelled half the world to say
You are my mu—

Ooh
Ooh

Ah, réponds, réponds à ma tendresse
Verse-moi, verse-moi l'ivresse
Réponds à ma tendresse, réponds à ma tendresse
Ah, verse-moi l'ivresse
Ooh, verse-moi, verse-moi l'ivresse
Réponds à ma tendresse, réponds à ma tendresse
Ah, verse-moi l'ivresse
I belong, I belong to you alone

Ooh
—se

Ooh, I can't find the words to say
They're overdue
I've travelled half the world to say
I belong to you

Ooh
Ooh"
