"number","title","artist","album","album_release_date","release_date","pageviews","word_count","line_count","featured_artists","genius_url","genius_id","lyrics"
"22","Endlessly","Muse","Absolution XX Anniversary","","September 15, 2003","75817","122","28","","https://genius.com/Muse-endlessly-lyrics","51453","There's a part of me you'll never know
The only thing I'll never show

Hopelessly
I'll love you endlessly
Hopelessly
I'll give you everything
But I won't give you up
I won't let you down
And I won't leave you falling
If the moment ever comes

It's plain to see it's trying to speak
Cherished dreams forever asleep

Hopelessly
I'll love you endlessly
Hopelessly
I'll give you everything
But I won't give you up
I won't let you down
And I won't leave you falling
If the moment ever comes

Hopelessly
I'll love you endlessly
Hopelessly
I'll give you everything
But I won't give you up
I won't let you down
And I won't leave you falling
But the moment never comes"
"23","Won’t Stand Down","Muse","Will of the People","","January 13, 2022","73210","309","49","","https://genius.com/Muse-wont-stand-down-lyrics","7529194","I never believed that I would concede
And let someone trample on me
You strung me along, I thought I was strong
But you were just gaslightin' me
I've opened my eyes and counted the lies
And now it is clearer to me
You are just a user and an abuser
Living vicariously
I never believed that I would concede
And get myself blown asunder
You strung me along, I thought I was strong
But now you have pushed me under
I've opened my eyes and counted the lies
And now it is clearer to me
You are just a user and an abuser
And I refuse to take it

Won't stand down, I'm growing stronger
Won't stand down, I'm owned no longer
Won't stand down, you've used me for too long
Now die alone

Now I'm coming back, a counterattack
I'm playin' you at your own game
I'm cutting you out, a shadow of doubt
Is gonna hang over your name
I've opened my eyes, I see your disguise
I will never see you the same
I know how to win before you begin
I'll shoot you before you take aim
Now I'm coming back, a counterattack
A psychological war
I'm cutting you in, I'm under your skin
Now I'm gonna settle the score
I've opened my eyes, I see your disguise
I will never see you the same
I know how to win before you begin
I'll shoot you before you take aim

Won't stand down, I'm growing stronger
Won't stand down, I'm owned no longer
Won't stand down, you've used me for too long
Now die alone

Won't stand down
Breaking out
Won't stand down

Won't stand down, I'm growing stronger
Won't stand down, I'm owned no longer
Won't stand down, you've used me for too long
Now die alone

Won't stand down
Won't stand down"
"24","Sunburn","Muse","Origin of Muse","","October 4, 1999","70981","120","26","","https://genius.com/Muse-sunburn-lyrics","191525","Come waste your millions here
Secretly, she sneers
Another corporate show
A guilty conscience grows

I'll feel a guilty conscience grow
And I'll feel a guilty conscience grow

She burns like the sun
And I can't look away
And she'll burn our horizons
Make no mistakes

Come let the truth be shared
No one ever dared
To break these endless lies
Secretly, she cries

She burns like the sun
And I can't look away
And she'll burn our horizons
Make no mistakes

And I'll hide from the world
Behind a broken frame
And I'll run forever
I can't face the shame
And I'll hide from the world
Behind a broken frame
And I'll run forever
I can't face the shame"
"25","Sing for Absolution","Muse","Absolution XX Anniversary","","September 15, 2003","69433","152","25","","https://genius.com/Muse-sing-for-absolution-lyrics","120788","Lips are turning blue
A kiss that can't renew
I only dream of you, my beautiful
Tiptoe to your room (Tiptoe to your room)
A starlight in the gloom (A starlight in the gloom)
I only dream of you (I only dream of you)
And you never knew (And you never knew)

Sing for absolution
I will be singing
And falling from your grace, ooh

There's nowhere left to hide
In no one to confide
The truth burns deep inside and will never die
Lips are turning blue (Lips are turning blue)
A kiss that can't renew (A kiss that can't renew)
I only dream of you (I only dream of you)
My beautiful (My beautiful)

Sing for absolution
I will be singing
And falling from your grace, hey

Sing for absolution
I will be singing
And falling from your grace, yeah

Our wrongs remain unrectified
And our souls won't be exhumed"
"26","Space Dementia","Muse","Origin of Muse","","July 17, 2001","69258","107","20","","https://genius.com/Muse-space-dementia-lyrics","87133","H8 is the one for me
It gives me all I need
And helps me coexist
With the chill, ooh

You make me sick
Because I adore you so
I love all the dirty tricks
And twisted games you play on me, ooh

Space dementia in your eyes and
Peace will arise
And tear us apart
And make us meaningless again

You make us wanna die
I'd cut your name in my heart
We'll destroy this world for you
I know you want me to feel your pain, ooh

Space dementia in your eyes and
Peace will arise
And tear us apart
And make us meaningless again"
"27","The Globalist","Muse","Drones","","June 5, 2015","66966","211","47","","https://genius.com/Muse-the-globalist-lyrics","722387","You were never truly loved
You have only been betrayed
You were never truly nurtured
By churches or the state
You were left unprotected
To these wild and fragile lands
But you can rise up like a god
Arm yourself, you can be strong
You can build a nuclear power
Transform the earth to your desire
Free your mind from false beliefs
You can be the commander in chief
You can hide your true motives
To dismantle and destroy

Now you finally have the code
I have given you the code

Oh-oh-oh-oh-oh
Oh-oh-oh-oh-oh
Oh-oh-oh
Oh-oh-oh-oh-oh
Oh-oh-oh-oh-oh
Oh-oh-oh-oh-oh
Oh-oh-oh
Oh-oh-oh-oh-oh
(Ten, nine, eight, seven, six)
(Five, four, three, two, one, fire)

There's no country left
To love and cherish
It's gone, it's gone for good
It's you and me, babe, survivors
To hunt and gather memories
Of the great nation we were

There's no countries left
To fight and conquer
I think I destroyed them all
It's human nature, the greatest hunter will
Survive alone with no one left to love

Ah-ah-ah-ah-ah
Ah-ah-ah-ah-ah, ah-ah-ah
Ah-ah-ah-ah-ah, ah-ah-ah
Ah-ah-ah-ah-ah-ah, ah-ah-ah

There's no culture left
To love and cherish
It's gone, you know it's gone for good
A trillion memories lost in space and time
Forevermore
I just wanted, I just needed to be loved"
"28","The Handler","Muse","Drones","","June 5, 2015","65759","141","20","","https://genius.com/Muse-the-handler-lyrics","722380","You (You, you) were my oppressor
And I, (I, I) I have been programmed to obey
But now (Now, now) you are my handler
And I, (I, I) I will execute your demands

Leave me alone
I must disassociate from you

Behold (-hold, -hold) my trance formation
And you (You, you) are empowered to do as you please
My mind (Mind, mind) was lost in translation
And my heart (Heart, heart) has become a cold and impassive machine

Leave me alone
I must disassociate from you, yeah-yeah
Bum-bu-dayuh, bu-dayuh, bu-dayuh, bu-dayuhohoh

I won't let you control my feelings anymore
And I will no longer do as I am told
And I am no longer afraid to walk alone
Let me go, let me be
I am escaping from your grip
You will never own me again, yeah-yeah
Bum-bu-dayuh, bu-dayuh, bu-dayuh, bu-dayuhohoh"
"29","Algorithm","Muse","Simulation Theory","","November 9, 2018","65138","49","14","","https://genius.com/Muse-algorithm-lyrics","3836258","Burn like a slave
Churn like a cog
We are caged in simulations
Algorithms evolve
Push us aside and render us obsolete

This means war
With your creator
This means war
With your creator

Reload, crash out

This means war
With your creator
This means war
With your creator"
"30","Bliss","Muse","Origin of Muse","","August 20, 2001","63796","127","19","","https://genius.com/Muse-bliss-lyrics","87132","Everything about you is how I'd wanna be
Your freedom comes naturally
Everything about you resonates happiness
Now I won't settle for less

Give me all the peace and joy in your mind
Ooh

Everything about you pains my envying
Your soul can't hate anything
Everything about you is so easy to love
They're watching you from above

Give me all the peace and joy in your mind
I want the peace and joy in your mind
Give me the peace and joy in your mind, ooh

Everything about you resonates happiness
Now I won't settle for less

Give me all the peace and joy in your mind
I want the peace and joy in your mind
Give me the peace and joy in your mind
Ooh"
"31","Defector","Muse","Drones","","June 5, 2015","60058","204","45","","https://genius.com/Muse-defector-lyrics","722383","Free, yeah, I'm free
From your ins-ins-inciting
You can't brainwash me
You've got a problem
Free, yeah I'm free
From society
You can't control me
I'm a defector

You think you're strong and you can't be broken
But your empire is dissolving
You thought, you thought I was weak
But you got it wrong, look into my eyes, I'm a defector

Free, yeah, I'm free
From your ins-ins-inciting
You can't brainwash me
You've got a problem
Free, yeah I'm free
From society
You can't control me
I'm a defector

Your blood is blue and your mind's turned green
And your belly is all yellow
You believe your throne is too high
To be overthrown, we'll watch it get razed by a defector

Free, yeah, I'm free
From your ins-ins-inciting
You can't brainwash me
You've got a problem
Free, yeah I'm free
From society
You can't control me
I'm a defector

I'm a defector

Free, yeah, I'm free
From your ins-ins-inciting
You can't brainwash me
You've got a problem
Free, yeah I'm free
From society
You can't control me
I'm a defector

We look for strength and assistance
Confident that with your help
Man will be what he was born to be:
Free and independent"
"32","Muscle Museum","Muse","Origin of Muse","","January 11, 1999","59463","185","31","","https://genius.com/Muse-muscle-museum-lyrics","144378","She had something to confess to
But you don't have the time, so
Look the other way
You will wait until it's over
To reveal what you'd never shown her
Too little much too late

Too long trying to resist it
You've just gone and missed it
It's escaped your world

Can you see that I am needing
Begging for so much more
Than you could ever give?
And I don't want you to adore me
Don't want you to ignore me
When it pleases you
Yeah, and I'll do it on my own

I have played in every toilet
But you still want to spoil it
To prove I've made a big mistake

Too long trying to resist it
You've just gone and missed it
It's escaped your world

Can you see that I am needing
Begging for so much more
Than you could ever give?
And I don't want you to adore me
Don't want you to ignore me
When it pleases you
Yeah, and I'll do it on my own

And I'll do it all by myself
And you'll never make it"
"33","Something Human","Muse","Simulation Theory","","July 19, 2018","58543","169","32","","https://genius.com/Muse-something-human-lyrics","3820235","My circuits have blown
I know it's self-imposed
And all I have shared, and all I have loved
Is all I'll ever own
But something has changed
I feel so alive
My life just blew up, I'd give it all up
I'll depressurize

Ten thousand miles left on the road
Five-hundred hours 'til I am home
I need something human, human
Human, human

Let's face all our fears
Come out of the shade
Let's burn all the money, absolve all the lies
And wake up unscathed
The big picture's gone
Replaced with visions of you
Now life can begin, I've cleansed all my sins
I'm about to break through

Five thousand miles left on the road
Two-hundred hours 'til I am home
I need something human, human
Human, human

And I need the touch
And something human, human

Less than a mile left on the road
I will be crawling through your door
I need something human, human
Human, human

And I need your love
And something human, human"
"34","Supremacy","Muse","The 2nd Law","","September 28, 2012","56803","73","14","","https://genius.com/Muse-supremacy-lyrics","89823","Wake to see, your true emancipation is a fantasy
Policies have risen up and overcome the brave
Greatness dies, unsung and lost, invisible to history
Embedded spies brainwashing our children to be mean

You don't have long
I am on to you
The time, it has come to destroy
Your supremacy

You don't have long
I am on to you
The time, it has come to destroy
Your supremacy

Supremacy
Yeah, ooh, yeah-yeah-ooh"
"35","Butterflies and Hurricanes","Muse","Absolution XX Anniversary","","September 15, 2003","55907","151","27","","https://genius.com/Muse-butterflies-and-hurricanes-lyrics","120784","Change everything you are
And everything you were
Your number has been called
Fights and battles have begun
Revenge will surely come
Your hard times are ahead

Best, you've got to be the best
You've got to change the world
And use this chance to be heard
Your time is now (Your time is now)

Change everything you are
And everything you were
Your number has been called
Fights and battles have begun
Revenge will surely come
Your hard times are ahead

Best, you've got to be the best
You've got to change the world
And use this chance to be heard
Your time is now (Your time is now)

Don't let yourself down
Don't let yourself go
Your last chance has arrived

Best, you've got to be the best
You've got to change the world
And use this chance to be heard
Your time is now (Your time is now)"
"36","Falling Away with You","Muse","Absolution XX Anniversary","","September 15, 2003","55397","189","34","","https://genius.com/Muse-falling-away-with-you-lyrics","120780","I can't remember when it was good
Moments of happiness elude
Maybe I just misunderstood
All of the love we left behind
Watching the flashbacks intertwine
Memories I will never find
So I'll love whatever you become
And forget the reckless things we've done
I think our lives have just begun
I think our lives have just begun

And I'll feel my world crumbling
I'll feel my life crumbling
I'll feel my soul crumbling away
And falling away
Falling away with you

Staying awake to chase a dream
Tasting the air you're breathing in
I know I won't forget a thing
Promise to hold you close and pray
Watching the fantasies decay
Nothing will ever stay the same
And all of the love we threw away
And all of the hopes we've cherished fade
Making the same mistakes again
Making the same mistakes again

And I'll feel my world crumbling
I'll feel my life crumbling
I'll feel my soul crumbling away
And falling away
Falling away with you

All of the love we left behind
Watching the flashbacks intertwine
Memories I will never find
Memories I will never find"
"37","Dig Down","Muse","Simulation Theory","","May 18, 2017","51904","191","35","","https://genius.com/Muse-dig-down-lyrics","3084285","When hope and love has been lost and you fall to the ground
You must find a way
When the darkness descends and you're told it's the end
You must find a way

When God decides to look the other way and a clown takes the throne
We must find a way
Face the firing squad, against all the odds
You will find a way

Dig down
Dig down
Dig down and find faith
When you're close to the edge
With a gun to your head
You must find a way

When friends are thin on the ground and they try to divide us
We must find a way
We have entered the fray and we will not obey
We must find a way, yeah

Dig down
Dig down
Dig down and find faith
When they've left you for dead and you can only see red
You must find a way
Dig down
Dig down
Dig down, find faith
We won't let them divide, we will never abide
We will find a way

Dig down (Woah-oh-oh)
Dig down (Woah-oh-oh)
Dig down (Woah-oh-oh)
Faith (Woah-oh-oh)
Dig down (Woah-oh-oh)
Dig down (Woah-oh-oh)
Faith"
"38","Aftermath","Muse","Drones","","June 5, 2015","50020","247","35","","https://genius.com/Muse-aftermath-lyrics","722386","War is all around, I'm growing tired of fighting
I've been drained and I can't hide it
But I have strength for you, you're all that's real anymore
I am coming home now, I need your comfort

From this moment, from this moment
You will never be alone
We're bound together, now and forever
The loneliness has gone

States are crumbling, and walls are rising high again
It's no place for the faint-hearted
But my heart is strong 'cause now I know where I belong
It's you and I against the world, and we are free

From this moment, from this moment
You will never be alone
We're bound together, now and forever
The loneliness has gone

We've gone against the tide
All we have is each other now
And I am coming home now
I need your comfort

(From this moment) From this moment, (From this moment) from this moment
(You will never be alone) Never be alone, yeah
(We're bound together) We're bound together, (Now and forever) now and forever
(The loneliness has gone) The loneliness has gone
(From this moment) From this moment, (From this moment) from this moment
(You will never be alone) Never be alone
We're bound together, now and forever
The loneliness has gone
From this moment (From this moment), from this moment (From this moment)
You will never be alone
We're bound together, now and forever
The loneliness has gone

We're bound together
Now and forever
The loneliness has gone"
"39","Panic Station","Muse","The 2nd Law","","September 28, 2012","48087","218","28","","https://genius.com/Muse-panic-station-lyrics","89824","You won't get much closer 'til you sacrifice it all (All)
You won't get to taste it with your face against the wall (Wall, wall)
Get up and commit, show the power trapped within (-In, -in)
Do just what you want to and now stand up and begin, uh

Ooh, one, two, three, four fire's in your eyes
And this chaos, it defies imagination
Ooh, five, six, seven, eight minus nine lives
You've arrived at panic station

Doubts will try to break you, unleash your heart and soul (Soul)
Trouble will surround you, start taking some control (-trol)
Stand up and deliver your wildest fantasy (-sy, -sy)
Do what the fuck you want to, there's no one to appea-ea-ease

Ooh, one, two, three, four fire's in your eyes
And this chaos, it defies imagination
Ooh, five, six, seven, eight minus nine lives
You've arrived at panic station, woah

Hey
Ooh

Ooh-ah, ooh-ah
Ooh, one, two, three, four fire's in your eyes
And this chaos, it defies imagination
Ooh, five, six, seven, eight minus nine lives
And I know that you will fight for the duration
Ooh, one, two, three, four fire's in your eyes
And I know I'm not resisting your temptations
Ooh, five, six, seven, eight minus nine lives
You've arrived at panic station, woah

Woo, ugh"
"40","Drones","Muse","Drones","","June 5, 2015","47118","51","9","","https://genius.com/Muse-drones-lyrics","722388","Killed by drones
My mother, my father
My sister and my brother
My son and my daughter

Killed by drones
Our lives between your fingers and your thumb
Can you feel anything at all? Are you dead inside?
Now you can kill from the safety of your home with drones

Amen"
"41","Unravelling","Muse","M10*","","June 20, 2025","43922","169","47","","https://genius.com/Muse-unravelling-lyrics","12001375","(Un-un-unravelling)
(Un-un-unravelling)
(Un-un-unravelling)
(Un-un-unravelling)

An insect trapped in amber, I'm a fading pulse
The ecstasy was false
Our love is an unlit script no one can memorise
Redacted and revised
I'll lie beside you and I'll try to play along
An insect trapped in amber, I'm a static hum
No longer happy dumb

Un-un-unravelling
Un-un-unravelling
Un-un-unravelling
Un-un-unravelling

Feeling the glow
Die inside of our bones
This is a hymn for our love
With no God and no throne

(Un-un-unravelling)

Your eyes go cold at sunrise as we disembark
You lеft me in the dark
An insect trappеd in amber, I'm a fading high
Our heaven is a lie

Un-un-unravelling
Un-un-unravelling
Un-un-unravelling
Un-un-unravelling

Feeling the glow
Die inside of our bones
This is a hymn for our love
With no God and no throne (Un-un-unravelling)

(Un-un-unravelling)
(Un-un-unravelling)
(Un-un-unravelling)
(Un-un-unravelling)

(Un-un-unravelling)
(Un-un-unravelling)
(Un-un-unravelling)
(Un-un-unravelling)

Feeling the glow
Die inside of our bones
This is a hymn for our love
With no God and no throne (Un-un-unravelling)
No throne (Un-un-unravelling)

(Un-un-unravelling)
(Un-un-unravelling)"
"42","We Are Fucking Fucked","Muse","Will of the People","","August 26, 2022","43822","210","47","","https://genius.com/Muse-we-are-fucking-fucked-lyrics","7788592","(We play it together)

You really believe
We can survive all of this?
The black vacuum of the universe, it was designed
To swallow us whole
It's a losing game

We're at death's door, another world war
Wildfires and earthquakes I foresaw
A life in crisis, a deadly virus
Tsunamis of hate are gonna find us

Ah-ah-ah-ah-ah-ah-ah-ah
We are fucking fucked
Ah-ah-ah-ah-ah-ah-ah-ah
We are fucking fucked

We're at death's door, another world war
Wildfires and earthquakes I foresaw
A life in crisis, mutated virus
Tsunamis of hate are gonna drown us

Ah-ah-ah-ah-ah-ah-ah-ah
We are fucking fucked
Ah-ah-ah-ah-ah-ah-ah-ah
We are fucking fucked

True, just when you think
You are safe and secure
You'll forget what you need to remember, living in peace
But you're living a lie
The game is rigged

We're at death's door, another world war
Wildfires and earthquakes I foresaw
A life in crisis, mutated virus
Tsunamis of hate are gonna drown us

Ah-ah-ah-ah-ah-ah-ah-ah
We are fucking fucked
Ah-ah-ah-ah-ah-ah-ah-ah
We are fucking fucked

Hole up
Stockpile
Hoard up
We are getting fucking fucked

Ah, ah, ah-ah
We are getting fucked
Ah, ah, ah-ah
We are getting fucked

Hey, hey, hey, fuck off
Hey, hey, hey, stockpile
Hey, hey, hey, fuck off
Hey, hey, we are getting fucking fucked"
"43","Propaganda","Muse","Simulation Theory","","November 9, 2018","42864","208","49","","https://genius.com/Muse-propaganda-lyrics","3929031","Pro-pro-pro-pro-pro-pro-pro-pro-pro-pro-paganda
Pro-pro-pro-pro-pro-pro-pro-pro-propa-gan-ganda
Propa-gan ga
Propa-propa-gan-ganda
Pro-pro-pro-pro-pro-pro-pro-pro-pro-pro-ga-ga-ga-ga

Floozy
You got me trapped in your dark fantasy world
Don't you know you make me woozy?
You have me wrapped around your little finger

Baby, don't you know you can't lose
You make me offers that I can't refuse
You keep telling pretty lies
You toy with the truth
Oh you're killing me with your

Pro-pro-pro-pro-pro-pro-pro-pro-pro-pro-paganda
Pro-pro-pro-pro-pro-pro-pro-pro-propa-gan-ganda
Propa-gan ga
Propa-propa-gan-ganda
Pro-pro-pro-pro-pro-pro-pro-pro-pro-pro-ga-ga-ga-ga

Cold chick
You ate my soul just like a Death Eater
I'm the ocean, you're an oil slick
Now I am choking on your thought pollution

Baby, don't you know you can't lose
You make me offers that I can't refuse
You keep telling pretty lies
You toy with the truth
Oh you're killing me with your

Pro-pro-pro-pro-pro-pro-pro-pro-pro-pro-paganda
Pro-pro-pro-pro-pro-pro-pro-pro-propa-gan-ganda
Propa-gan ga
Propa-propa-gan-ganda
Pro-pro-pro-pro-pro-pro-pro-pro-pro-pro-ga-ga-ga-ga

Propa
Propa
Ga-ga-ganda

Can't lose
You make me offers that I can't refuse
You keep telling pretty lies, babe
Baby, don't you know you can't lose?
You make me offers that I can't refuse, yeah
You contort me with your lies, babe
Don't you know that you just can't lose?
You make me offers that I can't refuse, yeah
You keep telling pretty lies
You play with the truth
Oh you're killing me with your
Pro-pro-pro-pro-pro-pro-pro-pro-pro-pro-pro-pro-pro-pro-pro
Ga-ga-ga-ga-ga-ga-ga-ga-ga-ga-ga-ga-ga-ga-ga-ga-ganda"
"44","Blackout","Muse","Absolution XX Anniversary","","September 15, 2003","42701","67","13","","https://genius.com/Muse-blackout-lyrics","120783","Don't kid yourself
And don't fool yourself
This love's too good to last
And I'm too old to dream, yeah-yeah, ooh

Don't grow up too fast
And don't, mmm, embrace the past
This life's too good to last
And I'm too young to care, yeah-yeah, ooh

Don't kid yourself
And don't fool yourself
This life could be the last
And we're too young to see
Woah-woah-woah, mmm"
"45","Thoughts of a Dying Atheist","Muse","Absolution XX Anniversary","","September 15, 2003","42573","161","23","","https://genius.com/Muse-thoughts-of-a-dying-atheist-lyrics","120791","Eerie whispers trapped beneath my pillow
Won't let me sleep, your memories
And I know you're in this room, I'm sure I heard you sigh
Floating in between where our worlds collide

Scares the hell out of me
And the end is all I can see
And it scares the hell out of me
And the end is all I can see
Yeah-yeah, yeah-yeah, yeah-yeah, woah

And I know the moment's near
And there's nothing we can do
Look through a faithless eye
Are you afraid to die? Yeah

'Cause it scares the hell out of me
And the end is all I can see
And it scares the hell out of me
And the end is all I can see
Yeah-yeah, yeah-yeah, yeah-yeah, woah

And it scares the hell out of me
And the end is all I can see
And it scares the hell out of me
And the end is all I can see
Yeah-yeah, yeah-yeah, yeah-yeah, woah"
"46","Apocalypse Please","Muse","Absolution XX Anniversary","","September 15, 2003","40383","99","18","","https://genius.com/Muse-apocalypse-please-lyrics","87159","Declare this an emergency
Come on and spread a sense of urgency
And pull us through
And pull us through

And this is the end, the end
This is the end of the world

And it's time we saw a miracle
Come on, it's time for something biblical
To pull us through
And pull us through

And this is the end
This is the end of the world

Proclaim eternal victory
Come on and change the course of history
And pull us through
And pull us through

And this is the end
This is the end of the world"
