"number","title","artist","album","album_release_date","release_date","pageviews","word_count","line_count","featured_artists","genius_url","genius_id","lyrics"
"35","What Do You Do for Money Honey","AC/DC","Bonfire","","July 25, 1980","23961","258","44","","https://genius.com/Ac-dc-what-do-you-do-for-money-honey-lyrics","75947","You're workin' in bars, ridin' in cars
Never gonna give it for free
Your apartment with a view, on the finest avenue
Lookin' at your beat on the street
You're always pushin', shovin', satisfied with nothin'
You bitch, you must be gettin' old

So, stop your love on the road, all your diggin' for gold
You make me wonder
Yes, I wonder, I wonder

Honey
What do you do for money?
Honey
What do you do for money? Oh, where do you get your kicks?

You're lovin' on the take and you're always on the make
Squeezin' all the blood outta men
Yeah, we're standin' in a queue just to spend the night with you
It's business as usual again
You're always grabbin', stabbin', tryin' get it back in
But girl, you must be gettin' slow

So, stop your love on the road, all your diggin' for gold
You make me wonder
Yes, I wonder
Yes, I wonder

Honey
What do you do for money?
Oh, honey
What do you do for money?

Oh, what do you do for money honey? How do you get your kicks?
What do you do for money honey? How do you get your licks? Go

Yow, honey
What do you do for money?
I said, honey
What do you do for money? Oh, honey
(
Honey
) Oh, honey
What do you do for money?
(What you gotta do right now?)
(
Honey
) Oh, yeah, honey
What do you do for money?

What you gonna do?
Ah, what you gotta do?"
"36","She’s Got Balls","AC/DC","High Voltage","","February 17, 1975","22055","208","50","","https://genius.com/Ac-dc-shes-got-balls-lyrics","307355","She's got style, that woman
Makes me smile, that woman
She's got spunk, that woman
Funk, that woman
She's got speed, my lady
Got what I need, my baby
She's got the ability, hey
To make a man out of me

But most important of all
Let me tell you

The lady's got balls
She's got balls
She's got balls
She's got balls

She's got soul, my lady
Likes to crawl, my baby
All around the floor on her hands and knees
Ooh, because she likes to please me

But most important of all
Ah, let me tell you

The lady's got balls
She's got balls
She's got balls
She's got (
Balls
) balls

And she's got taste, my lady
Pace, my lady
Makes my heart race
With her pretty face
She's got balls, my lady
Likes to crawl, my lady
Hands and knees all around the floor
No one has to tell her what a feller is for

But let me tell you all
Ooh, yeah

The lady's got balls
She's got balls
She's got balls
She's got (
Balls
) balls
She's got balls, ow
She's got balls
(My lady's got)
She's got balls
(Balls)
She's got balls
(Look at her go)

She's got balls"
"37","Realize","AC/DC","POWER UP","","November 11, 2020","21582","193","46","","https://genius.com/Ac-dc-realize-lyrics","6034390","Ah-ah-ah-ah
Ah-ah-ah-ah

The moment you realize
Those moments just pass you by
Gonna take you to paradise

Move it
Make you prove it, yeah
Breakin' out, break it down
Feel the chills, feel the chills movin' down your spine

(Ah-ah)
When we recall and (Ah-ah)
Realize
Ah-ah-ah-ah
Make you realize
Ah-ah-ah-ah
I've got the power to hypnotize
Make a play, mesmerize
Feel the chills up and down your spine
I'm gonna make you fly

Your eye's playin' tricks on you
Your mind will seek the truth
You know you're gonna make it through

I said, move it
Makе you prove it, yeah
Shake it out, shakе it down
Feel the chills, feel the chills movin' down your spine

(Ah-ah)
When we recall and (Ah-ah)
Realize, hey, yeah
Ah-ah-ah-ah
Gonna make you realize
Ah-ah-ah-ah
I got the power to electrify
Make a play to satisfy
Feel a chill up and down your spine
I'm gonna make you fly
Fly, fly

When we recall and
Realize
Ah-ah-ah-ah
Gonna make you realize
Ah-ah-ah-ah
I got the power to hypnotize
Make a play, mesmerize
Feel the chills up and down your spine
I'm gonna make you fly"
"38","Shake a Leg","AC/DC","Bonfire","","July 25, 1980","20698","290","40","","https://genius.com/Ac-dc-shake-a-leg-lyrics","75953","Idle juvenile on the street, on the street
Ooh, he's kickin' everything with his feet, with his feet
Fightin' on the wrong side of the law, of the law, yeah
Don't kick, don't fight, don't sleep at night and shake a leg
Shake a leg
Shake a leg
Shake it, yeah

Keepin' out of trouble with eyes in the back of my face
Kickin' ass in the class and they tell me I'm a damn disgrace
They tell me what they think, but they stink and I really don't care
Got a mind of my own, move on, get out of my hair

Oh, shake a leg, shake your head
Shake a leg, wake the dead
Shake a leg, get stuck in
Shake a leg, shake a leg, yow

Magazines, wet dreams, dirty women on machines for me
Big licks, skin flicks, tricky dicks are my chemistry
Goin' against the grain, tryin' to keep me sane with you
So, stop your grinnin' and drop your linen for me

Oh, shake a leg, shake your head
Shake a leg, wake the dead
Shake a leg, get stuck in
Shake a leg, shake a leg

Yeah, shake it
Come on, yeah
Yow

Idle juvenile on the street, on the street
Kickin' everything with his feet, with his feet, yeah
Fightin' on the wrong side of the law, of the law, yeah
Spittin' and bitin' and kickin' and fightin' for more

Shake a leg, shake your head
Shake a leg, wake the dead
Shake a leg, get stuck in
Shake a leg, play to win
Shake a leg, shake your head
Shake a leg, wake the dead
Shake a leg, get stuck in

Shake a leg, shake a leg
Shake it, ow
Ow"
"39","Shot Down in Flames","AC/DC","Highway to Hell","","July 27, 1979","20559","210","45","","https://genius.com/Ac-dc-shot-down-in-flames-lyrics","307476","(Woah)
Woah
One, two

Out on the town, lookin' for a woman
Gonna give me good love
Anybody want to hang off of me
And give me plenty of?
She was standin' alone over by the jukebox
Like she's somethin' to sell
I said, ""Baby, what's the goin' price?""
She told me to go to hell

Shot down in flames
Shot down in flames
Ain't it a shame
To be shot down in flames?

Singles bar, got my eye on a honey
Hangin' out everywhere
She might be straight, she might want my money
I really don't care, no
Said, ""Baby, you're drivin' me crazy""
Laid it right on the line
When a guy with a chip on his shoulder said
""Toss off, buddy, she's mine""

Shot down in flames
Shot down in flames
Ain't it a shame, yeah
To be shot down in flames?

Hey, you, Angus
Shoot me, shoot

That's nice
Whoa

Oh, oh
Whoa, shot down in flames
Shot down in flames
Ain't it a shame
To be shot down in flames?
Oh, shot
Shot down in flames, ooh
Shot down in flames
Ain't it a shame
To be shot down in flames?

I don't need the pain
Don't want to be
Shot down in flames
Ow"
"40","Demon Fire","AC/DC","POWER UP","","November 13, 2020","20393","177","41","","https://genius.com/Ac-dc-demon-fire-lyrics","6033879","He loves to drive 'em crazy
With his evil lips
Great guns are blazin'
On a deadly trip

Yeah, born of no family, born of no creed
Yeah, raised by a jackal, raised a bad seed
You better look around before you hit the ground
Give me no quarrel, lives of crime

Like a devil on a deadline
Gonna send you down

Demon fire
Is all you desire
Demon fire
It glows sapphire

Seekin' out power, girl, I'll hunt you down
Boy, Lord of the Flies is gonna knock you out
You better look around, hear the evil sound?
Give me no quarrel, drenched in grime

With all the bad intentions
Gonna send you down

Demon fire
Is all you desire
Demon fire
It glows sapphire
Demon fire
Flames burn higher
Demon fire
It's an all-out hellfire

Ooh, yeah, yeah, yeah, yeah, yeah
Hey, hey, hey

Hey, demon fire
Is all you desire
Demon fire
It glows sapphire
Demon fire
Flames burn higher
Demon fire
It's an all-out hellfire

Fire, demon, fire
Fire, demon, fire
Demon fire"
"41","War Machine","AC/DC","Black Ice","","October 17, 2008","20259","186","54","","https://genius.com/Ac-dc-war-machine-lyrics","308219","Push your foot to the floor
Don't need no more
You been kickin' all 'round
While you're messin' about

Black is the name, come on in
Give me that thing
That thing gone wild

War machine (
War machine
)
War machine (
War machine
)

Make a stand, show your hand
Call in a high command
Don't think, just obey
I'm like a bird of prey

Black is the name, come on in
Give me that thing
That thing gone wild

War machine (
War machine
)
War machine (
War machine
)

Better watch your back
And cover your tracks
Kick your foot through the door
Hit the deck, know the score
They're taken by surprise
And here's mud in your eye

Misery's the name if you shoot 'em for gain
Call of the wild, huntin' for miles
That thing gone wild

War machine (
War machine
)
War machine (
War machine
), let's go

That thing gone wild

War machine (
War machine
)
War machine (
War machine
)
War machine (
War machine
)
War machine (
War machine
)"
"42","Walk All Over You","AC/DC","Highway to Hell","","July 27, 1979","20002","232","32","","https://genius.com/Ac-dc-walk-all-over-you-lyrics","307467","Out of my way, I'm a runnin' high
Take a chance with me and a-give it a try
Ain't no woman in the world don't know
'Cause I ain't lookin' for overflow
Oh, baby, I ain't got much
Resistance to your touch
Take off the high heels, let down your hair
Paradise ain't far from there

I'm gonna walk all over you (Walk all over you)
I'm gonna walk all over you (Walk all over you)
Do anythin' you want me to (
Walk all over you
), baby
I'm gonna walk all over you, oh

Reflections on the bedroom wall
And, there, you thought you'd seen it all
We're risin', fallin' like the sea
You're lookin' so good under me

I'm gonna walk all over you (Walk all over you)
I'm gonna walk all over you (Walk all over you)
Do anythin' you want me to (Walk all over you), to you
I'm gonna walk all over you

Moanin', groanin', stirrin' it up
So, gimme the stage, I'm gonna steal the show
Leave on the lace and turn off the light
Tonight is gonna be that night

I'm gonna walk all over you (Walk all over you)
I'm gonna walk all over you (Walk all over you)
Do anythin' you want me to (Walk all over you), baby

I'm gonna walk all over
You, ow
I'm gonna walk all over you"
"43","Are You Ready","AC/DC","The Razors Edge","","September 24, 1990","19947","319","43","","https://genius.com/Ac-dc-are-you-ready-lyrics","307643","Are you ready?
Are you ready?
Are you ready?
Are you ready?

Sweet apple pie, standin' in the street
Hand out of line, lookin' for some heat
She take you high when you feel her steel
She make you fly and you know you're comin'

Who all need it? Who?
Who all need it? You
(Who all need it, who all need it?) Yes, you do
You all breathe it, we all need it

Are you ready for a good time?
Then get ready for the night line
Are you ready for a good time?
Then get ready for the night line
Are you ready for a good time?

She makin' eyes at everythin' she meet
It ain't a crime when she make you pump heat
She make you fly because that's her thing
She make you dry, then you know you're broken in

(Who all need it?) You (Who all need it?), yes, you do
You all breathe it, we all need it

Are you ready for a good time?
Then get ready for the night line
Are you ready for a good time?
Then get ready for the night line
Are you ready for a good time?
Get ready

(Who all need it?) Yeah (Who all need it?)
You all breathe it, we all breathe it

Are you ready for a good time?
Then get ready for the night line
Are you ready for a good time?
Are you ready for a good time?
Are you ready for a good time? Are you ready?
(Are you ready for a good time?) I want a good time
(Are you ready for a good time?) Are you, are you ready?
(Are you ready for a good time?) Good, good, good, good time
(Are you ready for a good time?) Are you ready, ready, ready?
Are you ready for a good time?

Are you ready for a good time?
Yeah"
"44","Gone Shootin’","AC/DC","Powerage (Europe)","","May 5, 1978","18617","174","41","","https://genius.com/Ac-dc-gone-shootin-lyrics","307440","Feel the pressure rise
Hear the whistle blow
Bought a ticket of her own accord
To, I don't know
Packed her heart in a travellin' bag
I never said ""bye-bye""
Somethin' missin' in the neighbourhood
Of her cryin' eyes

I stirred my coffee with the same spoon
Knew her favourite tune

Gone shootin'
My baby's gone shootin'

Wrapped herself around
Like a second skin
Backed her favourite nag
But she could never win
I took an offer in another town
She took another pill
She was runnin' in an overdrive
A victim of overkill

She never made it past the bedroom door
What was she aimin' for?

Gone shootin'
She's gone
Gone, gone, gone

Gone shootin'
My baby's gone shootin'
And look out, woo
Gone shootin'
Oh, my baby's got a gun
Gone shootin'
Ow, look out, look out, look out
Gone shootin'
I shouldn't get in her way
Gone shootin'
Ah, she sure is loaded
She's gone (Gone shootin')
Gone, gone, gone, she's gone
Gone shootin'

(Way)
I used to love her so"
"45","Riff Raff","AC/DC","Powerage (Europe)","","May 5, 1978","18009","129","28","","https://genius.com/Ac-dc-riff-raff-lyrics","307434","See it on television every day
You hear it on the radio
It ain't humid, but it sure is hot
Down in Mexico
Authorities tryin' to tell me, haha
""Beginnin' of the end""
Sayin' it'll bend me
It's too late, my friend

Riff raff
Oh, it's good for a laugh
Ha-ha-ha
Riff raff
Go on and laugh yourself in half
Smile a while, oh

Now, I'm the kind of guy that keep his big mouth shut
It don't bother me
Somebody kickin' me when I'm up
Leave me in misery
I never shot nobody
Don't even carry a gun
I ain't done nothin' wrong
I'm just havin' fun

Riff raff
Well, it's good for a laugh
Riff raff
Go on and laugh yourself in half
(Oh)

Do it again"
"46","Stiff Upper Lip","AC/DC","Stiff Upper Lip","","February 25, 2000","16727","285","48","","https://genius.com/Ac-dc-stiff-upper-lip-lyrics","307687","Well, I was out on a drive, on a bit of a trip
Lookin' for thrills to get me some kicks
Now, I warn you ladies, I shoot from the hip
I was born with a stiff, stiff upper lip

Like a dog and I howl
I bite everything
And I'm big and I know
And I'll ball your thing

I keep a stiff upper lip
And I shoot from the hip
I keep a stiff upper lip
And I shoot, and I shoot, shoot from the hip

Yeah, I shoot from the hip
Now, listen

Well, I'm workin' it out
And I've done everything, yeah
And I can't reform, no
Can you feel my sting?

Man, I keep a stiff upper lip
And I shoot from the hip, yeah
I keep a stiff upper lip
And I shoot, and I shoot
And I shoot, shoot, shoot, yeah, shoot from the hip

Oh, yeah
Well, I'm out
Oh, yes
Yeah, yeah

Well, I'm out on the prowl, yeah
And I'll ball your thing
I got the teeth that'll bite you
Can you feel that sting?

Babe, I keep a stiff upper lip
And I shoot from the hip
I keep a stiff upper lip
And I shoot, shoot, shoot from the hip

I got a stiff upper lip, better believe me
Stiff upper lip, comin' down
Stiff upper lip
See my stiff upper lip
Yeah, I got a stiff upper lip
Stiff upper lip
I got a stiff upper lip
I got a stiff upper lip
Woah, I got a stiff upper lip
Stiff upper lip
I got a stiff upper lip

And I shoot, and I shoot
And I shoot, shoot from the hip"
"47","Squealer","AC/DC","Dirty Deeds Done Dirt Cheap (Australia)","","September 20, 1976","14740","164","51","","https://genius.com/Ac-dc-squealer-lyrics","118586","She said she'd never been
Mm, never been touched before
She said she'd never been
This far before
She said she'd never liked
Mm, to be excited
She said she always had
Had to fight it
And she never won
She said she'd never been
Never been balled before
And I don't think, hey
She'll ever ball no more
Fixed her good

Hey (Squealer), when I held her hand
(Squealer) I made her understand
(Squealer) When I kissed her lips
(Squealer) Sucked her fingertips, hey
(Squealer) Ooh, started getting hot
(Squealer) Ooh, made it hard to stop
(Squealer) Got too much
(Squealer) I think I've got a magic touch, ow

Yow, squealer
Squealer
Squealer
Squealer
Oh
Yeah
Squealer
Yeah, squealer
Ow
Squealer
Oh, yeah, squealer
Oh, squealer
Squealer
Squealer
Squealer
She was a squealer
Squealer
She likes to squeal
Squealer
I like to squeal
Squealer
She was a
Squealer, squealer, squealer
(Squealer) Squealer
Oh, yeah, squealer
She was a squealer
Squealer
Yeah, squeal
Squealer"
"48","Ballbreaker","AC/DC","Ballbreaker","","1995","14577","166","40","","https://genius.com/Ac-dc-ballbreaker-lyrics","307676","Breakin' balls, bangin' walls
Work hard and tough, and I want some rough
Unpack my bags, and take a drag
We bang on nine, and I'm dead on time

Open up the door
And lay upon the floor
She open her overcoat
Livin' out her dreams
Rippin' off my jeans

You are a ballbreaker
Ballbreaker

Engine roll, and time to go
A razorback, a hog attack
I'm buildin' steam, for whippin' cream
She likes a fat smokin' stack

Hangin' off her legs
She threw me on the bed
Her hand went for my throat
As I began to choke
""Honey, shoot your load""

You are a ballbreaker
Ballbreaker
Ballbreaker

Wreckin' ball, let it roll
You are a ballbreaker
Buildin' steam, for whippin' cream
You are a ballbreaker

Hangin' off her legs
She threw me on the bed
Her hand went for my throat
As I began to choke
""Honey, shoot your load""

You are a ballbreaker
You are a ballbreaker
Ballbreaker
Ballbreaker
Ballbreaker
Ballbreaker
Ballbreaker
Ballbreaker"
"49","Let’s Get It Up","AC/DC","For Those About to Rock (We Salute You)","","November 20, 1981","13887","242","42","","https://genius.com/Ac-dc-lets-get-it-up-lyrics","308208","My, my, my

Loose lips sink ships
So come aboard for a pleasure trip
It's high tide, so let's ride
The moon is rising and so am I

I'm gonna get it up
Never gonna let it up
Cruisin' on the seven seas
A pirate of my loving needs
I'll never go down, never go down

So let's get it up
Let's get it up, get it right up
Let's get it up, right to the top
Let's get it up, right now

Loose wires cause fires
Getting tangled in my desires
So screw him up and plug him in
Then switch it on and start all over again

I'm gonna get it up
Never gonna let it up, no
Ticking like a time bomb, ooh, yeah
Blowing out the fuse box
I'll never go down, never go down

So let's get it up
Let's get it up, get it up, oh, oh
Let's get it up, right to the top
Let's get it up, right now

Get it up
Come on, Ang
Wail

Oh, let's get it up, c'mon
Let's get it up, hey, get it, get it
Let's get it up, switch it on, start it
Let's get it up, oh, yeah, yeah
C'mon, let's get it up, yeah, yeah, yeah, yeah, ooh
Let's get it up, oh, yeah
Let's get it up, oh
Let's get it up

Get it up
Get it up
Get it up
Right up, haha"
"50","Beating Around the Bush","AC/DC","Highway to Hell","","July 27, 1979","13756","239","42","","https://genius.com/Ac-dc-beating-around-the-bush-lyrics","307473","Smilin' face and lovin' eyes
But you keep on tellin' me all those lies
How'd you expect me to believe?
Honey, I ain't that naïve
Baby, I've got my eye on you
'Cause you do all the things I want you to
Stop your cryin' and dry your tears
I ain’t that wet behind the ears

And you can throw me lefts
And you can throw me rights
But where was you last night?
Beatin' around the bush

Wish I knew what's on your mind
And why you're being so unkind
Remember those nights we spent alone
Talkin' on the telephone?
Thoughts of you go through my brain
Told me that you felt the same
Don't say that you love me too
Tell me, who would lie with you?

I was talkin' birds
And you was talkin' bees
Or was he down upon his knees?
Beatin' around the bush
Ow

You're the meanest woman I've ever known
Sticks and stones won't break my bones
I know what you're lookin' for
You've eaten your cake, you want some more
I'm gonna give you just one more chance
Try to save our romance
Done everythin' I'm gonna do
The rest is up to you

And you can chew it up
And you can spit it out
Let it all hang out
Beatin' around the bush
Ow

Chew it up
Spit it out
Let it all hang out
Beatin' around the bush"
