"number","title","artist","album","album_release_date","release_date","pageviews","word_count","line_count","featured_artists","genius_url","genius_id","lyrics"
"18","Live Wire","AC/DC","T.N.T.","","December 1, 1975","48450","250","45","","https://genius.com/Ac-dc-live-wire-lyrics","307341","Well, if you're lookin' for trouble
I'm the man to see
If you're lookin' for satisfaction
I'm satisfaction guaranteed

I'm as cool as a body on ice
Hotter than the rollin' dice
Send you to heaven, take you to hell
I ain't foolin', can't you tell?

I'm a live wire
I'm a live wire
I'm a live wire
Going to set this town on fire

And if you need some lovin'
And if you need some man
You've got the phone and the number
And I got no future plans

Oh, come on, honey, you've got nothin' to lose
You got the thirst, and I've got the booze
Give you an inch, take you a mile
I want to make you fry

I'm a live wire (Live wire)
I'm a live wire (Live wire)
I'm a live wire, oh (Live wire)
Holy smoke and sweet desire

Like a hot rod, baby
Oh, stick this in your fuse box

Ah
Cooler than a body on ice
Hotter than the rollin' dice
Wilder than a drunken fight
You're gonna burn tonight

I'm a live wire (Live wire)
I'm a live wire (Live wire)
I'm a live wire (Live wire)
And I'm gonna set this town on fire
Live wire (Live wire)
I'm a live wire (Live wire)
Well, I'm your live wire (Live wire)
I'm a live wire (Live wire)

Look at me burn
Ow, look at me
Meltin'
Short my circuit, ooh
Ooh, yeah
Burn, burn, burn, burn, burn, burn, burn"
"19","For Those About to Rock (We Salute You)","AC/DC","For Those About to Rock (We Salute You)","","November 20, 1981","44639","291","55","","https://genius.com/Ac-dc-for-those-about-to-rock-we-salute-you-lyrics","234867","Oh, yeah, yeah
Woah, oh
Oh, oh
We roll tonight
To the guitar bite
Yeah, yeah
Ow

Stand up and be counted
For what you are about to receive
We are the dealers
We'll give you everything you need
Hail-hail to the good times
'Cause rock has got the right of way
We ain't no legend, ain't no cause
We're just livin' for today

For those about to rock, we salute you
For those about to rock, we salute you

We rock at dawn, on the front line
Like a bolt right out of the blue
The sky's alight with the guitar bite
Heads will roll and rock tonight

For those about to rock, we salute you
For those about to rock, we salute you
For those about to rock, we salute you, yes, we do
For those about to rock, we salute you, ah
Oh, salute

Oh, yeah
Oh, yes
On it
Load up

We're just a battery for hire with a guitar fire
Ready and aimed at you
Pick up your balls and load up your cannon
For the twenty-one-gun salute

For those about to rock, fire, we salute you
Oh, for those about to rock, we salute you
Oh, those about to rock, fire, we salute you
Oh, fire
We salute you
We salute you
Come on
Oh

For those about to rock, we salute you
For those about to rock (Yeah), we salute you
For those about to rock (Ayy), we salute you
For those about to rock, oh, we salute you

Shoot, shoot
Shoot, shoot
Oh, for those who give and those who take
Doing your time and those on the rank
We salute you, yeah
We salute you
We salute you
We salute you
Fire"
"20","Touch Too Much","AC/DC","Highway to Hell","","July 27, 1979","44104","322","58","","https://genius.com/Ac-dc-touch-too-much-lyrics","307468","It was one of those nights when you turn off the lights
And everythin' comes into view
She was takin' her time, I was losing my mind
There was nothin' that she wouldn't do

It wasn't the first, it wasn't the last
She knew we was makin' love
I was so satisfied deep down inside
Like a hand in a velvet glove

Seems like a touch
A touch too much
Seems like a touch
A touch too much
Too much for my body, too much for my brain
This damn woman's gonna drive me insane
She got a touch
A touch too much
Yeah

Oh, she had the face of an angel, smilin' with sin
A body of Venus with arms
Dealin' with danger strokin' my skin
Like a thunder and lightnin' storm

It wasn't the first, it wasn't the last
It wasn't that she didn't care
She wanted it hard and wanted it fast
She liked it done medium rare

Seems like a touch
A touch too much
Seems like a touch
A touch too much
Too much from my body, too much from my brain
This damn woman's going to drive me insane
She got a touch
A touch too much
Touch me

Seems like a touch (Touch too much)
You know it's much too much (Much too much)
I really want to feel you (Touch too much)
Girl, you know you're givin' me (Much too much)
Oh, seems like a touch
Just a dirty little touch
I really need your touch
'Cause you're much too much, too much, too much

Seems like a touch
A touch too much
Seems like a touch
A touch too much
Givin' me a touch
A touch too much
Baby got a touch
A touch too much
Seems like a touch
A touch too much
A touch too much
A touch too much
A touch too much

Touch
Come on, touch me
Yeah, ah"
"21","Problem Child","AC/DC","Dirty Deeds Done Dirt Cheap (Australia)","","September 20, 1976","41930","290","66","","https://genius.com/Ac-dc-problem-child-lyrics","118584","Cop this

I'm hot and when I'm not
I'm cold as ice
Get out my way
Just step aside or pay the price

What I want, I take, what I don't, I break
And I don't want you
With a flick of my knife, I can change your life
There's nothin' you can do

I'm a problem child
I'm a problem child, yes, I am
I'm a problem child
And I'm wild

Make my stand, no man's land
On my own
Man in blue, it's up to you
The seed is sown

What I want, I stash, what I don't, I smash
And you're on my list
Dead or alive, I got a .45
And I never miss

Oh, I'm a problem child
Ayy, I'm a problem child
Oh, I'm a problem child
Just runnin' wild
Haha

Just watch your step

Every night, street alight
I drink my booze
Some run, some fight
But I win, they lose

What I need, I like, what I don't, I fight
And I don't like you
Say ""bye-bye"" while you're still alive
Your time is through

'Cause I'm a problem child
Oh, I'm a problem child
I'm a problem child
I'm a problem child
Problem child
I'm a problem child, even my mother hates me
I'm a problem child, all right
I'm a problem child, hey, yeah

Problem child
Problem child
Problem child
Problem child
You've got your troubles, I've got mine
Problem child
Problem child
Problem child
Problem child
Yeah, problem child
I'm a problem child
Problem child
And I'm a problem (Problem child), like a child
Problem child
Problem child
Problem child
I'm Problem child
I'm a problem child (Problem child)
Problem child
Problem child
Problem child
Problem child
Problem child"
"22","Who Made Who","AC/DC","Who Made Who","","May 24, 1986","41189","234","38","","https://genius.com/Ac-dc-who-made-who-lyrics","307558","The video game say ""Play me""
Face it on a level, but it take you every time on a one-on-one
Feelin' runnin' down your spine
Nothin' gonna save your one last dime, 'cause it own you
Through and through
The databank know my number
Says I got to pay 'cause I made the grade last year
Feel it when I turn the screw
Kick you 'round the world, there ain't a thing that it can't do
Do to you, yeah

(Who made who?) Who made you?
(Who made who?) Ain't nobody told you?
(Who made who?) Who made you?
If you made them and they made you
Who picked up the bill and who made who?
Yeah
Who made who?
Who turned the screw?

Yeah
Yeah, ooh, yeah

Yeah, satellites send me picture
Get it in the aisle, take it to the wall
Spinnin' like a dynamo
Feel it goin' 'round and 'round
Runnin' outta chips, you got no line in an 8-bit town
So don't look down, no

(Who made who?) Who made you?
(Who made who?) Ain't nobody told you?
(Who made who?) Who made you?
If you made them and they made you
Who picked up the bill and who made who?

Ain't nobody told you?
Oh, who made who?
Who made you?
Who made who?

(Who made who?) And who made who?
(Who made who?) Yeah
Oh, nobody told you"
"23","Rock and Roll Ain’t Noise Pollution","AC/DC","Bonfire","","July 25, 1980","36405","275","45","","https://genius.com/Ac-dc-rock-and-roll-aint-noise-pollution-lyrics","75954","Alright
Hey there, all you middle-men
Throw away your fancy clothes
And while you're out there sittin' on a fence
So get off your ass and come down here
'Cause rock and roll ain't no riddle, man
To me, it makes good, good sense
Good sense, yeah, let's go
Ow
Ooh, yes

Heavy decibels are playin' on my guitar
We got vibrations comin' up from the floor
We're just listenin' to the rock that's givin' too much noise
Are you deaf? You wanna hear some more?

We're just talkin' 'bout the future
Forget about the past
It'll always be with us
It's never gonna die, never gonna die

Rock and roll ain't noise pollution
Rock and roll ain't gonna die
Rock and roll ain't noise pollution
Rock and roll, it will survive
Yes, it will, haha

I took a look inside your bedroom door
You looked so good lyin' on your bed
When I asked you if you wanted any rhythm and love
You said, ""You wanna rock and roll instead?""

We're just talkin' 'bout the future
Forget about the past
It'll always be with us
It's never gonna die, never gonna die

Rock and roll ain't noise pollution
Rock and roll ain't gonna die
Rock and roll ain't no pollution
Rock and roll, it's just rock and roll

Oh, rock and roll ain't noise pollution
Rock and roll ain't gonna die
Rock and roll ain't no pollution
Rock and roll, it will survive
Rock and roll ain't noise pollution
Rock and roll, it'll never die
Rock and roll ain't no pollution

Rock and roll
Ah, rock and roll
Is just rock and roll, yeah"
"24","If You Want Blood (You’ve Got It)","AC/DC","Iron Man 2","","July 27, 1979","35459","297","74","","https://genius.com/Ac-dc-if-you-want-blood-youve-got-it-lyrics","307482","It's criminal
There ought to be a law
Criminal
There ought to be a whole lot more
You get nothin' for nothin'
Tell me, who can you trust?
We got what you want
And you've got the lust

If you want blood
You got it
If you want blood
You got it
Blood on the streets, blood on the rocks
Blood in the gutter, every last drop
You want blood
You got it
Yes, you have

It's animal
Livin' in a human zoo
Animal
The shit that they toss to you
Feelin' like a Christian
Locked in a cage
Thrown to the lions
On the second page

If you want blood
You got it
If you want blood, you got it
Blood on the streets, blood on the rocks
Blood in the gutter, every last drop
You want blood
You got it

Oh
O positive

Oh
Yeah, yeah
Woah

Blood on the rocks
Blood on the streets
Blood in the sky
Blood on the sheets
If you want blood
You got it

I want you to bleed for me
Sss-yeah

If you want blood,
you got it
If you want blood,
you got it
If you want blood,
you got it
If you want blood,
you got it
If you want blood, you got it
If you want blood, you got it
If you want blood, you got it
If you want blood, you got it
(Oh)
If you want blood, you got it
(Yow)
If you want blood
(Blood, blood),
you got it
(Blood, blood)
If you want blood
(Blood),
you got it
If you want blood,
you got it
If you want blood, you got it
If you want blood, you got it
Oh, if you want blood,
you got it
If you want blood"
"25","Let Me Put My Love Into You","AC/DC","Bonfire","","July 25, 1980","32339","246","45","","https://genius.com/Ac-dc-let-me-put-my-love-into-you-lyrics","75950","Flyin' on a free flight
Drivin' all night
With my machinery
'Cause I, I got the power, any hour
To show the man in me
And those reputations, blown to pieces
With my artillery
I'll be guidin' and we'll be ridin'
Give a-what you got to me

Don't you struggle
Don't you fight
Don't you worry
'Cause it's your turn tonight

Let me put my love into you, babe
Let me put my love on the line
Let me put my love into you, babe
Let me cut your cake with my knife, oh

Oh, like a fever, burnin' faster
You spark the fire in me
Crazy feelings got me reelin'
They got me raisin' steam

Now, don't you struggle
Don't you fight
Don't you worry
'Cause it's your turn tonight, yeah

Let me put my love into you, babe
Let me put my love on the line
Let me put my love into you, babe
Let me cut your cake with my knife
Oh
Cut it

Let me
Let me

Oh, let me put my love into you, babe
Let me put my love on the line
Let me put my love into you, babe
Let me cut your cake with my knife
Oh, let me put my love into you, babe
Let me put my love on the line
Let me put my love into you, babe

Let me give it all
Let me give it all
To you
To you
Give it all"
"26","Sin City","AC/DC","Powerage (Europe)","","May 5, 1978","31640","155","46","","https://genius.com/Ac-dc-sin-city-lyrics","307436","Diamonds and dust
Poor man last
Rich man first
Lamborghinis
Caviar
Dry martinis
Woo, Shangri-La

I got a burnin' feelin'
Deep inside of me
It's a-yearnin'
But I'm gonna set it free

I'm goin' in
To Sin City
I'm gonna win
In Sin City
Where the lights are bright
Do the town tonight
I'm gonna win
In Sin City

Oh, let me roll you baby, yeah
Should we die
Oh

Ladders
And snakes
Ladders give
Snakes take
Rich man, poor man
Beggar man, thief
Ain't got a hope in hell
That's my belief
Fingers Freddy
Diamond Jim
They're gettin' ready
Look out, I'm comin' in

So spin that wheel, cut that pack
And roll those loaded dice
Bring on the dancin' girls
And put the champagne on ice

I'm goin' in
To Sin City
I'm gonna win
In Sin City
Where the lights are bright
Do the town tonight
I'm goin' in
To Sin City"
"27","Through the Mists of Time","AC/DC","POWER UP","","November 13, 2020","31073","194","38","","https://genius.com/Ac-dc-through-the-mists-of-time-lyrics","6033882","See dark shadows on the walls
See the pictures
Some hang, some fall
And the painted faces all in a line

And the painted ladies
Yeah, the painted ladies

Through the mists of time (Ah, ah)
Mists of time (Ah, ah)
Of the restless kind (Ah, ah)
Through the mists of time
On a magic ride
Through the mists of time (Ah, ah)
Ah, ah

Hear the whisper of the whirlwind
Monster shadows
A light gone dim
Dark horses roam in my sleep
Mystic voices conjure up our dreams

And the painted ladies
Yeah, the painted ladies

Through the mists of time (Ah, ah)
Mists of time (Ah, ah)
Of the restless kind (Ah, ah)
Through the mists of time
On a magic ride
Through the mists of time

Ah, ah
Ah, ah
And the painted faces (Ah, ah)
Lookin' so divine (Ah, ah)

Through the mists of time (Ah, ah)
Mists of time (Ah, ah)
Of the restless kind (Ah, ah)
Through the mists of time (Ah, ah)
On a magic ride (Ah, ah)
Searchin' for a sign (Ah, ah)
Through the mists of time (Ah, ah)
The mists of time, time (Ah)"
"28","Ride On","AC/DC","Bonfire","","September 20, 1976","30969","286","49","","https://genius.com/Ac-dc-ride-on-lyrics","118588","It's another lonely evenin'
In another lonely town
But I ain't too young to worry and I ain't too old to cry
When a woman gets me down
Got another empty bottle
Mm, and another empty bed
Ain't too young to admit it and I'm not too old to lie
I'm just another empty head

Mm, that's why I'm lonely
I'm so lonely
But I know what I'm gonna do

I'm gonna ride on
Ride on
(Ride on) Standin' on the edge of the road
(Ride on) Thumb in the air
(Ride on) One of these days, I'm gonna
(Ride on) Change my evil ways, ha
Till then, I'll just keep
Ridin' on

Broke another promise
Now I broke another heart
But I ain't too young to realize that I ain't too old to try
Try to get back to the start
And it's another red-light nightmare
Woah, and another red-light street
And I ain't too old to hurry, 'cause I ain't too old to die
But I sure am hard to beat

But I'm lonely
Lord, I'm lonely
What am I gonna do?

Ride on
(Ride on) Got myself a one-way ticket
Ride on
(Ride on) Goin' the wrong way
(Ride on) Gonna change my evil ways
(Ride on) One of these days
One of these days

Ride on
Ride on
I'm gonna ride on
(Ride on) Mm, lookin' for a truck
(Ride on) Mhm
(Ride on) Keep on ridin'
Ridin' on and on and on and on and on and on and on (Ride on)
(Ride on) Gonna have myself a good time
(Ride on) Mm, yeah
(Ride on) Ride, ride, ride
(Ride on) One of these days
(Ride on) One of these days"
"29","Hell Ain’t a Bad Place to Be","AC/DC","Iron Man 2","","March 21, 1977","30263","201","34","","https://genius.com/Ac-dc-hell-aint-a-bad-place-to-be-lyrics","307449","Hey, you
Yeah, you

Sometimes I think this woman is kinda hot
Sometimes I think this woman is sometimes not
Puts me down, fool me around
Why she do it to me?
Out for satisfaction, any piece of action
That ain't the way it should be

She needs lovin', knows I'm the man
She's gotta see
Pours my beer, licks my ear
Brings out the devil in me
Hell ain't a bad place to be

Spends my money, drinks my booze
Stays out every night
But I got to thinkin', ""Hey, just a minute
Somethin' ain't right""
Oh, disillusions and confusion
Make me wanna cry
All the shame, you playin' your games
Tellin' me those lies

Don't mind her playin' demon
As long as it's with me
If this is hell, then let me say
It's heavenly
Hell ain't a bad place to be

End of the night, turns down the light
Closes up on me
Opens my heart, tears it apart
Brings out the devil in me
Hell ain't a bad place to be
I said, Hell ain't a bad place to be
Hell ain't a bad place to be
You know that hell ain't a bad place to be"
"30","Rock N’ Roll Train","AC/DC","Black Ice","","October 17, 2008","29987","292","54","","https://genius.com/Ac-dc-rock-n-roll-train-lyrics","291497","One hot angel
One cool devil
Your mind on the fantasy
Livin' on the ecstasy
Give it all, give it, give it what you got
Come on, give it all the lot
Pick it up, move it, give it to the spot

Your mind on a fantasy, livin' on ecstasy

Runaway train
Runnin' right off the track
Runaway train
Runnin' right off the track
Runaway train
Runnin' right off the track
Down the runaway train
Runnin' right off the track

One hard ring a bell
Old school rebel
A ten for the revelry
Jammin' up the agency
Shake it, shake it, take it to the spot
You know, she make it really hot
Give it all, give it up, come, on give it all you got

Your mind on a fantasy, livin' on the ecstasy

Runaway train
Runnin' right off the track
Oh, the runaway train, yeah
Runnin' right off the track
I'm on the runaway train
Runnin' right off the track
Runaway train
Runnin' right off the track

God, yeah

One hot southern belle
Son of a devil
A school boy's spellin' bee
A school girl with a fantasy
One hard ring a bell
Old school rebel
It's a ten for the revelry
Jammin' up the agency
Shake it, take it, take it to the spot
You know, she make it really hot, yeah
Give it all, give it up, come on, give it what you got
You know she's just like it

Runaway train
(Runnin' right off the track) She's comin' off the track now
Runaway train, yeah
Runnin' right off the track

Give it all, give it up, come on, give it what you got
Runaway train
Runnin' right off the track
Runaway train
Runnin' right off the track"
"31","Girls Got Rhythm","AC/DC","Highway to Hell","","July 27, 1979","29006","273","62","","https://genius.com/Ac-dc-girls-got-rhythm-lyrics","307464","I've been around the world
I've seen a million girls
Ain't one of them got
What my lady, she's got
She's stealin' the spotlight
Knocks me off my feet
She's enough to start a landslide
Just a-walkin' down the street

Wearin' dresses so tight
And lookin' dynamite
About to blow me out
No doubt about it, can't live without it

The girl's got rhythm (
Girl's got rhythm
)
The girl's got rhythm (
Girl's got rhythm
)
She's got the backseat rhythm (
Backseat rhythm
)
The girl's got rhythm, oh

She's like a lethal brand
Too much for any man
She give me first degree
She really satisfy me
Love me till I'm limbless
Achin' and sore
Enough to stop a freight train
Or start the Third World War

You know I'm losin' sleep
But I'm in too deep
Like a body needs blood
No doubt about it, can't live without it

The girl's got rhythm (
Girl's got rhythm
)
The girl's got rhythm (
Girl's got rhythm
)
She's got the backseat rhythm (
Backseat rhythm
)
The girl's got rhythm, ow

You know she move like sin
And when she let me in
It's like liquid love
No doubt about it, can't live without it

The girl's got rhythm (
Girl's got rhythm
)
The girl's got rhythm (
Girl's got rhythm
)
She's got the backseat rhythm (
Backseat rhythm
)
The girl's got rhythm (Girl's got rhythm)
You know she really got the rhythm (Girl's got rhythm)
She's got the backseat rhythm (Backseat rhythm)
Rock and roll rhythm (Rock and roll rhythm)
The girl's got rhythm"
"32","Jailbreak","AC/DC","Dirty Deeds Done Dirt Cheap (Australia)","","June 14, 1976","28309","221","55","","https://genius.com/Ac-dc-jailbreak-lyrics","118589","There was a friend of mine on murder
And the judge's gavel fell
Jury found him guilty
Gave him sixteen years in hell
He said, ""I ain't spendin' my life here
I ain't livin' alone
Ain't breakin' no rocks on the chain gang
I'm breakin' out and headin' home""
Gonna make a
jailbreak
And I'm lookin' towards the sky
I'm gonna make a
jailbreak
Oh, how I wish that I could fly

All in the name of liberty
All in the name of liberty
Got to be free

Jailbreak
Let me outta here
Jailbreak
Sixteen years
Jailbreak
Had more than I can take
Jailbreak
Yeah

He said he'd seen his lady bein' fooled with
By another man
She was down and he was up
Had a gun in his hand
Ah, the bullets started flyin' everywhere
People start to scream
Big man lyin' on the ground
With a hole in his body where his life had been

But it was all in the name of liberty
All in the name of liberty
I got to be free

Jailbreak
Jailbreak, I got to break out
Out of here

Heartbeats, they were racin'
Freedom, he was chasin'
Spotlights, sirens
Rifles firin'
But he made it out
With a bullet in his back

Jailbreak
Jailbreak
Jailbreak
Jailbreak (Ha-ha-ha-ha-ha-ha)
Jailbreak
Jailbreak
Jailbreak
Jailbreak
Jailbreak
Jailbreak"
"33","High Voltage","AC/DC","Backtracks","","June 23, 1975","27640","225","43","","https://genius.com/Ac-dc-high-voltage-lyrics","307360","Well, you ask me 'bout the clothes I wear
And you ask me why I grow my hair
And you ask me why I'm in a band
I dig doin' one night stands
And you want to see me doin' my thing
All you got to do is plug me in

To high
I said, ""High""

High voltage rock 'n' roll
High voltage rock 'n' roll
High voltage, high voltage
High voltage rock 'n' roll

Well, you ask me why I like to dance
And you ask me why I like to sing
And you ask me why I like to play
I got to get my kicks some way
And you ask me what I'm all about
Come on, let me hear you shout

High
I said, ""High""

High voltage rock 'n' roll
High voltage rock 'n' roll
High voltage, high voltage
High voltage rock 'n' roll

Rock 'n' roll

I said, ""High""
I said, ""High"", oh

High voltage rock 'n' roll
High voltage rock 'n' roll
High voltage, high voltage
High voltage rock 'n' roll

Stars, bulbs all around the spotlight
Put the lights out, turn me on

High voltage rock 'n' roll
High voltage rock 'n' roll
Wine, women and song
High voltage
(
High voltage
) Plugged in and turned on
It's sparkin', man (
High voltage rock 'n' roll
)"
"34","Night Prowler","AC/DC","Highway to Hell","","July 27, 1979","25456","309","57","","https://genius.com/Ac-dc-night-prowler-lyrics","307487","Somewhere, a clock strikes midnight
And there's a full moon in the sky
You hear a dog bark in the distance
You hear someone's baby cry
A rat runs down the alley
And a chill runs down your spine
And someone walks across your grave
And you wish the sun would shine
'Cause no one's gonna warn you
And no one's gonna yell ""attack""
And you don't feel the steel
Till it's hangin' out your back

I'm your night (Night) prowler
I sleep in the day
Night (Night) prowler
Get out of my way
Yeah, I'm the night (Night) prowler
Watch out tonight
Yes, I'm the night (Night) prowler
When you turn out the light, oh

Too scared to turn your light out
'Cause there's somethin' on your mind
Was that a noise outside the window?
What's that shadow on the blind?
As you lie there naked
Like a body in a tomb
Suspended animation
As I slip into your room

I'm your night (Night) prowler
I sleep in the day
Yeah, I'm the night (Night) prowler
Get out of my way
Look out for the night (Night) prowler, haha
Watch out tonight
Yes, I'm the night (Night) prowler
When you turn out the light

Oh
Oh

I'm your night (Night) prowler
I sleep in the day
Yes, I'm the night (Night) prowler
Get out of my way
Look out for the night (Night) prowler, ow
Watch out tonight
Yes, I'm the night (Night) prowler
When you turn out the light
I'm your night (Night) prowler, oh
Break down your door
I'm your night (Night) prowler
Crawlin' cross your floor
Yeah, I'm out for the night (Night) prowler
Make a mess of you (Yes, I will)
Night (Night) prowler

And I'm tellin' this to you, there ain't nothin'
There ain't nothin', oh
Nothin' you can do
""Shazbot, nanu nanu"""
